City,Datetime,Tweet Id,Text,Username
Darwin,2020-03-10 23:48:59+00:00,1237525893410508801,"Everyone with a complex condition knows the Australian health system is in no way prepared. It can’t deal with us effectively NOW, never mind during a pandemic. 
#COVID19 #covid19australia https://t.co/Jv6L22vtip",RubyTombstone
Darwin,2020-03-10 07:37:56+00:00,1237281519820914690,"For most people, #COVID19 is a mild flu. That’s great - if you don’t have a complex condition &amp; can take antibiotics. If people panicking means I don’t need to spend another day in an office where 50% of my colleagues have upper respiratory infections.. (1/2)",RubyTombstone
Darwin,2020-03-09 08:45:16+00:00,1236936076427530240,Bloody good point made on #thedrum - Where IS the government public health campaign? They were quick enough to self promote during the #australianbushfires . #ScottyFromMarketingFAIL #ScottyFromMarketing #COVID2019 #COVID19 #coronavirus #ABC,RubyTombstone
Darwin,2020-03-08 05:36:08+00:00,1236526091348488192,"@healthcommphd I’ll applaud if and when I get through the next few months. For those of us with complex chronic conditions, this is a scary time. And there are too many red flags. I showed up at my GP (after calling ahead) with flu symptoms, and he didn’t even consider #COVID19 or the risks.",RubyTombstone
Darwin,2020-03-08 05:31:12+00:00,1236524848869863424,#COVID19 #coronavirus #coronavirusaustralia #auspol #ScottyFromMarketing #publichealth,RubyTombstone
Darwin,2020-03-08 05:25:24+00:00,1236523389231042561,"When experts and officials are doing media on #COVID19 , telling people it’s all okay because for normal people it’s just a mild flu - can you please try &amp; remember just how many of us there actually are with existing complex and/or chronic conditions? You’re not fucking helping.",RubyTombstone
Darwin,2020-03-03 14:08:33+00:00,1234843106547077121,@TheNTNews Is there a correlation in the NT between absence of covid19 and ready availability of toilet paper 🤔🤔🤔,jamaora
Darwin,2020-03-01 02:48:44+00:00,1233947250490888194,"Did Annastacia Palaszczuk just use the word “appleculture”? Is that a thing? Did she invent a new word? Am I going nuts? So many questions. 
#COVID19 #auspol #abcnews #CoronaVirusUpdate",RubyTombstone
