City,Datetime,Tweet Id,Text,Username
Canberra,2020-09-02 07:10:32+00:00,1301054888235823104,@wozzak Good movie.. meaning .. lockdown is nearly over ... hopefully,MrBaird72
Canberra,2020-09-01 09:31:20+00:00,1300727932051099648,@kels_316 @stilgherrian I actively deleted mine in early lockdown. I felt like I missed it for about two days.,trib
Canberra,2020-08-30 22:15:06+00:00,1300195366244028417,He also attempts to equate a 12-month extension to a state of emergency as a 12-month lockdown.,BradleyTemperl1
Canberra,2020-08-29 08:25:58+00:00,1299624319564173313,@SueFarroukh I still feel your pain. During lockdown i had a hypertensive crisis &amp; 3 micro haemorrhages in my brain   I'm being checked for an adrenal tumour &amp; trying so hard to get back to it all &amp; be normal.  Its so hard!,BelindaTeaches
Canberra,2020-08-29 02:01:20+00:00,1299527522304978944,Love this from senior law enforcement in Melbourne commenting on the lockdown in Victoria. https://t.co/HHNwgjyahe,PaulMaddison7
Canberra,2020-08-28 07:22:39+00:00,1299245998389125121,@VLXCAT Aren't you in lockdown? Everyone's unattainable,MuffinManifesto
Canberra,2020-08-26 17:00:01+00:00,1298666521707737091,How is everyone doing lately?! Hope everyone is doing ok with Lockdown/restrictions and all! If anyone ever needs a chat my DM’s are open,jphillipsmusic1
Canberra,2020-08-23 00:52:44+00:00,1297335931540664326,"With apologies to those in #lockdown, it’s a morning tea in a #cafe while playing #UNO kind of morning here #weekendvibes #cardgames https://t.co/Ldu4JsuSNs",Josh_B_Rosner
Canberra,2020-08-19 22:23:28+00:00,1296211205615280129,"@Sue_Webeck with 1 in 20 women suffering abuse during lockdown @ourANU needs to counsel and retrain all male managers to recognise signs of abuse in their staff. Budget cuts and redundancies are amplifying fears at home, and impacting negotiations at work.",AMcFeeters
Canberra,2020-08-19 00:00:59+00:00,1295873359775842305,@pinkybarks The numbers continue to look good in Victoria so crossing fingers and toes that the lockdown will end as scheduled and you can go out and fully enjoy spring. If your weather is like Canberra today you'll probably be glad to stay inside,LizDolphinfluff
Canberra,2020-08-18 09:28:39+00:00,1295653826922287106,"@ZeinaChalich Ah i had explosively high BP during lockdown, 3 micro haemorrhages in my brain &amp; now have specialists coming out ny ears! What helps? Waking up, putting a smile on my face &amp; going to school &amp; seeing every student",BelindaTeaches
Canberra,2020-08-16 17:13:48+00:00,1295046112412221441,"@KristyMcBain @AWMemorial @ShayneNeumannMP I’ll be remembering my 96 year old Uncle Bruce - this is him in his driveway during lockdown on ANZAC Day 2020, Manly Vale NSW.  Bless. #VPDay2020 https://t.co/yckyYtAt8J",Elllsee
Canberra,2020-08-15 12:06:52+00:00,1294606481539571713,"@jo_mercuri Thank you - good days are a blessing and for bad days there are puppers and lovely people on Twitter

How are you going on lockdown? So good to see things improving 🌺",LizDolphinfluff
Canberra,2020-08-14 08:32:13+00:00,1294190077174661120,"""God give me the confidence of a mediocre white man""

- me every time I see/hear/read Simon Cowan

(And no the whole of NZ is not going into ""hard"" lockdown you numpty) https://t.co/4bnBJV6z10",LizDolphinfluff
Canberra,2020-08-11 04:31:31+00:00,1293042337602445312,Quite the contrast from the lockdown #Australia has imposed in Melbourne #COVID19Vic #COVID19 https://t.co/8RNflMheDe,Nicola_Gage
Canberra,2020-08-11 04:12:58+00:00,1293037667932807169,@nobby15 Did this for lockdown in Term Two but in Canberra it was too cold in the van; but yes great solution and since we won’t be taken out anytime soon...,KimFraser62
Canberra,2020-08-11 00:09:47+00:00,1292976468599820288,Tone deaf... Response to a Dr fined for parking outside of the hospital she was working in during the current lockdown. As though she has time for this bureaucracy! https://t.co/RIoza1JeYd,davidriddel
Canberra,2020-08-09 01:15:30+00:00,1292268233056063490,"I’m sorry to those still in lockdown, but lovely breakfast out this morning without the child #baconandeggroll https://t.co/ItHKnle5EN",Josh_B_Rosner
Canberra,2020-08-07 12:28:56+00:00,1291712932032593921,"You hve put other ""comedy lockdown specials"" to shame. https://t.co/bNGoYdCagZ",AMcFeeters
Canberra,2020-08-07 12:19:49+00:00,1291710635747627008,@MrJoshEarl i hope #DYKWIA continues online beyond lockdown. Ive been in physical rehab for over a year and you have provided pure joy and company on Saturday arvos. Thankyou for your commitment to an anonymous audience.,AMcFeeters
Canberra,2020-08-07 00:32:13+00:00,1291532566336376832,"Please re-tweet to help my student with recruitment!

Have you attended, hosted or performed at an online nightlife event? Eliza is looking at how online nightlife is created/experienced during lockdown &amp; she’d love to speak with you! Contact: u5561105@anu.edu.au for more info! https://t.co/KIKMdUmZaZ",gavin_jd_smith
Canberra,2020-08-06 01:36:50+00:00,1291186439049248770,PM Scott Morrison has asked nation’s top mental health representatives to work with Victorian counterparts to support the wellbeing of Victorians in the lockdown. Says mental health and suicide prevention among government’s highest priorities. @theheraldsun #auspol https://t.co/b9JtTja4kT,tamsinroses
Canberra,2020-08-05 09:26:20+00:00,1290942204429533185,@maddythecatlady @thosearemysocks @mathaiaus You need to give them a bonus chapter...Phil returns home just before lockdown hours with the wrong Pringles flavour and ginned up Theresa puts the tube......,AusLoafer
Canberra,2020-08-05 09:00:06+00:00,1290935603048013824,"Hot debate topic in tonight's Eriksen lockdown weekly chat ""what's the best apple"" mum 1 fuji 2 envy 3 jazz, sister 1 jazz 2 pink lady 3 fuji, parter 1 jazz/granny smith, dad 1 pineapple 🙃",yeneriksen
Canberra,2020-08-05 01:01:18+00:00,1290815105815339015,What a selfish self-centred man is Jim Penman of @JimsMowing1 #CovidVic instead of a fine he should be hauled before a court for inciting people to break the law “Jim's Mowing to defy lockdown “https://t.co/ah2xMgujNJ,DavidSavage63
Canberra,2020-08-04 14:12:05+00:00,1290651726006095873,Pandemic Project: What to do instead of reorganising my chaotic #PhD readings #lockdown #fashion #procrastination #neurology #anatomy #evolution #archeology #paleotology #paleoanthropology #primatology https://t.co/u49srY5V8d,PalaeoNeuro
Canberra,2020-08-04 00:06:58+00:00,1290439044934115329,"I’m thinking of my friends, family, colleagues and everyone in lockdown in Victoria &amp; around the world and want to send you all some Happiness at this difficult time. 

Music will get us through!

Felicidade from my @ABCClassic album Songs of Yesterday

https://t.co/8b4E6nPkUe",austguitarist
Canberra,2020-08-03 06:17:24+00:00,1290169881527107584,"@ananavarro This is why the USA is such a Dark colour on this map.
And 9 X worse than Australia on these charts.
FYI we are in lockdown not opening up. https://t.co/CzZQPhBIa4",mrgarymatthews
Canberra,2020-08-03 02:55:26+00:00,1290119053164462080,"I wish it was illegal for you to expose your STUPITITY . What is wrong with you ? Maybe a class action suing some of you anti lockdown , anti maskers might stop you from putting your own community at risk . Go play with your teddy kiddy ! Leave the adults to get on with it! https://t.co/ImWrhYLQci",Kay1Denise
Canberra,2020-08-02 12:34:34+00:00,1289902409087455232,There are thick #Covid_19 clouds hovering over @Australia &amp; it's our duty to follow the rules &amp; consider others as we all are in this together. @Melbourne we all are by your side and can't wait for these clouds to lift. #lockdown #clouds #parlimenthouse #Visitcanberra https://t.co/K8N57AoH8J,vishalcanberra
Canberra,2020-08-02 07:15:07+00:00,1289822017961603073,"Health Minister @GregHuntMP announces mental health support for those in lockdown areas.

An additional 10 Medicare subsidised psychologist sessions. Double what is currently in place. 

@SBSNews #auspol https://t.co/1xgZPIV2kd",JamieTravers
Canberra,2020-08-01 18:53:35+00:00,1289635404895813632,'Numbers are too high': Melbourne faces stage four lockdown within days https://t.co/cpvDTYDv93 via @theage,UmerBhatti83
Canberra,2020-07-29 15:21:53+00:00,1288494966390456320,"#Lockdown challenges #PhD style: Last week, learning multivariate regressions &amp; predicting fossil brain sizes, this week analysing modern human sulcal patterns #SkullandBrain #statistics #neuroanatomy #paleoanthropology #paleoprimatology #evolution",PalaeoNeuro
Canberra,2020-07-26 07:50:34+00:00,1287294225537802240,"Second dinner out this weekend! Relishing freedom from pandemic lockdown while we can! Since John Ting is coming along tonight, it counts as a #refreshmentswillbeprovided 😍 @ The Italian Place https://t.co/Dg5PWC2WeT",thesiswhisperer
Canberra,2020-07-26 07:48:43+00:00,1287293758933876737,@myknittingwool It wasn't  long ago when he was advocating to allow more access to residents by visitors  &amp; releasing them from lockdown.,JilJilchap
Canberra,2020-07-26 05:52:07+00:00,1287264414270230528,"Dziś mija 100 dni od ostatniego zarażenia wirusem na Fidżi 🇫🇯. 
Tylko pogratulować!

Kraje wyspiarskie południowego Pacyfiku to teraz najbezpieczniejszy obszar globu. Ale ze względu na ścisły lockdown w całym regionie - pewnie też najbardziej niedostępny. https://t.co/7XP6KF5KqJ",MiKolodziejski
Canberra,2020-07-23 10:41:47+00:00,1286250150126481408,@here2makemoney @ausmojo That’s it! Funny that it seems to only be the people who call it a Parma are in lockdown while the rest of us normal folk that call it a Parmi aren’t 😉😂,samdwyer23
Canberra,2020-07-22 11:23:14+00:00,1285898190575636480,"These uncertain times passingly make me wonder if we will ever travel again? As an optimist, I am sure we will be able to in the near future. Never stop dreaming.
💛🙏💙
@PureQueenstown #roadtrip #wanaka @PureNewZealand #latergram #COVID_19 #lockdown #dreambig #travel https://t.co/j209bmPOxR",vishalcanberra
Canberra,2020-07-22 10:09:35+00:00,1285879659129798656,"@kerrymcnasty @abcnews I hope so, also.

Basically infections lag by about 14 days. 
Deaths lag that by about 14 days.

I think the lockdown started 07Jul2020, so today was 14 days.

If we don't see a slowing in the next week we are in trouble. https://t.co/Ojz2tD2AXx",mrgarymatthews
Canberra,2020-07-22 07:18:27+00:00,1285836589847855105,"@abcnews That is showing the infections from 2 weeks ago, so if steps taken are sufficient ie the Melbourne lockdown.

Should start to see a decline in the next few days.",mrgarymatthews
Canberra,2020-07-22 01:25:05+00:00,1285747664148029440,"This is fascinating - “The researchers found that during the lockdown, the rate of babies born before 28 weeks had dropped by a startling 90 percent.” https://t.co/kZp793e5DV",FletaTheTweeter
Canberra,2020-07-14 06:26:16+00:00,1282924354884366336,"@Adam_Creighton We need to not be like America.

I will fight for your right to have an opinion but really not supported by facts.

How many deaths would make lockdown Ok? https://t.co/NZtza8SOk6",mrgarymatthews
Canberra,2020-07-13 08:14:38+00:00,1282589236781174790,"@SandraSmiles @ColleenL66 @colangelo_delia @gtconway3d It helps that we are a huge island. Shutting the borders early, enforcing quarantine and nationwide lockdown was also a good move. I can’t stand our PM but at least he is not Trump.",KellyBowman2
Canberra,2020-07-11 05:37:24+00:00,1281824894087581696,"The world is watching as coronavirus forced Melbourne into lockdown for the second time. The hotel quarantine debacle, school cluster, and Morrison’s government decision to halt international arrival as Victorian… https://t.co/KEsCPxrMjH",MichaelRDLH
Canberra,2020-07-11 04:47:30+00:00,1281812337310105601,@calinative Melbourne has a new 6 week lockdown. 5 million people. https://t.co/76uqR4Wbdc,skwashd
Canberra,2020-07-10 09:37:19+00:00,1281522881415897088,"Ga lockdown, seperti swedia, juga ga ngehasilin economic gain yg besar. So, better to save lives above all. https://t.co/0AXNHWNWet",laksonomics
Canberra,2020-07-10 08:30:13+00:00,1281505995630481409,"A day to night timelapse from May.
This is one of the highlight of this year. I went out with Paul after the lockdown, we set up our cameras and then had a great chat about photography and stuff. It was a clear night… https://t.co/8qyTUFtekU",ari_rex
Canberra,2020-07-10 03:52:58+00:00,1281436224536760321,That’s the lockdown areas.,JulianBAbbott
Canberra,2020-07-09 13:24:27+00:00,1281217653802033152,"When the Melbourne lockdown is over, I fervently hope that @DanielAndrewsMP will look at significant investment in those 9 towers and in additional community support for the residents as well as addressing the outstanding maintenance issues. These people deserve better.",Brookefiona
Canberra,2020-07-09 08:07:17+00:00,1281137835962011650,"4 months without contact 🦠 24 hour flight ✈️ 14 days in government lockdown on arrival 🔒 13 precious days together 👨‍👧 100% worth it ❤️

#daddydaughtertime #daddysgirl #hugs #hug #family #familytime #familyfirst #separation #divorce #love #covid19 #covid_19 #covid https://t.co/fVnvGORckD",ashalexcooper
Canberra,2020-07-09 03:57:32+00:00,1281074984270651393,"During lockdown, I tried hard to improve my diet, exercise more &amp; get into a better sleep routine. So what did I learn?
.
Sleep really does matter! For too many years I’ve taken sleep for granted &amp; existed generally… https://t.co/7KdBxzTz31",ashalexcooper
Canberra,2020-07-08 11:26:15+00:00,1280825522927230976,Yang sok tau tntg kasus melbourne secondwave padahal sudah lockdown ini pengen gw tampol pake penggorengan.. tau ga kalo belakangan ini restriksi udah dilonggarin? Dan sumbernya dari karantina yg dilanggar. Kalau mau maksain fitting theory sendiri at least do your homework,laksonomics
Canberra,2020-07-08 01:25:17+00:00,1280674280947150848,"@DeliciousSophie I know right. Those poor Victorians are going to get frustrated being in lockdown again &amp; just revolt &amp; do what they want, which will only lead to more cases. Just look at the US.",AHCPhoto
Canberra,2020-07-07 06:48:49+00:00,1280393313342812160,You’d have to wonder about the AFL season now. Players agreed with the AFL they would only be out of Victoria for 5 weeks. Stage 3 hard lockdown for 6 weeks makes it hard. Bye round coming up in August you’d think,JulianBAbbott
Canberra,2020-07-07 06:11:21+00:00,1280383886984310790,@RobertsSledge Lockdown: with a vengence.,Cal_AU_
Canberra,2020-07-06 06:24:50+00:00,1280024892256038912,"@JoeBiden Comparison between Australia and Florida.

Australia 104 Deaths population 25,49 million people

Florida     3,701 Deaths. Population 21.48 million people

We get 74 cases and lockdown places. https://t.co/J7IMGRWwTG",mrgarymatthews
Canberra,2020-07-06 04:54:45+00:00,1280002221095161857,@rainey_knight Not everyone that’s a pensioner or immunosuppressed lives in that lockdown suburb. It’s not like some magical barrier is gonna stop them from contracting the virus elsewhere,lizhampton_14
Canberra,2020-07-06 04:12:33+00:00,1279991601897463808,"@aniutami24 Iya, eskalasinya cepet. Apa skrg udah total lockdown seluruh melbourne?",laksonomics
Canberra,2020-07-06 00:44:30+00:00,1279939244702625793,@BrentSpiner went into lockdown before it was cool (and people's lives depended on it..). https://t.co/fLR2RtF2Tj,_kieranoconnor
Canberra,2020-07-05 04:36:37+00:00,1279635268530814976,"Day 13/14: Australian Government Quarantine - FREEDOM! 🕺🏼

Great to be back in the fresh air. Lockdown hotel room exercise has been good, but not the same as running in winter sunshine.

#covid19 #quarantine #grateful #health #wellness #exercise #veterans #mentalwellness #fitness https://t.co/sbs2c9Xtw4",ashalexcooper
Canberra,2020-07-04 11:53:00+00:00,1279382699740807173,@EnsignR I don’t think that would work. The lockdown isn’t great but it is probably the best option in the circumstances.,skwashd
Canberra,2020-07-04 08:21:18+00:00,1279329423724998657,@3wombats @CaseyBriggs So what about those that are obviously spreading it? They need a proper lockdown statewide,lizhampton_14
Canberra,2020-07-04 07:53:49+00:00,1279322508412416000,"If @DanielAndrewsMP was serious, they’d have a statewide lockdown. The horse has bolted",lizhampton_14
Canberra,2020-07-04 07:32:22+00:00,1279317113010700288,"@Bails_81 @RajViajar @CaseyBriggs A lockdown of everyone would be fair, this is depriving poor people of movement",lizhampton_14
Canberra,2020-07-04 06:18:26+00:00,1279298504213573633,"Oh Melbourne this sounds quite awful 😢

I hope the supporting logistics really look after these folks in the immediate tower lockdown.",kaydo
Canberra,2020-07-04 01:04:25+00:00,1279219478170042370,"Cycling has keep me active and clear-headed during COVID-19 lockdown, enjoying my local community while staying active. And why do I get up on a crisp winter’s morning to ride my bicycle? This is why!… https://t.co/wL47bhFtxy",stephenhodgeaus
Canberra,2020-06-30 06:14:36+00:00,1277847990636392448,"Huh. If I had stayed in my old Melbourne apartment*, I'd be back in lockdown.

*I couldn't have because it got sold a few months after I left, but you know, in theory.",drakyndra
Canberra,2020-06-30 05:47:49+00:00,1277841250410872833,"@_lizbarr My sister is 1 block away from a lockdown, I think.",drakyndra
Canberra,2020-06-29 12:09:38+00:00,1277574947347394564,"Suicide figures are up 200% since lockdown. Could 2 friends please copy and re-post this tweet? We’re trying to demonstrate that someone is always listening.

Call 116 123 (Samaritans UK)

Just two. Any two. Copy, not retweet
#SuicideAwareness",steven_gill
Canberra,2020-06-29 12:01:16+00:00,1277572841538379776,The arts sector who has nurtured and sustained us through lockdown deserves better #qanda,RebeccaVassarot
Canberra,2020-06-29 11:07:06+00:00,1277559210453024768,"@SimonGIS @dinomirMT Yes I’ve not seen COVID stats below LGA. But with authorities talking about local lockdown by suburb or even street, someone must be storing unit records with a GNAF PID.  They do ask for an address when you get a COVID test 😀",MarcusMapMaker
Canberra,2020-06-27 06:34:14+00:00,1276765766734381059,@tullyoneill_ Congratulations on your achievement. I  submitted in the Covid lockdown and am waiting for the verdict.,duxburyjen
Canberra,2020-06-24 23:53:52+00:00,1275940233175904257,"I have a great idea. How about the govt reverse the ABC cuts and instead a hive them  big grant to employ artists, musicians, singers, to entertain us all in lockdown?",giddeygirl
Canberra,2020-06-23 12:08:43+00:00,1275400389798461445,Not making any accusations here but if @neiltyson isn't using the covid-19 lockdown time to break the concept for Cosmos series 3 (or 4 if you include the original) ima be pissed. @StarTalkRadio #cosmos #science,_kieranoconnor
Canberra,2020-06-23 05:49:51+00:00,1275305043684548609,"Post-lockdown socially distanced celebration 🎉 Happy birthday, John Dryzek, happy new baby @WendyConwayLamb &amp; happy new grant @francesco_veri 🥳🥳🥳 https://t.co/Afyfg1dZ54",DelDemUCan
Canberra,2020-06-22 21:46:19+00:00,1275183361665888256,"@scotty_thomo @AWMemorial All good Scott. The book arrived at the same time covid started to put us all into lockdown. Bigger events overtook us, but now attention is focusing back to the Korean peninsula and the ongoing issues north of the DMZ.",MichaelPost1945
Canberra,2020-06-21 07:59:52+00:00,1274612988037591046,@TheGHRaiders Dumb football. Lazy and unorganised. Are the players still in lockdown? They don’t seem to know each other,NoShins81
Canberra,2020-06-20 06:12:26+00:00,1274223566934773760,"@adzz75 But if we followed your suggestion...which I’m thinking would be a year in lockdown, no business would be left standing.",markparton
Canberra,2020-06-16 23:02:51+00:00,1273028295148417024,"Blimey this is seriously deranged, on several levels. Adam’s been spending way too much lockdown time in creepy online corners. https://t.co/iXCgQeIdPs",mumbletwits
Canberra,2020-06-15 10:44:32+00:00,1272480103625134082,"Me: I can't believe I lost the small body progress I made this lockdown.
Also me: *orders pizza for dinner twice a week*",viktorepo
Canberra,2020-06-14 11:21:55+00:00,1272127122409009152,"Mom: Wake up, look at Sun it's already at top of head.
Me: So, What am I supposed to do Photosynthesis? 😉
#lockdown 
#jokes",oannbn
Canberra,2020-06-13 01:44:06+00:00,1271619320095756288,New Zealand is now selling out sports grounds. Talk about a turnaround from lockdown just a few weeks ago https://t.co/PArCarPlcF,andywhitenz
Canberra,2020-06-12 13:27:13+00:00,1271433878020820992,.@KGeorgieva From Great Lockdown to Great Transformation https://t.co/Z9gJWhSX6S,Ihahmad7
Canberra,2020-06-10 13:59:30+00:00,1270717229458321414,"My bratiness caught on cam 😅😅😅 TBF I really wanted to know new regimes of sanctions &amp; punishment in one of the world’s strictest and longest lockdown 🇵🇭 Full video here: https://t.co/1MQblMRf8A 

@PSS_SociologyPH @jayeel_cornelio https://t.co/0ELprz85fw",NicoleCurato
Canberra,2020-06-10 08:50:51+00:00,1270639553963937792,"#flashback to before the coronavirus lockdown #PreCovid19 
#MessageSticks #ArtInstallation #art #exhibition #NationalMuseumOfAustralia #Canberra #ACT #AustralianCapital #VisitCanberra #australia #SeeAustralia… https://t.co/zFvcIIblOC",petrospap
Canberra,2020-06-09 10:02:42+00:00,1270295248141316097,"Jonathan Ong @jonathan_c_ong unpacks multiple possibilities behind the spike in cloned accounts in the Philippines drawing on our #DisinformationTracker project. Great interview, Jon! Loving your lockdown glow 😍 https://t.co/IrgKS8KXkg",NicoleCurato
Canberra,2020-06-04 09:31:36+00:00,1268475481382322182,"After 23.2km again today it feels like I've walked to Sydney and back hhhhh....Lockdown pe ke lue hange ha vale...😜😜🤣🤣🤣♥️🌹♥️🌹♥️ @ Siakofine Tengalelei, Amaroo Act https://t.co/ThSR2GNPZm",JoleenDeflir
Canberra,2020-06-02 22:41:41+00:00,1267949536837656576,First day working at the NLA after three-months of lockdown: hope won't spend too long waiting the book to be ready since we're only allowed working for three hours a day... 😅,analispolitik
Canberra,2020-06-02 16:05:11+00:00,1267849755742232577,Me before lockdown https://t.co/L6Uu7W1CLV,skwashd
Canberra,2020-06-02 00:28:04+00:00,1267613920967049217,"Live scenes in Queanbeyan right now🤪

What still fits after lockdown?!?
What needs dry cleaning?!?
What's the dress code at @royalrandwick?!?
😂😂

Go Kattegat!!🐴 🟢⚫🟢 https://t.co/iFpK8FmnGW",Action__Dave
Canberra,2020-06-01 10:28:45+00:00,1267402699613618176,"ACT Autumn Adventures: pics in portrait from the 2020 lockdown collection, #Canberra @ Canberra, Australian Capital Territory https://t.co/w4PXHBCwK5",StuartAJohn
Canberra,2020-05-28 23:42:06+00:00,1266152800293011456,"So I know a few people who have decided their beloved isn't. Lockdown is hard together in the little ways. One likes a quiet house; one the radio. One likes to wash up after dinner; one the next morning. One hates tech in the bedroom; one misses their clock.
Anyone have a story?",giddeygirl
Canberra,2020-05-27 14:02:39+00:00,1265644588229750785,@ChrisChinch The first week of lockdown when everyone decided they wanted to become a podcaster or YouTuber,skwashd
Canberra,2020-05-27 05:56:05+00:00,1265522143087005697,Australia lockdown juga😭,boyhadid___
Canberra,2020-05-26 21:41:55+00:00,1265397779519516672,A lament from Anonymous. She might have written this during an Italian plague lockdown. https://t.co/nMtP0XTYlT,chrismewett
Canberra,2020-05-26 12:33:48+00:00,1265259842274332673,"Yg bilang swedia bisa dijadikan contoh karena berhasil atasi corona walau ga lockdown, kene cangkemmu tak jejeli grafik iki, raimu pisan tak siram ben ga nglendur maneh!! https://t.co/XX53W7CUjI",laksonomics
Canberra,2020-05-25 21:55:13+00:00,1265038738192654336,"I extends my warm wishes to all Muslims in Jordan, Australia and across the globe for a happy, safe and pleasant Eid El-Fiter holiday 💞

S7r7 enha mt25re bs Tfadalo again ya jama3a ‼️💯

#Canberra #Greenway #SouthPoint #FancyNight #Ramadan2020 #EidFiter2020 #LockDown .... 🔥 https://t.co/2rLkOpwgOP",LaithAbd91
Canberra,2020-05-24 21:58:11+00:00,1264677097378689026,"PSBB bisa di longgarin if testing, tracing, &amp; APD bagus, nah kita, infection case tinggi, tracing, testing dan APD terbatas trus petentang petenteng mau judi sama nyawa orang demi so called perekonomian. Orang ekonomnya juga nyaranin lockdown, yg didengerin siapa sih sebenernya? https://t.co/zBrrXpJPCO",laksonomics
Canberra,2020-05-24 14:47:43+00:00,1264568769097031680,Pleased my story “Sands of Time” will be part of LOCKDOWN FANTASY 6 @BlackHarePress - More details to come! #shortstories #anthologies #fantasy #sandstorms #weather #magic  #Lockdownfiction #freefiction #amwritingfantasy https://t.co/H3CdAEx9lo,LeanbhPearson
Canberra,2020-05-21 00:50:15+00:00,1263270850184114176,"This sums up our #Australia experience so far - drought, #bushfires, #covid lockdown but incredible resilience and absolutely amazing Australian people. Just watching this video brings it all back  🇬🇧🇦🇺 https://t.co/lkAZMTj7n9",Wheelerbird
Canberra,2020-05-20 07:59:03+00:00,1263016371056607232,"Week 9 of lockdown. One child has returned to school. Normally a reduced child number makes life easier but today 8 and 10 were AT each other and it really got me. 8 goes to school next week, I’m pretty sure she is the squeaky wheel.",houseofmess
Canberra,2020-05-18 07:29:41+00:00,1262284207730028544,@george_jaeggli I've been logging my hours while in lockdown just in case I need a record. It's interesting to follow.,botbml
