City,Datetime,Tweet Id,Text,Username
Canberra,2021-03-07 03:06:03+00:00,1368397506460098560,"Almost a year ago we all had to start staying home to keep the most vulnerable people safe because of the Pandemic

And a year later now, we’re back discovering the mysteries of the universe in ways we couldn’t have imagined before we had to go into lockdown 🙂",The_Young_Stars
Canberra,2021-02-26 07:23:29+00:00,1365200799735844865,"The weekend we went into lockdown in Canberra was the same weekend we received 1 million bulbs for @floriadeaust

Lots of ‘reimagining’ was required https://t.co/0Dqq9ZeQLR",SciTJC
Canberra,2021-02-24 22:55:11+00:00,1364710495723286531,Huge congrats to all the entrants and organisers of @ZimScienceFair from your friends at @ANU_CPAS! Amazing achievement by all involved to deliver the fair despite lockdown. https://t.co/gmTMoj5tiR,DrGrahams
Canberra,2021-02-23 15:41:04+00:00,1364238857944752128,"Di tengah covid masih tinggi kasusnya, jumlah tes malah turun, positivity rate naik, malah bersyukur ga sampai lockdown. Nggak semua pemimpin punya logika begini. Rawan pembodohan. https://t.co/stS5qudwvW",laksonomics
Canberra,2021-02-23 05:22:22+00:00,1364083156140269568,"State of Origin Game 1 tickets✅ Please be kind, AND may there be no cases, AND no lockdown come June, thank you and goodbye #BurnCity #MCG #QueenslandMaroons #SOO2021",Moanaleilua
Canberra,2021-02-23 02:14:53+00:00,1364035974649556994,"Catching up with French Studies buddies @AshokCollins and @gemma_s_king at the ANU, hearing about wonderfully innovative COVID teaching methods and the difficulties, small wins and surprising upsides of doing research in lockdown.
No one here is wearing masks! It feels so 2019 😷 https://t.co/Dw9lpI9oKf",DrChrisWatkin
Canberra,2021-02-18 21:39:12+00:00,1362517045015764992,Now let’s wait for the 15-day lockdown while the tennis keeps going https://t.co/RixJ9YViDd,BlackwellJ_
Canberra,2021-02-17 02:14:34+00:00,1361861568707784709,"@Wil_Anderson I can only describe the support for players at the Australian Open tennis, during lockdown, as a dud barrack.",inxanadudid
Canberra,2021-02-15 05:53:08+00:00,1361191796450021381,Alternative news narrative idea #1 instead of blaming Andrews for the (gasp) 5 day lockdown the free press (sic) could instead ask the very reasonable questions of why isn't there a federally run quarantine facility for OS arrivals and where the fuk is the vaccine for its workers,qednet
Canberra,2021-02-13 08:18:32+00:00,1360503611361353728,"@MaddyUlbrick If we can’t eat a tonne of bread while in lockdown the Saturday before Valentine’s Day, then life isn’t worth living😝",BlackwellJ_
Canberra,2021-02-12 08:17:47+00:00,1360141033628073986,My Mum and sister and nephew go back into lockdown tonight and somehow they seem further away.,KathyReid
Canberra,2021-02-12 00:34:46+00:00,1360024511421186048,I swear to god if Melbourne goes into lockdown and I don’t get to see my boyfriend next week I’m going to kill a bitch,james_eveille
Canberra,2021-02-07 10:07:32+00:00,1358356716283256833,@OurNewHomecoach Can I join you? Any plan? Is it to get rid of lockdown bonus?,MacarenaDLVDL
Canberra,2021-02-04 22:43:42+00:00,1357459846400929792,"“Because of the lockdown ... our opportunities for showing our love in practical ways may be limited ... Our opportunities to unite ourselves in prayer with our suffering brothers and sisters, on the other hand, may be greatly enhanced:” Archbishop Costelloe https://t.co/byCLfHtxMr",jeremystuparich
Canberra,2021-02-03 23:46:51+00:00,1357113349285154817,"@GavinBarwell Australian States lockdown each time they find a single case. The UK would be crazy to open up now while there are still such large numbers of infections and deaths, and various mutations in the community.",markneeham
Canberra,2021-02-03 07:15:03+00:00,1356863757339738112,"Hang in there, Perth! Thinking of you all during these few difficult days in lockdown. I’ve been trying to keep Mum and Dad as entertained as possible with phone calls this week!
#Family #MamaBear #Mother https://t.co/ZM53Fawu0K",CatLSullivan
Canberra,2021-02-03 02:30:34+00:00,1356792163988725763,"Oh look, trying to shoehorn a borders/lockdown finger waggle from a central banker... https://t.co/Ud2jRjnLe1",TimKofCanberra
Canberra,2021-02-02 11:27:29+00:00,1356564895462907904,"Thoughts are with WA right now. If a 5 day lockdown wasn’t enough - a major bushfire continues to burn east of Perth. Nearly 60 homes lost.
#perthfires 
#perthlockdown https://t.co/T0lzz8olW3",ClareMortensen
Canberra,2021-02-01 23:54:29+00:00,1356390496453627904,@LisaAndPaws 😹😹 you’re in lockdown and we’re not allowed to leave the country. This could be difficult. *googles rowboat* 😹,Aloo_Oz
Canberra,2021-01-31 20:27:50+00:00,1355976103249104899,"@kellyhd @ben_hr Having lived through both, one is much more palatable to do over and over — like I get the appeal of the lockdown, but I’m not sure I could do 4 of those across 6 months",BlackwellJ_
Canberra,2021-01-29 20:44:48+00:00,1355255596560261126,"Hahahaa... mantap sindirannya... lagi covid tapi ga terlihat seperti lagi pandemi di Indonesia. Ayo pemerintah @jokowi lockdown yg benar jika ingin normal beneran kayak gini, bukan normal2an... https://t.co/Xlt8AVIlNa",laksonomics
Canberra,2021-01-25 11:58:08+00:00,1353673504516788226,Susah memastikan prokes karena printilan begini2. Lockdown keras sementara sampai rumah sakit ga kewalahan..! https://t.co/RbBlx3MP18,laksonomics
Canberra,2021-01-25 09:44:09+00:00,1353639787647754242,"Ini semua mgkn bermula dari misleadingnya membaca data first difference bahwa growth kita msh jauh lbh baik dr negara lainnya yg nerapin lockdown. God, how serious it can be when you falsely read and data without careful interpretation

https://t.co/6mgr9YBT7f",laksonomics
Canberra,2021-01-24 00:27:39+00:00,1353137353968111616,@JunipurrStudio Thanks Junipurr. I’ve been working out during lockdown. 😹♥️,Aloo_Oz
Canberra,2021-01-17 06:12:53+00:00,1350687518023274497,"@MelDMann I live in Australia and because we have valid suppression/ eradication practices.

We do wear masks when we can't physically distance - flying, trains, doctors.

But overall life is quite normal, but we lockdown or restrict travel with any evidence of COVID19 in sewerage etc https://t.co/mQPgizrdIg",mrgarymatthews
Canberra,2021-01-15 08:19:28+00:00,1349994597376643072,From lockdown in Northern Ireland my Dad sent me these photos of the early morning views from my childhood bedroom 💕 #purplesky #Annaclone #CoDown https://t.co/cVdfqACwjx,Dr_FaithG
Canberra,2021-01-14 01:26:52+00:00,1349528375988166658,@lizkmiller Wow! More than they did in Australia when Sydney Northern Beaches went into lockdown. People lost thousands.,bhaines0
Canberra,2021-01-10 12:32:43+00:00,1348246392582508546,@DrAdrianBlau The entire city of Brisbane is currently in a three day lockdown after just one case of the new UK strain. But nothing succeeds like success.,LSHennessy
Canberra,2021-01-08 22:08:19+00:00,1347666468729548800,"@DuckGirl20 It’s 9:10am Ms Kayleigh. I’ve been awake for hours! I’m just waiting for breakfast 2. 😸 
Hope you and Ms Keira (and the family) are all good and keeping safe during your lockdown. ♥️",Aloo_Oz
Canberra,2021-01-08 22:07:11+00:00,1347666185567944704,"@LisaAndPaws Doing great thanks Ms Lisa. How are you, Mr James and family during your snowy lockdown? ♥️",Aloo_Oz
Canberra,2021-01-08 09:16:08+00:00,1347472142191923204,"Lockdown itu keputusan, bukan hasil, alhamdulillah ga cocok. Yang lebih pas: ""astaghfirullah, kok sampai sekarang tidak lockdown"" https://t.co/WPS5rVDWTB",laksonomics
Canberra,2021-01-05 23:57:26+00:00,1346606768038690816,.@nytimes seems to be perceptually blind to the extreme lockdown strategies imposed in China. https://t.co/CS3p7WcpDH,MerlotN
Canberra,2021-01-05 22:17:06+00:00,1346581515635834880,still no international border lockdown? tssk,mariekringxx
Canberra,2021-01-05 00:27:07+00:00,1346251848492093441,The UK is in lockdown not because the government wants to lock everything down but to stop spread of deadly pandemic and save lives. Don’t be another clueless Karen or crazy Kevin and think it and treat it as just the common cold. It’s not... #COVID19,richardfoote
Canberra,2021-01-04 21:08:45+00:00,1346201926442971136,@DocAvvers @phillipwmoore49 Far too many. It was obvious weeks ago that a lockdown was crucial,LizDolphinfluff
Canberra,2021-01-04 20:17:45+00:00,1346189095140134912,"So, Boris orders new national lockdown in England. Only yesterday he was saying schools were safe, and now schools to shut. Still no travel ban, no tests or mandatory quarantines though. To anyone doing dry January, just crack open a bottle and switch over to the football.",amyshepherd89
Canberra,2021-01-02 05:01:28+00:00,1345233728767885313,I believe this is pass wearing a mask. America needs to go into lockdown. The government should stop being corrupt Assholes and get the people the service they need ! https://t.co/bMtaouipyW,adannatweeting
Canberra,2021-01-01 00:30:18+00:00,1344803099978784769,@laureningram Also a lot of Melburnians have PTSD from their months of lockdown and it was finally worth it (over 60 days of no local cases) - they don't want that sacrifice to be for nothing.,BlairWilliams26
Canberra,2020-12-31 22:33:05+00:00,1344773599324852225,"@PatsKarvelas @GladysB The Border closure with Victoria  is heartbreaking for those people looking forward to a holiday after a shit of 2020 but if it hadn’t been imposed, Victoria may well have finished up back in lockdown. Delaying it, say 2 days, would have just meant the rush was set back 2 days.",Grumpyoleman55
Canberra,2020-12-30 04:01:20+00:00,1344131432608714757,"@normanswan @GladysB has been comprised by @ScottMorrisonMP telling her she is the gold standard because she stays open.

Yes, Greater Sydney needs a hard lockdown until it gets sufficient results.",mrgarymatthews
Canberra,2020-12-29 22:48:49+00:00,1344052782387650565,"First time at @canberra_airport in over a year. Ready to fly!
Airport is looking good. Bit of a reno during lockdown? @ Canberra Airport https://t.co/AjgYWgk9BM",oz_bandicoot
Canberra,2020-12-29 07:22:13+00:00,1343819594914353154,"Early intervention, testing, tracing, lockdown, border closure, social assistance package are the vaccines here... https://t.co/J5G53BEX7r",laksonomics
Canberra,2020-12-28 11:34:09+00:00,1343520608131244032,Nan’s knitting output increased during lockdown. https://t.co/061zQ5wxMv,sloanefather
Canberra,2020-12-22 04:43:09+00:00,1341242850156175361,Aunty @c.t.l.y.n and Uncle @irish_monkey came for Wills visits! They have been freed from Victorian lockdown. #BeenTooLong #CovidKeepsFriendsAway @ Riverside Plaza https://t.co/Z2zwxpV7Jf,ArikaBiara
Canberra,2020-12-21 06:02:10+00:00,1340900348219682816,Canberra’s definitely heading into its Christmas ghost town phase. CBD hasn’t been this quiet since the peak lockdown period.,toaf
Canberra,2020-12-20 05:07:14+00:00,1340524135814860800,"“Every city that has laboured under the misapprehension that they can carry on with a bit of community transmission has been forced into lockdown when the health system collapsed.”

Yule be sorry: Why Sydney is facing a super-spreading disaster https://t.co/W30Y4aQcki",mumbletwits
Canberra,2020-12-15 06:31:43+00:00,1338733458667913218,@dothinkeducate Oh i only taught one very small unit during lockdown. We looked at the evolution of a pandemic!,BelindaTeaches
Canberra,2020-12-15 06:09:03+00:00,1338727752615129088,Happy our students who worked really hard for their dreams despite a pandemic &amp; lockdown achieved great ATARs - and all mire than they were aiming for. Happy end to 2020 for them!,BelindaTeaches
Canberra,2020-12-13 10:20:26+00:00,1338066242112954368,A5 - that we never go into lockdown again and that 2020 does not have any long term mental health impacts. It was a wish right?! #aussieED #makeawish https://t.co/pxSHVxLsN1,LWholley
Canberra,2020-12-12 02:59:25+00:00,1337592868626604032,"@CognitiveVerb Yep had hypertensive crisis &amp; 3 micro haemorrhages in my brain during lockdown. Possible adrenal tumour. BP under control, kidneys functioning &amp; no tumour!",BelindaTeaches
Canberra,2020-12-10 02:14:08+00:00,1336856694245052416,"Great start to panel on documenting Covid-19 @ausmemory #memoryoftheworld by Kevin Bradley on the breadth of @NSLA collecting from libraries across Aus and the @nlagovau collecting activities from sound capture in lockdown, digital art to web archiving! https://t.co/G09mvCmQQj",VickGwyn
Canberra,2020-12-09 00:26:42+00:00,1336467272903217152,I've been lucky where i am we've been Covid free for some time. Face to face classes for last 2 terms after brief lockdown #2PencilChat,BelindaTeaches
Canberra,2020-12-07 06:28:09+00:00,1335833456484356097,@itsa_talia This guy was earlier showcased on Fox News as a hero of the lockdown revolt.,adavid
Canberra,2020-12-07 01:15:30+00:00,1335754776412266496,"@pattyann226 @PattyArquette @realDonaldTrump @RudyGiuliani It has not. We had one state that had a major flare up, they went into strict lockdown with mandatory masks wearing and the Victorian government and community beat it. It’s been 38 days since any new virus cases.",thefoodmarshall
Canberra,2020-12-05 23:37:07+00:00,1335367629519740928,"@DesertEv @FreedomVivian @xskinn @ScottMorrisonMP China relations stuff up, canceled exports, suicides from Robodebt, Covid instructions not to lockdown, Hindrance to the Premiers doing a good job. No intervention of ongoing Aboriginal atrocities etc etc",MaureenAHuebel
Canberra,2020-12-05 21:19:23+00:00,1335332968034783232,"@fras99 Or in a country like Australia which has effectively eliminated the virus not have to.

Because you practice Physical Distancing.
Maintenance of testing and tracing.

But we do lockdown &amp; wear masks early if we have outbreaks.

We can test sewerage and identify outbreaks early. https://t.co/esL7pO7Rie",mrgarymatthews
Canberra,2020-12-04 02:16:45+00:00,1334683025880182785,COVID-19 lockdown induces disease-mitigating structural changes in mobility networks https://t.co/Kng2s5MUCJ,adavid
Canberra,2020-11-24 08:51:18+00:00,1331158440610197505,@CognitiveVerb @twtrrr Lockdown.  Headache. Lethargy. 3 micro haemorrhages on my brain. 5 specialists later all ok 😇,BelindaTeaches
Canberra,2020-11-22 09:48:57+00:00,1330448173479976966,"Oh God this one I don't know. I had a hypertensive crisis &amp; 3 micro haemorrhages in my brain during lockdown. So I'm going to say me. Me, adrenal tumour free and relatively in tact #aussieED",BelindaTeaches
Canberra,2020-11-22 06:09:57+00:00,1330393060249804800,"@AustralasianEdu Mind you i was in lockdown, having had 3 micro haemorrhages in my brain and being checked for an adrenal tumour.... timing is everything. It was still better he went!@",BelindaTeaches
Canberra,2020-11-21 04:11:31+00:00,1330000867752177664,"Hey dugout fans, been a mad mad week for me of cleaning out my late mums house, then dropping everything to make it out of lockdown, to border holdups and all day driving. Never fear, Ill be back checking out #IAE2950 on @RobertsSpaceInd tomorrow night!",Cal_AU_
Canberra,2020-11-20 22:00:41+00:00,1329907544483979264,"The mental health effects of lockdown are still resonating around my friends and family. A national ‘Thank You’ can help with recovery process.  And their sacrifice has helped us all. 

Feel like there’s an analogy somewhere about national sacrifice... https://t.co/2YL3wfAh9v",cbr_heartdoc
Canberra,2020-11-20 22:00:38+00:00,1329907532341538816,Can we have a national event of thanks to Victorians for their #covid response?  Their lockdown have given us hope for end of year holidays and time with family,cbr_heartdoc
Canberra,2020-11-19 21:47:42+00:00,1329541887875633152,"@zeus71stav @AnnastaciaMP Absolutely, states have no accountability for the money it costs to lockdown",AusBeerJourney
Canberra,2020-11-18 22:40:53+00:00,1329192884214513664,"@SkyNewsAust @PaulineHansonOz Correct but if we did have a lockdown in Melbourne and now Adelaide, we would have had a death rate like the USA. https://t.co/YtYHIY6vWW",mrgarymatthews
Canberra,2020-11-18 22:29:22+00:00,1329189988085317632,South Australia's 6-day lockdown explained.  https://t.co/1dlw2K1fPo via @ConversationEDU,KamaCathy
Canberra,2020-11-18 04:15:18+00:00,1328914654232342529,"@corybernardi Mate I just find it stunning how quickly you offer to take up the mantle of pro-virus/anti-lockdown conservative political fuckwittery in the name of publicity.  But hey, you do you champ.  History will regard your newsfeed well I’m sure.",TimKofCanberra
Canberra,2020-11-18 02:29:49+00:00,1328888109652557825,"@carstendog Anger fair enough, to a point, but repeatedly urging lockdown loosening was irresponsible.",mumbletwits
Canberra,2020-11-15 06:59:16+00:00,1327868754303172610,"@antsharwood Drenching Saturday night, ~May in lockdown: that’s *the* album I played.  Twice.",EurekaJames
Canberra,2020-11-03 17:53:24+00:00,1323684718102016001,@TheWalkingEds you inspired me to get back walking. During lockdown I had a headache which was a hypertensive crisis resulting in 3 micro haemorrhages in my brain.  Many specialists later I'm fine &amp; back walking - being kind to myself. Thanks #theWalkingEd,BelindaTeaches
Canberra,2020-11-03 09:55:42+00:00,1323564503787659264,@Anoosh_C  @stephenkb @PronouncedAlva  Lockdown will only be effective if there are checks by police or defence force members as occurred in Melbourne over the mega isolation recently. Test &amp; Trace was radically improved and again enforced. Many fined $$ for breaching lockdown,fenham
Canberra,2020-11-02 12:05:37+00:00,1323234809531961344,"@AkivaLichtner @realDonaldTrump It doesn’t have to be a full lockdown. It all begins with social distancing, masks, basic hygiene, quarantine if exposed, tracing, etc etc. None of these things are occurring here and so sadly the US has no chance of combating the virus. None.",richardfoote
Canberra,2020-11-02 07:29:25+00:00,1323165302457167872,"@HansMahncke @AlexanderDowner And without the various #COVID19 lockdown and other measures, how many multiples of 900 deaths might there have been? We'll never know but I suspect several.",Ian__P
Canberra,2020-10-29 22:57:32+00:00,1321949316580175873,Congratulations to Dr Trepheena Hunter for becoming one of the few certified Behavioural Veterinarians in Australia. Years of study and hard work. Final months through Melbourne COVID lockdown. Very proud of my little sister! https://t.co/BwAbbeomVS,cbr_heartdoc
Canberra,2020-10-27 03:17:03+00:00,1320927464860700672,"Morrison says the government “stood by Victorians every single day of the lockdown” during the second wave.

If cutting the rate of jobseeker and job keeper to 28,000 of my constituents during the lockdown is standing by them, I’d just as soon pass, Prime Minister. https://t.co/UzdexktHqJ",TimWattsMP
Canberra,2020-10-26 23:10:28+00:00,1320865410246299648,@SubinthePub Imagine Warnie's diet during lockdown?,michaelsnape
Canberra,2020-10-26 05:30:12+00:00,1320598581728874496,"Scott Morrison has had time to orchestrate three separate daggy dad PR stunts at Bunnings during the Victorian lockdown. 

He still hasn’t found time to thank Victorians for their sacrifices in fighting the COVID-19 second wave for the nation.",TimWattsMP
Canberra,2020-10-26 03:25:33+00:00,1320567216266309632,"@yodaberg @SezClom Decision making is multi-faceted. While there is no trend of Victorians leaving SOLELY due to lockdown (agreed) I can’t say that people including lockdown as a decision factor aren’t leaving for lockdown.

It’s pedantic but it’s important",BlackwellJ_
Canberra,2020-10-26 03:22:44+00:00,1320566507189923840,@yodaberg @SezClom I agree with you on the trend. There is no trend. But to say literally no Victorians are moving due to the lockdown just is not true,BlackwellJ_
Canberra,2020-10-20 11:14:02+00:00,1318510783039295488,"@auspost not sure if this is unreasonable to ask a social media team, but can I mail a can of beer? (putting together a lockdown care pack and don't want to break the rules) thanks 👏",kaydo
Canberra,2020-10-20 07:13:47+00:00,1318450325544599553,"@NewStatesman Allowing for area, population density differences Australia has done regional lockdown and in Victoria  regiona/city lockdown with overall success. The difference with the UK is that the state level govts had the will to do lockdown unlike UK",fenham
Canberra,2020-10-20 00:38:22+00:00,1318350813740236806,Valentinaem: “... silence the critics of Victoria’s lockdown....” https://t.co/xFdFircjw5,VernVerass
Canberra,2020-10-19 05:18:50+00:00,1318059009325199363,"Happy Monday to the golfers of Victoria! 

Over 100 days lockdown without golf. Dust the clubs off and get out there until the sun goes down. 🏌🏻 https://t.co/fAnyJAWg4k",adambest_
Canberra,2020-10-17 13:02:20+00:00,1317450876957511680,@annisa_beta I’ll take you out after lockdown 🥳,NicoleCurato
Canberra,2020-10-10 02:20:59+00:00,1314752759384555520,@antfarmer @RaidersCanberra Get onboard we are the people's team 🙂 Started the post lockdown season by having to travel 300km for home games. What an effort it has been.,AusLoafer
Canberra,2020-10-06 20:33:59+00:00,1313578270143569921,@MissCunninghamJ Get a medical check. Mine during Lockdown turned out to be a hypertensive crisis causing 3 micro haemorrhages in my brain,BelindaTeaches
Canberra,2020-10-03 00:29:31+00:00,1312187992233013248,Flying @Qantas again for the first time since lockdown.  Quite a different experience. Terminal is nearly empty. Lounge eerily quiet (except for the grunts coming from tennis highlights on the TV). Thanks for keeping the dream alive @Qantas,vzalakos
Canberra,2020-10-02 20:56:02+00:00,1312134267317624832,Interesting...infection rates in Canada are currently higher than Melbourne before the 2nd lockdown. https://t.co/nqb1qTm0z5,PaulMaddison7
Canberra,2020-10-02 09:38:31+00:00,1311963766100287488,"💥facemasks with filter pocket,💥
👉🏻 fashion and sustainable sparkly masks,

Check out this item in my Etsy shop https://t.co/a67DH15sPH

#wearamask #shoplocal #facecovering #lockdown #ppe #skin #safety #facemasksheet #stayhealthy #tshirts #all #facecover #facemaskorganic",CanEcoAUS
Canberra,2020-09-30 10:31:00+00:00,1311252195950522369,@lessheehan Wow - really? It’s definitely not the same. Yes Victoria had a second wave but the lockdown was swift. UK had thousands of deaths and cases BEFORE 14 day quarantine for international arrivals 😳🤷🏻‍♀️,ClareMortensen
Canberra,2020-09-23 02:02:56+00:00,1308587625595297792,@marcuskelson Saw Neko with New Pornagraphers just prior lockdown. One of the great concerts.,alexgosman3
Canberra,2020-09-21 06:11:48+00:00,1307925478234185728,"NU muhammadiyah nyaranin tunda, dulu pas awal2 lockdown ekonom2 indonesia juga bilang utamakan kesehatan at all cost, tapi yg dilakukan pemerintah ga mencermi kan itu. Fixed jokowi dengerin jin ifrit, bertobatlah  hey!!! https://t.co/Xot0hnhsep",laksonomics
Canberra,2020-09-20 10:24:52+00:00,1307626775237726209,@ThankyouMrA That's what our students found hardest in lockdown - the personal connection,BelindaTeaches
Canberra,2020-09-20 10:10:52+00:00,1307623253020520449,"A1. I don't know. Varied. Covid lockdown was eye opening fpr who coped, who thrived &amp; whi struggled. Otherwise we are devuce free unless in school IT labs #TLAPdownunder",BelindaTeaches
Canberra,2020-09-14 06:04:01+00:00,1305386802241351680,"There's going to be an array of contrarian conservative commentators whose heads are going to explode when they realise Melbourne no longer has ""the harshest lockdown measures in the world"" https://t.co/NsSRDq7CfM",LizDolphinfluff
Canberra,2020-09-11 07:39:22+00:00,1304323637227352064,"@DrCraigEmerson Correct.

We are all in this together but there does seem to be a trend.

Groups
1 Society should serve the Economy.
2 Economy should serve Society.

Lockdown &amp; Restrictions should meet both via reduced health care costs.

That's a balancing game.",mrgarymatthews
Canberra,2020-09-11 02:30:18+00:00,1304245854379806720,Dear comrade shall join chairman Dan Zhau in their favourite 'qarantine' hotel for an extended lockdown! https://t.co/amNHtGy9ZT,tongzhi96
Canberra,2020-09-10 02:58:56+00:00,1303890674987737091,"My family lives in Melbourne and Japan.⁠
The Coronavirus lockdown and some restrictions have separated many of us from our loved ones. Being apart from our partners, friends and family during this time of crisis is… https://t.co/kXJeBe9ImO",Hobbityetsy
Canberra,2020-09-06 08:15:11+00:00,1302520708564623363,@R_A_Dobson I could’ve sworn Sydney had lockdown.,mumbletwits
Canberra,2020-09-06 07:10:17+00:00,1302504377408565248,What was my wish during the country wide lockdown https://t.co/TnNQsxKc8O,MrBaird72
Canberra,2020-09-06 05:36:15+00:00,1302480712503668736,Prof Kidd says 2 week extension of Melbourne lockdown is very “challenging” and he’s concerned about the mental impact. He says studies have shown more contact tracing could accelerate easing of Vic restrictions and the Commonwealth “stands ready” to supply whatever is needed,ByClare
Canberra,2020-09-05 00:23:45+00:00,1302039679705866240,"@DHughesy I think all that would tell you is that lockdown reduces no covid related deaths as well, ie, no lockdown would be massively more (made up of the usual non covid - not occurring now - as well as covid - that would occur but for lockdown)",Dookyk
Canberra,2020-09-03 01:32:39+00:00,1301332245135810561,"Don’t get excited about lockdown exit, it could be deadly, says Andrews.  Sorry but that’s only for oldies with underlying health conditions.",Laszlo76247344
