City,Datetime,Tweet Id,Text,Username
Central Coast,2020-07-20 13:13:05+00:00,1285201060060176384,Humbled to share my ideas and thoughts through my voice and instrument on a platform such as Urban Sessions. Amidst the current pandemic I am grateful that I will be having the opportunity to perform my music and… https://t.co/OshGBZpEoe,Tshego_AMG
Central Coast,2020-07-18 22:42:42+00:00,1284619633471848449,"The candle that burns twice as bright, burns for half as long due to the pandemic. https://t.co/vsp8yq5HIq",mangrovemike
Central Coast,2020-07-18 05:45:09+00:00,1284363559342727170,"@ChrisGr49000925 @SwannyQLD Federal Parliament sat uninterrupted during the far more deadly influenza pandemic of 1919.
Churchill insisted Commons sit during the Blitz because he didn't expect factory workers to attend work and politicians not.
Today's mob are a bunch of wimps.",brushhandsigns
Central Coast,2020-07-18 00:14:47+00:00,1284280418942910464,@staffo_sez 40 year old virgin due to the pandemic,SMSFCoach
Central Coast,2020-07-17 21:01:49+00:00,1284231858733998080,@SBSNews With a global pandemic it's interesting that the number one concern is protecting the intellectual property so that it can be profited from as opposed to addressing the pandemic on a global scale,unclecraigums
Central Coast,2020-07-16 05:12:18+00:00,1283630516151844864,"Community-led responses, the need to integrate climate action &amp;economic recovery &amp;a determination to not go back to ‘business as usual’ are key to addressing social &amp; health inequities exacerbated by the pandemic - YES! It’s not new but we need to keep saying it #HealthReimagined https://t.co/7afLYHh1OO",s_wheeler_
Central Coast,2020-07-15 20:34:52+00:00,1283500301136261120,@GladysB The pandemic appears to have a bit to run yet perhaps we might focus on public health as a number 1 priority the economy will have to take a seat and be redesigned in the aftermath?,unclecraigums
Central Coast,2020-07-15 18:09:39+00:00,1283463756329054208,"'I was wrong' - Obama did leave pandemic response plan, says McConnell https://t.co/S0ftMVqYnG",IwanSchana
Central Coast,2020-07-14 23:20:03+00:00,1283179481834766336,"Latest reports in the US are that the state of Florida has no more ICU's available and Texas hospitals have run out of beds. Do we wait till the situation reaches those levels here in Australia before we accept...ok it is a pandemic?🤪
Alan Jones...YOU ARE A KNOBHEAD!!! https://t.co/OsXHeyFiM4",hecivan70
Central Coast,2020-07-14 22:27:04+00:00,1283166149018963968,NSW govt has effectively abrogated responsibility to combating the covid pandemic to the all powerful NSW alcohol lobby @crozi3r_john @Pat_gooley @BigAexposed https://t.co/XVYU8KFZ4H,tony4newcastle
Central Coast,2020-07-14 03:16:00+00:00,1282876471057375233,"@DonaldJTrumpJr You are obviously a Trump - blame everyone else - what exactly did you do to help the pandemic? I wouldn’t throw stones if I were you. Oh yes and learn English, you’re embarrassing yourself.",CaitrionaDowse
Central Coast,2020-07-13 03:16:07+00:00,1282514113122365445,"I guess this pandemic has shown us a lot of things. Especially around human behaviour. 

The most disappointing thing that it's highlighted, is just how selfish some people are.",itsAJBack
Central Coast,2020-07-12 11:38:46+00:00,1282278224022499330,@Todays_Pretty @DeAnna4Congress Upsetting to see such a tweet from someone who knows nothing about how we're handling the pandemic here.,itsAJBack
Central Coast,2020-07-10 23:15:07+00:00,1281728687080013824,"The number of covid19 cases dwindled to virtually zero in June. The experts were constantly warning that this pandemic was far from over but complacency crept in and now we find a ""2nd wave"" especially in Victoria is very real.
Was this inevitable or could've been avoided?",hecivan70
Central Coast,2020-07-10 09:35:51+00:00,1281522511780261890,"@Peter_Fox59 @realDonaldTrump The worst part about that Tweet is that 148k people agree with his BS. 
He has lied and spread disinformation since the beginning of this pandemic and yet so many ignoramuses still believe every word he says🤪",hecivan70
Central Coast,2020-07-10 01:48:50+00:00,1281404985217933312,@danilic seriously was nobody listening to all of the epidemiologists barologists the World health organisation when this pandemic was first announced for journalists seems like we have some people with goldfish memories,unclecraigums
Central Coast,2020-07-09 05:20:21+00:00,1281095825758666754,"The Auslan interpreters at every press conference are the real heroes during this pandemic. 

#COVID19Aus",itsAJBack
Central Coast,2020-07-08 04:28:38+00:00,1280720423437561856,"We are ‘looking at a drought of expertise, as the very people whose skills are sorely needed to handle the pandemic are on the verge of burning out’. To all of my #epitwitter &amp; #publichealth friends on #COVID19 - please take care of yourself, and let others care for you too ❤️ https://t.co/SO9fFhwrxS",s_wheeler_
Central Coast,2020-07-08 01:57:23+00:00,1280682359772200960,"@PatMorg65561677 @Media_Matt @DanielAndrewsMP He's a LEADER making necessary decisions re a PANDEMIC!
You do know what authoritarian subjection constitutes Pat?",dapoppagraham
Central Coast,2020-07-06 22:54:23+00:00,1280273921250476032,"@albericie @dailytelegraph It's been my life of being a Vic in NSW.

But it applies to potato cakes and footy.

Not a global pandemic.",nicklowther
Central Coast,2020-07-06 08:31:24+00:00,1280056744622751745,I wonder what will happen to the US if  #DonaldJTrump contracts #covid19 and dies? He seems to think he is above the pandemic.,lelovell
Central Coast,2020-07-05 08:29:35+00:00,1279693898344886272,How the Dutch are reshaping their post-pandemic economy - BBC REEL https://t.co/0ugaS1HP7R via @YouTube #DoughnutEconomics.,plu
Central Coast,2020-07-05 07:52:19+00:00,1279684521403641856,@newscomauHQ What is to say that this is not correct?  The origin and where it first emerged as a pandemic are vastly different.  The anti China narrative seems to make a lot of assumptions.,unclecraigums
Central Coast,2020-07-03 22:41:45+00:00,1279183575233908736,@hagsie Most of us are not. Look how well we have controlled the pandemic. But we do need to be more innovative in showing all the consequences as well as the costs of our decisions.,DrCraigGedye
Central Coast,2020-07-03 02:29:56+00:00,1278878612326739968,"@della79 But make them fashion! My friends and I were talking about this early in the pandemic, saying it would be a good idea for places like CO to sell them and make them a ‘cool’ item to get youngies to wear them.",E1MaWa
Central Coast,2020-07-01 11:31:38+00:00,1278290159750897665,"@jackcahill Yes, but didn't expect a pandemic as well.",GlendaIkundi
Central Coast,2020-06-29 02:56:19+00:00,1277435701382877185,"Remember when Trump predicted that the covid19 pandemic in the US would be over by Easter?
Remember when he predicted that the deaths would peak at 50-60k...then 80k?
Deaths are now 125k and the infection rate is rising rapidly again... https://t.co/CV8gvUknPy",hecivan70
Central Coast,2020-06-27 08:40:16+00:00,1276797482756796416,"So today we celebrated! We celebrating keeping our jobs (thanks to our clients), we celebrated our health, we celebrating making it to the other side of a pandemic (for now).

THANK YOU for your support,  and thank… https://t.co/6aUnKN42jn",intoyousfs
Central Coast,2020-06-26 05:50:21+00:00,1276392334381346816,"@vladoblazeka Imagine how many deaths there'd be around the world by now due to covid19 if there were no restrictions and Lockdowns in place?
It's called a pandemic for a reason!!!",hecivan70
Central Coast,2020-06-25 00:47:59+00:00,1275953854807289856,@FishingDB1965 I cannot fathom to politicisation/weaponisation of GOP response to this pandemic in your country ..it’s beyond criminal ..it is evil.,Lisabiartch
Central Coast,2020-06-24 06:55:49+00:00,1275684032882323457,@IanNicholls10 Nobody puts a pandemic in the corner.,GlendaIkundi
Central Coast,2020-06-22 00:29:57+00:00,1274862150092128256,@IanNicholls10 He has been so derogatory to so many people in America now &amp; completely disregarding the continuing pandemic that citizens are no longer holding back in their criticism of him.,GlendaIkundi
Central Coast,2020-06-21 06:05:40+00:00,1274584249920675840,"@MKrob @RNogarotto @TonyTannousTRBA @peterfilopoulos No one envisaged this pandemic and the effect it would have on society at all levels. To discuss a timetable for pro/rel at this point in time is unfortunately unrealistic.
Lets get thru this year and reassess.",hecivan70
Central Coast,2020-06-19 11:34:38+00:00,1273942260850122753,their hand over their mouthAs once every quarter around actually use the mask again is it having a drill every PA twice a week each area virtually no it’s good to practice but you’re wasting so much money just on Mars pocket Mars and I’ll get the stolen is that for the pandemic,ROct1972
Central Coast,2020-06-13 06:30:02+00:00,1271691279936573440,Real estate prices across #Newcastle appear to be holding steady despite the #COVID19 pandemic.  @nbnnews https://t.co/QUwWN0c4wm,SamBurbury
Central Coast,2020-06-10 22:03:36+00:00,1270839055601725442,"I wish something other than the extreme stress caused by a global pandemic had prompted me to start doing daily yoga, because that particular change has made my mornings (and general strength and balance) so much better. I guess I just have to accept it and keep going.",eleaud
Central Coast,2020-06-08 23:11:08+00:00,1270131276616368128,#pandemic https://t.co/ZLcksX19mQ,Austbloodstock
Central Coast,2020-06-06 08:13:55+00:00,1269180705474396161,So is there a fu#%ing pandemic or not?! 🤬 https://t.co/CmwwRVlsp5,NickArkoudis
Central Coast,2020-06-06 04:30:55+00:00,1269124586290831360,".@newyparkrun - 8 years old today! 🥳

Only ever been derailed by a path upgrade (2013) and a pandemic (2020).

Pic taken before the start on Sat 9 June 2012, 77 runners/walkers and 5 volunteers. 

#twasonthe9thofJoon #BlaydonRaces @newcparkrun https://t.co/zZXAMid8sN",mrdaverobbo
Central Coast,2020-06-05 09:46:40+00:00,1268841660290646018,"KAB Gallery welcomes you on Saturday 6th June
Thank you for the heartwarming well-wishes and online purchases over the past few months while we have been closed during the COVID-19 pandemic. The gallery isn't back to… https://t.co/v0hvkgdtL9",KABGallery
Central Coast,2020-06-05 01:44:01+00:00,1268720197038305282,This is the first time world exposed to pandemic condition and also the first time  to see a real qualification of organizations that we interact with them especially in academic world. It is  a real regret to see EUBCE behavior with their speakers,JalalabadiT
Central Coast,2020-06-04 20:24:10+00:00,1268639704506707973,"Don't let the media and #ScottyFromMarketing lies fool you. We were already in a #recession before the bushfires and #pandemic . 
#auspol #AuspolSoCorrupt #scomolies https://t.co/vS3VyqeNsg",Tonee65834913
Central Coast,2020-06-04 12:06:52+00:00,1268514556524916737,"We have to learn to make things again.Pandemic reveals Australia vulnerable from narrow, fragile manufacturing base https://t.co/pWa4M4qz62 via @MichaelWestBiz",djmarley6
Central Coast,2020-06-01 03:52:18+00:00,1267302932006895617,@emma_petrolo Anyone is kidding themselves if they think being even as productive as before the pandemic is possible.,sawsharkman
Central Coast,2020-05-30 14:06:59+00:00,1266732846053421057,"@MarkPearsonMP is right let use the funding from non essential government  funded ""services"" instead of freezing the wages of those who worked tirelessly throughout not only the #COVID pandemic but also the recent #bushfires . #nswauspol shame on you https://t.co/SkeOgg6xJO",Tonee65834913
Central Coast,2020-05-30 08:21:05+00:00,1266645797778554880,"“So many things make America combustible right now:mass unemployment,a pandemic that’s laid bare murderous health and economic inequalities,teenagers with little to do, police violence,right-wingers itching for a second civil war &amp;a president eager to pour gasoline on every fire” https://t.co/33mlspzAwz",DeclanClausen
Central Coast,2020-05-30 05:01:58+00:00,1266595687489130497,"@pmens72 @RNogarotto Yes, racial tensions have always been under the surface, ready to explode regardless of who the President is.
The fact is though that the pandemic has exposed just how broken the very social fabric of American society has become.",hecivan70
Central Coast,2020-05-27 20:28:52+00:00,1265741784342163457,This is a great thank you from #auspol to the people who put their lives at risk &amp; worked tirelessly throughout the pandemic.  Thanks #koalakiller for you generosity.#covidshame https://t.co/umg4x0wN2M,Tonee65834913
Central Coast,2020-05-27 04:44:22+00:00,1265504093562380288,"Thank you to all the frontline workers during the pandemic; teachers, nurses and police.
Maybe instead of spending billions on stadiums, you could remunerate the “critical workers”. You’re a disgrace Berejiklian. @GladysB 

 https://t.co/x7kfUzq2ak",JayJay1974
Central Coast,2020-05-26 07:11:55+00:00,1265178838352293888,"@BenFordhamLive @marklevy2gb @PaulineHansonOz Isn't Qld Premier Palaszcuk acting on advice from health authorities?
These are extraordinary circumstances, there is a worldwide pandemic FFS. Why would the High Court intervene because Pauline Fckn Hanson wants them too???😡",hecivan70
Central Coast,2020-05-24 00:54:40+00:00,1264359122637475840,@ProfPCDoherty As Senator Wong mentioned; there are so many issues and challenges that have arisen from this pandemic. Way too much focus has been given to this spat with China over the need for an investigation into its origins at the expense of focusing on our long-term strategy re: Trade.,hecivan70
Central Coast,2020-05-22 10:13:15+00:00,1263774920770641926,@Ortmann_ Remember back in our day our pandemic was the swine flu... ah to be young again!,nickintheworld
Central Coast,2020-05-22 05:11:43+00:00,1263699036898381824,"""...Racism is also undermining the nations political response to the pandemic.""😳
What a mess the US is in both politically and socially. They seem to be a lost case which is why we in Australia must reassess the path we are on to ensure we do not end up like this... https://t.co/s1QHrims2h",hecivan70
Central Coast,2020-05-22 02:13:31+00:00,1263654191425155073,"@Independent Please reconsider Boris, these migrant are putting their lives on the line to help you and your fellow Britons get through this pandemic.",djmarley6
Central Coast,2020-05-21 10:51:37+00:00,1263422188985520129,"@AnnastaciaMP Premier, how to enable co-parenting in this pandemic constrained world? My 2 Girls live in Qld &amp; I haven’t seen them since Jan. Cancelled 3x visits/time together &amp; July school hols was our next chance. Not with border restrictions = 2 weeks of quarantine + 2 permits + ..?",DrWilso
Central Coast,2020-05-19 01:39:53+00:00,1262558564616269825,It has been interesting getting emails about the pandemic from every hair salon I visited while on research trips during my postdoc. That platinum pixie cut didn’t maintain itself!,erinannmcc
Central Coast,2020-05-17 23:23:06+00:00,1262161753690894338,Three Queensland Reds rugby players stood down after refusing to accept salary cuts in the wake of the coronavirus pandemic https://t.co/etZQ5PhQpg,LloydRothwell
Central Coast,2020-05-17 06:55:12+00:00,1261913138644975616,@TimSmithMP So it seems Victoria has a contender for biggest sookie la la tweet of the pandemic.,eleaud
Central Coast,2020-05-16 15:40:04+00:00,1261682838887256064,"Planet Earth, the Pandemic, and the Power of One https://t.co/OhCrcFPsPb",IwanSchana
Central Coast,2020-05-16 09:37:28+00:00,1261591586061774852,"There is no cure!                                there is no vaccine!
it only took 1 person to start the pandemic ! the virus is out there! BEWARE",leonard_fabre
Central Coast,2020-05-13 12:50:06+00:00,1260552900360540161,Equally serious question. Was The United States really a super power  in the few years before the pandemic? https://t.co/dahdOJfgQg,allanasher
Central Coast,2020-05-11 09:16:02+00:00,1259774253991251968,A timeline from January 3rd when Trump was first informed of the coronavirus to March 17 when he finally admitted that it was a pandemic. Make your own mind up but IMO he has got to be the most incompetent US President in living memory in dealing with a crisis... https://t.co/71HMGxiOvv,hecivan70
Central Coast,2020-05-10 23:16:56+00:00,1259623485581615104,"'The US in 2020 resembles a failed state, with a fabulist for a leader and political polarities that cannot be reconciled even by an untreatable pandemic that has already killed 80,000 citizens and is certain to kill many tens of thousands more.' 👇👇👇👇👇 https://t.co/glMFRxF5r2",GlendaIkundi
Central Coast,2020-05-10 11:41:02+00:00,1259448359116353536,It's very humbling to see Sadhguru's efforts to do what he can to keep moving forward n raising money in which ever way needed to support Isha's relief work during this pandemic. https://t.co/cpkVXv1BZ3,_VanessaGrace_
Central Coast,2020-05-10 06:27:34+00:00,1259369470172119041,Police are warning drivers the #COVID19 pandemic is no excuse for breaking the law.  The results from ‘Operation Northern Roads’ in @nbnnews at 6 https://t.co/Tq85ItNm4u,SamBurbury
Central Coast,2020-05-09 23:04:27+00:00,1259257955620237312,"@sallymcmanus @ProfPCDoherty This system is unsustainable. 
Just look at the US now, with all their wealth, power and influence but they have been exposed now during this pandemic. We are on this path too if we continue to follow Neoliberalist ideology.",hecivan70
Central Coast,2020-05-09 07:34:22+00:00,1259023893215338497,"@Lindycleeland What are his staff doing? This is all about ignoring unions,even when they represent essential workers. Result, a spread of the pandemic and unnecessary deaths",djmarley6
Central Coast,2020-05-09 01:44:48+00:00,1258935922751533056,@JoelCaine @PhilGould15 @FOXNRL @abcgrandstand it’s a shame it’s taken a global pandemic for the central coast to finally get an @NRL team! @NZWarriors welcome to the coast! It’s a shame we can’t go and watch live 😔,danielmccamley
Central Coast,2020-05-08 05:46:17+00:00,1258634304403333120,Love working with such a fantastic team who are keen to embrace the opportunity that is here to develop systems and capacities that address #COVID19 but are also applicable to other current and future #publichealth issues that don’t stop just because of a pandemic 🧪🩺🧼📊🦟 🌊 https://t.co/8wRMmP5jay,s_wheeler_
Central Coast,2020-05-08 05:33:00+00:00,1258630963019444225,I visited the Apple Store today. They are very well set up for pandemic retailing. https://t.co/bvVu3QcHXk,HyperBrendan
Central Coast,2020-05-07 22:12:38+00:00,1258520141525946368,"@phbarratt not much, if its silence about govt plans to refuce the Jobseeker payment post-pandemic is any guide ... no outrage, nothing other than a mealymouthed word salad from Albo ...",bigbasilb
Central Coast,2020-05-07 03:37:52+00:00,1258239600583049216,"@ClearBluSky2 @grottyscotty @JonesHowdareyou He had two years and lots of warning to be ready. He trashed the Obama era pandemic plan, he has spent resources on persecuting migrants instead of making America safe. All he cares about is four more years, no matter how many die.",djmarley6
Central Coast,2020-05-06 00:11:15+00:00,1257825216551546880,"@reidhoffman When the pandemic clears untreated oral health concerns will lead to a rise in doctor/dental visits and hospitalisations!

We can connect your sore throat or sore tooth to a doctor or dentist from the comfort of your own home with TelScope!

https://t.co/wJzKm5hu47",hollandhealth_
Central Coast,2020-05-04 23:45:35+00:00,1257456369210458112,"@PEYESTRO @rdsva @mattyglesias And this failure to address the virus, to allow it to become entrenched will impact on how US citizens will be treated by the rest of the world as they will pose a health risk. The tourism industry will also be hit. Who wants to visit a country that wont manage a pandemic?",JaneoOakley
Central Coast,2020-05-03 20:25:57+00:00,1257043740268453888,Absolutely not and in contravention of the Biosecurity (Human Biosecurity Emergency) (Human Coronavirus with Pandemic Potential) (Emergency Requirements—Public Health Contact Information) Determination 2020 - no coercion. https://t.co/Q3dpwgVWNm https://t.co/f0qLIDN0NM,carolduncan
Central Coast,2020-05-02 11:56:56+00:00,1256553254529519616,"Maybe this global pandemic thing is just what we all needed to rediscover what's important in this world. No.1 on the list is simple, it's, 'the world'... And making the most of it without f#*king it. Last night I… https://t.co/qxlhOcx1EB",inciteimages
Central Coast,2020-05-02 02:09:14+00:00,1256405357238181888,"What's more, she asks an extremely valid question: which terrible event on the residents affected did more harm? The Invasion or the Pandemic? https://t.co/bfYh0qnRAD",bevhenwood
Central Coast,2020-05-02 00:45:24+00:00,1256384258836271104,@TheIPA @evmulholland Ate you brave defenders of James Cook or a bunch of neo Liberals using feigned outrage to sabotage a successful strategy to contain the pandemic? The latter I think.,djmarley6
Central Coast,2020-05-02 00:33:01+00:00,1256381143630245888,"Population: Wearing a homemade mask doesn't protect you from others. 
Personal: I want to protect others from me and signal to them that I’m taking this pandemic seriously.",jed_duff
Central Coast,2020-05-01 23:51:51+00:00,1256370783909105664,"@JDBudgie It’s not scaring folks to be realistic about the behavioural impacts of a shock like the pandemic - what would be scary is if folks ignore reality and then are surprised when things don’t go back to “normal”

Humans, life, society adapts - Covid has been an accelerant to trends",gregorymckenna
Central Coast,2020-05-01 15:07:06+00:00,1256238725329190914,@adamajacoby Oh! What more hypocrisy! It’s a pandemic amongst LNP!,BZElkie
Central Coast,2020-05-01 05:12:58+00:00,1256089207010983937,Friday’s  Checkie-Check-in (make sure to look at the last image) So I’ve evidence that animals are affected by this global pandemic/quarantine too. She’s giving me “double-snaggle stare-down realness”.  During… https://t.co/OiGSxxwxrq,jaymayokay
Central Coast,2020-04-30 10:14:40+00:00,1255802744595558400,"@realDonaldTrump @CNN You fired him.
He plead guilty.
There are 60,000 dead from a disease you said was going away when there were only 15 cases in the USA.
You spent February playing golf and holding rallies instead of preparing for the pandemic you were warned about.",paullyfromaus
Central Coast,2020-04-27 09:09:39+00:00,1254699216586240002,Does living in New York make any financial sense after this pandemic? https://t.co/G9EFi24jpY,carolduncan
Central Coast,2020-04-26 07:53:03+00:00,1254317553838510080,"@MikeCarlton01 Just look at the US...for all it's wealth, it's power and influence throughout the world. The #COVID19 pandemic has truly shown on so many levels just how much it is failing as a society. The system that created Trump is well and truly broken!",hecivan70
Central Coast,2020-04-25 21:50:12+00:00,1254165839701356544,"--tapos ko na gawin, nandito ako sa labas (this is at night and almost late) nagahanap ng malakas na signal"" like grabe lang jud ni karon kay pandemic man gud ni, dili basta2 makagawas para makahanap ug signal. one mistake of going out can lead to possible infection.  //",janinemntflcoxx
Central Coast,2020-04-25 19:09:54+00:00,1254125500357722114,The pandemic at sea: How cruise ships exposed thousands on board and helped spread the virus around the world https://t.co/SXLGnszAxq,IwanSchana
Central Coast,2020-04-24 02:01:49+00:00,1253504388196454401,"This boy really is my heart, soul and my reason for everything!

He is growing so fast and is just an incredible human. During this pandemic and horrible time, he is our light on some of the darkest days! 

We are so… https://t.co/IafYB8b9K4",leecy_osh
Central Coast,2020-04-21 23:41:44+00:00,1252744360120029185,"@realDonaldTrump 820,00 infected. 45,000 dead including almost 3000 just today. Outstanding job handling the pandemic.  Imbecile.",MyKing1968
Central Coast,2020-04-21 11:24:37+00:00,1252558857617862658,@triplets0412 Is this really the biggest issue to put your time into during a pandemic though?,itsAJBack
Central Coast,2020-04-21 05:43:07+00:00,1252472913745203202,"@gavflano If he had acted back in early March instead of labelling the pandemic a hoax, there is no doubt that the number of deaths would not have been this high.
It's just unfathomable that he can now gloat as if his actions have saved millions of lives😡
#CriminalTrump",hecivan70
Central Coast,2020-04-21 01:47:28+00:00,1252413610069864449,"@mark_frye @parscale Oh honestly stop carrying on about FREEDOM and socialism and stupid, stupid theories. We are in the middle of a pandemic and trying to save lives.",CaitrionaDowse
Central Coast,2020-04-20 09:28:51+00:00,1252167336401891329,"Hey @danilic, this tweet didn’t age so well. Only months after you praised him as a “great leader”, @AndrewConstance now wants to sell more public services. Of course @LiberalAus use a #pandemic to cut more #PublicServiceJobs. #NoToPrivitisation #auspol #nswpol @psansw @unionsnsw https://t.co/c3baUXhknU",RGratton
Central Coast,2020-04-19 18:01:06+00:00,1251933857273843714,Happy Birthday!! I  that you had a wonderful day staying inside all alone and isolated.  Too bad that’s what you had to do..although that’s pretty much what you (and I) did every day BEFORE the viral pandemic.… https://t.co/3C04uTf6Ym,jaymayokay
Central Coast,2020-04-18 23:51:08+00:00,1251659558411370496,"@thehill And here I am thinking he junked his inheritance, such as national parks and the pandemic response group.",djmarley6
