City,Datetime,Tweet Id,Text,Username
Central Coast,2020-10-15 03:15:43+00:00,1316578471385001984,Got 5 laugh reacts in the group chat overnight. Probably gonna be able to ride this high for the rest of the pandemic,Jrafferty43
Central Coast,2020-10-14 12:23:07+00:00,1316353843005849601,@TerrySerio It’s a figure of speech Scotty 🙄🙄🙄 but you will insist on using the pandemic to gun for Labor Premiers so how bout you get off your high horse &amp; admit that you’re playing in the mud 😡😡😡,NaomiCranfield1
Central Coast,2020-10-13 03:10:09+00:00,1315852294970208257,Treating dental patients in the covid 19 pandemic.1: all visits 1 hour 2: double wipe down between each patient 3: change and dispose PPE after each patient 4: spray the air in room with Glen 20 5: patient covid declaration and temperature check,leonard_fabre
Central Coast,2020-10-11 14:16:21+00:00,1315295177028722689,Cruise ships dismantled for scrap metal as coronavirus pandemic sinks industry https://t.co/C4kOyB7qxM,IwanSchana
Central Coast,2020-10-11 02:54:23+00:00,1315123551054094336,"@leighsales @normanswan @CaseyBriggs Not sure, but is it that the NSW track &amp; tracing has been superior for most of the pandemic?
I’ve not got data in front of me, but I have a feeling from what was reported, most MSW cases were tracked to clusters, pretty quickly in comparison to Vic.",paullyfromaus
Central Coast,2020-10-09 09:33:47+00:00,1314499288802750465,Another #beach. Great bit of relaxation. The #cebtralcoast #nsw is a gem of a holiday destination. Been great to escape the ongoing pandemic warnings and just see beautiful sceneries without any worries. https://t.co/FaGTTtG9O1,Eddie_Bee
Central Coast,2020-10-09 01:15:04+00:00,1314373782920855552,"Paid $13 for 2 drinks at Bon Juice, next door to Just Cuts. $8 for a banana smoothie, $1 extra for soy in my covfefe.

Only supported them because 
a) new
b) pandemic 
c) we’ve been using their chairs while waiting for the haircut

And they give you a tiny-teddy with the covfefe",p_terg
Central Coast,2020-10-08 22:28:52+00:00,1314331958583848960,How does Andrew Cuomo have time to write a book while managing a pandemic? https://t.co/GJs6iKg90z,JakeLapham
Central Coast,2020-10-07 23:07:35+00:00,1313979311997636609,"Well done the majority of Victorians and of course Dan and those magnificent frontline at the ""coal""face health workers!
Most australians with respectful beating hearts are appreciative of your effort! With you, and Victoria nearly back with us, pandemic wise!!....",dapoppagraham
Central Coast,2020-10-07 13:13:41+00:00,1313829851439132672,'An embarrassment': Trump tweet angers pandemic survivors https://t.co/xlB8XMJVES,IwanSchana
Central Coast,2020-10-07 08:11:42+00:00,1313753855776047104,"I’m away this week (first real break since this pandemic hit 😩) so my team decided to theme our weekly #Zoom meeting Me!🤣 Seems coloured glasses, Bowie and beads are my signature thing 🤣 I guess they miss me 🤣 #CultureChamps 💕 my team! @jodieingles27 @UTS_GC https://t.co/S7OjvotPS6",nanherlihen
Central Coast,2020-10-06 10:35:39+00:00,1313427696907513856,Calling it. During a global pandemic and worst economic downturn since 1929 we have also the worst budget in living memory #auspol #MorrisonRecession #Budget2021,bigtruth2
Central Coast,2020-10-05 09:53:55+00:00,1313054803593850884,"@GordyPls Wonder if they opened a support case and MS had to play the EULA card?

I’m sorry, the agreement you made when you purchased the license specifically excludes its use for pandemic response. It’s in there with space flight and nuclear reactors.",AUSFestivus
Central Coast,2020-10-04 04:18:43+00:00,1312608062956429313,"@Jukes01 @Balkanite87 @pmens72 ""I honestly don't understand all the hate for Trump""🤣
I really don't know where to begin Joe, you must have been living under a rock these past 4 years.
Whether it's the pandemic, action on climate change, strengthening relationships with allies etc...he has failed as a leader.",hecivan70
Central Coast,2020-10-03 13:38:00+00:00,1312386422712659973,@flamingo_a_gogo @RonniSalt @abcsydney IMO showing the useless PM in the middle of a pandemic in concert with greatest downturn of the economy since 1929 is so hard working for his country that he has chosen to make chicken coops is a massive slur on his utterly absent leadership skills. It’s like Hawaiian hols 2.0,bigtruth2
Central Coast,2020-09-29 11:25:10+00:00,1310903442626326528,@twensor @juliasilvertop @MrSirUgly @ScottMorrisonMP Should of had the pandemic insurance Wimbledon hooked up.,kaeleneak
Central Coast,2020-09-25 23:50:54+00:00,1309641560124915712,"@MicallefPhilip @FFA @ALeague @TheWorldGame I'm over it tbh Phil.
I still take interest in what is happening concerning the Jets and the A-League but for me some of the passion ""the fire"" has gone.

Also, the pandemic has highlighted just how much influence RL has at a political level in NSW.",hecivan70
Central Coast,2020-09-22 08:50:12+00:00,1308327726776872961,"Murdoch's tentacles reach far and wide. Going by this logic, alcohol should be banned too because it kills people😳
Yep lets unleash the pandemic so hospitals get totally inundated because hey worst case scenario is ""only"" 200 deaths/day for the UK. https://t.co/gq6e65L1TH",hecivan70
Central Coast,2020-09-21 10:55:33+00:00,1307996885664198657,"More than egg on face, these cretins have influence that motivates idiotic &amp; sometimes criminal behaviour. In difficult and pandemic times this can escalate disproportionately. 
Nice for the rags and corps. they work for no doubt. But tough on Dan and support and health warriors! https://t.co/L13t1KgENt",dapoppagraham
Central Coast,2020-09-18 23:19:41+00:00,1307096987964235778,"@sophieelsworth You're tweeting yourself into a shameful section of history that'll mock, not only your failure to contribute anything of value towards defeating this pandemic, but actually doing your best to place us amongst the nations' whose dismal response is leading them and us to disaster!",dapoppagraham
Central Coast,2020-09-14 00:32:07+00:00,1305303277869780992,"for Queensland Head Doctor as Morrison government whips up Trumplike hysteria saying borders should open like Europe....
This PM cannot manage a disaster as the fire and COVID pandemic has seen. 
He is the disaster we can avoid #AUD pol",bigtruth2
Central Coast,2020-09-11 04:07:10+00:00,1304270233524408320,@australian Helpful article in the middle of a pandemic. Must be so proud of the public health stand your paper has taken #auspol,bigtruth2
Central Coast,2020-09-11 03:25:31+00:00,1304259751572844546,@OccupyMyGov Got me some pandemic insurance.,kaeleneak
Central Coast,2020-09-10 00:13:45+00:00,1303849104586334208,"Golf was one of the few sports that could continue during the pandemic and now Lake Macquarie golfers have even more reason to sharpen their skills, with a new driving range opening up at Toronto Country Club. @nbnnews https://t.co/uEtXuSBvYf",LydiaBilton
Central Coast,2020-09-09 22:27:55+00:00,1303822472215584768,"Why are celebrities allowed to travel around Australia without restrictions when families aren’t allowed to visit a dying loved one?
#Hypocrites #lockdown #celebrities #anger #pandemic",lawless_author
Central Coast,2020-09-09 01:17:53+00:00,1303502857589547008,"Agree  aupon her passing,  with 'labour  weekend '   rename it, paying extra taxes or increase to rebuild the economy yes taxes is not everyone best friend with this pandemic need to look forward https://t.co/xAy59O6IOx",Zarah63Nina
Central Coast,2020-09-09 01:03:41+00:00,1303499284675928064,@nakkiahlui Every human service that has been privatised immediately turns their focus to profit over the quality of service. The greedy are profitting from this pandemic.,bevhenwood
Central Coast,2020-09-08 03:04:40+00:00,1303167339232337922,"@DeanRosario @PoshVictory Ultimately we are still in the midst of the pandemic and It's probably still premature to make any assertions until we probably get through the ""other side"" and can make an overall judgement. 
Cases in some European countries have for eg once again exploded.",hecivan70
Central Coast,2020-09-07 01:22:23+00:00,1302779212235898881,Commentary on what NOT to do in a pandemic. https://t.co/n1Rcvk1Qti,MJA_Editor
Central Coast,2020-09-06 00:20:51+00:00,1302401341260591110,@mister_wynn @mcreal15 What did she have to say aboutvthe businesses who have reached record profits during the pandemic?,bevhenwood
Central Coast,2020-09-05 10:21:06+00:00,1302190010561523712,"So we have a worldwode pandemic to persevere with and you're asking the Premier to to avoid 100 % of people with the obvious difficulties that presents!
Are you playing politics? https://t.co/ZZCIM5LDUD",dapoppagraham
Central Coast,2020-09-03 07:23:05+00:00,1301420433892208642,How to Stop the Next Pandemic https://t.co/PookTIveu2,alison_hutton
Central Coast,2020-09-02 23:42:39+00:00,1301304561127190528,You don’t have an embarrassment gene at all do you?? What about the “National Government plan” ?? Sadly you lot led us down this path with a very weak economy leading into the pandemic and are offering nothing but attacking State leaders as a way out. You ARE the National govt https://t.co/2XoB19Jcqd,bigtruth2
Central Coast,2020-09-02 05:08:20+00:00,1301024136966201346,"@BenFordhamLive @TimSmithMP A Tragedy is 1 million people dying 
Or black deaths in custody 
Or small children with terminal disease 
Having a AFL Grand Final played in another state is what is required in a  pandemic 
Mr Smith needs to reassess the real priorities",RoyanWg
Central Coast,2020-09-01 08:41:01+00:00,1300715272022536193,Being free from COVID (with your entire family here and in the Philippines) this far is super blessing in midst of this pandemic.. salamat po Father God 🙏 and may You continue to protect… https://t.co/nCfJUpKXpq,tulips0228
Central Coast,2020-08-31 20:20:51+00:00,1300529001715253254,"@LouiseRawAuthor They know how much better off Britain would be if he was PM. Instead we have a double whammy of an ignorant Tory and a pandemic he has done nothing to tackle, aided by an austerity opposition.",djmarley6
Central Coast,2020-08-31 02:55:40+00:00,1300265975288270848,"The curve has finally been flattening the past week in Vic with Restrictions most likely to be eased in less than a fortnight, so what does farkwit Newman suggest...to have a mass protest in the CBD🤪
Nearly 80k new cases in India alone would indicate this pandemic is not over. https://t.co/iUxIA3ZFG2",hecivan70
Central Coast,2020-08-30 10:21:30+00:00,1300015781304913920,"@GemmaTognini First and foremost I'd be questioning the corruption rampant within the Federal government...the vested interests, the kick backs, jobs for mates, the rorts etc
In dealing with a pandemic, of course our politicians are going to take on the advice of health experts...you moron😳",hecivan70
Central Coast,2020-08-25 10:52:44+00:00,1298211705755848704,@MagdaSzubanski That is disgusting 😡 I’m so sorry that you are being bullied line this when all you were trying to do was help people’s mental health through this pandemic. Your are a national treasure and is much loved ♥️♥️♥️,NaomiCranfield1
Central Coast,2020-08-23 21:46:01+00:00,1297651333906874368,Managing Change in a Pandemic https://t.co/roUAu33Jbq,Sandnicoll
Central Coast,2020-08-22 22:21:32+00:00,1297297882681245697,@vanOnselenP The whining of privilege strikes a discordant note in a pandemic that has killed millions and will kill millions more if it is allowed to run riot. Just shut up.,djmarley6
Central Coast,2020-08-21 02:56:24+00:00,1296642278589493252,"Uh Flybuys, you know there’s a pandemic on and the borders are closed, right? 🙄 https://t.co/f19p9k9tOR",CJ_Levinson
Central Coast,2020-08-20 09:36:36+00:00,1296380606868107265,Extremely proud and privileged to be part of @TheMatilda_USyd and @BHPFoundation COVID-19 Mental Health think tank and contributing to building our resilience and recovery from this pandemic @UON_research https://t.co/4Bp6Q4Ucf3,ProfFranKayLamb
Central Coast,2020-08-20 09:21:49+00:00,1296376884956037122,"@sophieelsworth FCS what parts of this unprecedented pandemic do YOU have an alternative solution for?
Your next dozen tweets, illuminate for the saving of the planet!
We'll be forever grateful, not to mention the elimination of your Dantweet obsession.",dapoppagraham
Central Coast,2020-08-19 23:57:47+00:00,1296234941735297024,"Great leverage of @Twitter @TwitterDev API to study bot behaviour in #COVID pandemic. Disinformation also has #publichealth impacts, undermines trust. Analysis of bot motivators would be good follow-on study. https://t.co/A6tzhO0MLe",laughingmind
Central Coast,2020-08-19 09:54:03+00:00,1296022610220732416,"A Pandemic joke.
A man walks into a bar.
Lucky bastard.
#pandemicjoke #pandemiclife #lockdown",lawless_author
Central Coast,2020-08-19 00:39:26+00:00,1295883035783487489,"Inspiring words from Ronni Kahn about using space created by the pandemic to reflect on our core selves; find our own sense of what purpose is; and live that life in a meaningful way. Importantly, “make the biggest impact we can on those around us” #workplacewellnessfestival",rehabinnovat
Central Coast,2020-08-19 00:23:43+00:00,1295879080336752641,"@normanswan says uncertainty during the pandemic is affecting us all, but “we will get through this”. He encourages healthy eating and regular movement to maintain physical and psychological wellbeing during this time #workplacewellnessfestival @LizDitton @gillyminn @CRI_Director",rehabinnovat
Central Coast,2020-08-18 23:16:02+00:00,1295862047557574657,@BethanyinCBR Dangerous leader... in the world of a pandemic’s and climate change,bretto_dudley
Central Coast,2020-08-18 20:53:02+00:00,1295826059871391744,Mask or no mask? This simple ethical approach can help with your pandemic etiquette https://t.co/y5smdXx286 via @ConversationEDU,RhondaWilsonMHN
Central Coast,2020-08-17 23:14:30+00:00,1295499272826150913,"This 100% from @MikeCarlton01 
Andrew Bolt is a vile, compassionless human being at the best of times but the pandemic has exposed another ugly aspect to his character... https://t.co/1yJMyWKC2U",hecivan70
Central Coast,2020-08-16 19:43:15+00:00,1295083721209425920,"#running Brady's Gully to Wingello Creek. The #pandemic = exploring and discovery of more local trails. A wet and boggy one in #Wyoming, #NSW https://t.co/J54AeJAhhg",baker_and
Central Coast,2020-08-16 09:53:10+00:00,1294935223038177282,"@recneps51 Yes, I've read recently too that the Spanish Flu actually originated in the good ol USA. Kind of hypocritical that Trump has been labelling covid19 the China Flu but the poor Spaniards have been unfairly given ""naming rights"" to the 1918-19 pandemic!",hecivan70
Central Coast,2020-08-15 05:05:11+00:00,1294500361147826176,It’s just such an inappropriate business model &amp; it’s thanks to this Covid pandemic that we all have seen how frightful it is (if there is anything to be thankful for!) https://t.co/8YCit3Gefx,BZElkie
Central Coast,2020-08-13 06:25:36+00:00,1293795822081957890,Our New Editorial - From Crisis to Coordination: Challenges and Opportunities for Integrated Care posed by the COVID-19 Pandemic: https://t.co/wLGyzUxZV3 @CCoastHealth @Uni_Newcastle @IFICInfo @AusHealthcare,goodwin_nick
Central Coast,2020-08-13 02:23:58+00:00,1293735015423963136,Showing again what poor economic managers the Morrison government actually is and how they are trying to use the COVID pandemic to cover there incompetence #auspol https://t.co/y47Ht9101B,bigtruth2
Central Coast,2020-08-10 23:37:21+00:00,1292968306656198656,@GuardianAus as horrible as this is in a global pandemic if people don't want to wear masks than they need to stay at home it's really just that simple people need to stop trying to find excuses not 2 follow medical advice for the good of all of society,unclecraigums
Central Coast,2020-08-10 23:20:09+00:00,1292963979812208642,"@Frank__Davies The most absurd of many utterances Trump has made during the pandemic was when Trump said in June: ""If we stopped testing right now, we'd have very few cases""🤪🤡
He truly is mad...and dangerous!",hecivan70
Central Coast,2020-08-10 19:08:04+00:00,1292900541433933824,For alcohol/gambling indty pandemic represents a unique marketing n sales opportunity aided n abetted by some complicit govts @peter_g_miller @lewest @KatedaCosta1 @ncdalliance @AsiaPacAPA @alikjones @dianehmartin https://t.co/jmkL4Ey6Vq,tony4newcastle
Central Coast,2020-08-08 09:42:04+00:00,1292033326090346497,"So during the pandemic when so many businesses are going to the wall and people losing superannuation &amp; jobs, this vile creature gets a pay rise!  A real pm (Jacinda) would have taken a cut  #auspol #empathyBypass

#ScumMo to get $10k pay rise https://t.co/YOC6nxIYkP via @SBSNews",mkentwell
Central Coast,2020-08-06 15:13:28+00:00,1291391949560152070,@GeoffM75 @Kidcowboy2 N I travel where work takes me n sadly state governments making that hard but I do what’s required n get paid!!N paid well but I will say this (pandemic)😂 costing us all n our kids n most likely their kids but hey let’s lock down again 🤦‍♂️🤷‍♂️n have curfew 🤦‍♂️smart virus curedflu??,trsports81
Central Coast,2020-08-06 02:23:56+00:00,1291198290210574337,@b_leeder @C_Corday @DavidLeyonhjelm Do you know the history of the 1918 1919 pandemic ? . People like you caused the death of 15 000 others .,Mangohippy
Central Coast,2020-08-05 22:28:31+00:00,1291139046983364608,Sign the petition: We need national paid pandemic leave https://t.co/OQRmslAfRA,unoauntymark
Central Coast,2020-08-04 12:15:19+00:00,1290622341664268289,"Eh, W.T.A.F are people doing going on cruise ships in July during a global pandemic where the worst possible place to be was proven unquestionably to be on a cruise ship?!! 😷🤯🤧🦠🚢
https://t.co/rep8Odcooq via @illawarramerc",Dublinactor
Central Coast,2020-08-04 11:04:52+00:00,1290604610386669569,@PatDollard1 @mprpearson That is so strange. I’m getting the urge yet again during this pandemic to re-read Blindness by Jose Saramago.,eleaud
Central Coast,2020-08-03 10:57:02+00:00,1290240253702234114,@prudinx The proliferation of Casual labour is a blight on our society. It's coming home to roost now during this pandemic the negative impact it's had on so many levels.,hecivan70
Central Coast,2020-08-03 10:39:35+00:00,1290235862270087169,"@asu_nsw_act @sallymcmanus @leighsales 100%👊
The pandemic has exposed how the heavy reliance on a casualized workforce is a liability on our society. It breeds instability and insecurity and has been a major factor in the spread of the virus.
People need job security...that is how you build a functional society!",hecivan70
Central Coast,2020-08-02 08:18:50+00:00,1289838053935083521,"@Adam_Creighton It's a pandemic you f#%kwit.
Do you need reminding of what has happened in cities in Spain, Italy, the UK and US etc because Restrictions were not enacted quick enough???
What has ensuring the health and safety of the public got to do with ""Respect for the individual""?🤬",hecivan70
Central Coast,2020-08-02 07:12:25+00:00,1289821337251274752,"Well, dying in a pandemic is an option. https://t.co/52hGGvImoz",carolduncan
Central Coast,2020-08-02 06:05:11+00:00,1289804419312128001,"@australian No politician could be re-elected overseeing a recession soon to be depression and tens of thousands dying from a pandemic.
Greg's in La La Land.",brushhandsigns
Central Coast,2020-08-02 04:27:12+00:00,1289779761179324416,@MagdaSzubanski @MpBev @McDonalds I have been working with cash all through this pandemic..myself and my coworkers have not been sick or gotten corona..It’s safe to use cash as long as you follow the rules and wash your hands..As you should always do when handling cash,katrina0405
Central Coast,2020-08-02 00:11:57+00:00,1289715525099036672,@Jessifer @Kosher_Weaver @Lollardfish Yes.  Requiring preventative measures during a pandemic is one thing - compulsory collecting and recording personal health information is quite another.,JonPowles
Central Coast,2020-08-01 00:26:25+00:00,1289356776115073024,"@AusOpinion @australian @vanOnselenP Hard to see what feds do these days.
Bushfires and Pandemic show States do the real governing.
Should have turned the colonies into seperate countries instead of Federation back in 1901.",brushhandsigns
Central Coast,2020-07-31 23:34:16+00:00,1289343653933015040,"Spare a thought for the UK at the moment, not only are they suffering through a pandemic, but they’re currently also battling a heatwave strong enough to melt an ice cream in the sun ☀️ 😒 https://t.co/Vmvo3ZnqX4",notelvey05
Central Coast,2020-07-31 10:21:17+00:00,1289144091033219072,"@Jukes01 Come on Joe, he's been pushing to open up the economy for ages, now all of a sudden he thinks it's too risky to hold elections. Trump doesn't deserve any ""benefit of the doubt"" as his approach to the pandemic has been incompetent and inconsistent since the beginning.",hecivan70
Central Coast,2020-07-31 07:42:39+00:00,1289104170708959232,@Bluestethgirl @peteevansnot Her nursing home has gone above and beyond throughout this pandemic.,KristenJayne1
Central Coast,2020-07-29 05:11:19+00:00,1288341313205596160,"@bevpaterson Hi Bev, I am doing MAE so it’s a bound volume of chapters on malaria epi and surveillance in the Solomons, a program evaluation in PNG, an outbreak (pandemic!) and the capacity building work I’ve been a part of. I enjoy writing a lot, but I love (and miss!) being in the field 🌴",s_wheeler_
Central Coast,2020-07-28 13:08:01+00:00,1288098888063135747,@WLB236 @RoyalAged @CorpGovResearch @anmf @k_eagar So sad it has taken a pandemic &amp; needless deaths to hightlight an issue that has 20yrs of inquiries &amp; reports. @agedcare could have been fixed many years ago. No #political or #bipartisan will. Those of us working in #agedcare have been telling this story but no one listening....,Blanch68L
Central Coast,2020-07-28 08:18:33+00:00,1288026041307414529,For the first time in a long time the pandemic forced us to asses the impact of our actions on others. #LookingAhead #UoN https://t.co/yMhsNkHZUj,digitaldocs
Central Coast,2020-07-28 08:01:47+00:00,1288021821233586178,Great panel for Paradox of a Pandemic #LookingAhead @Uni_Newcastle @UON_CEEHE @EdArtsUON @ntowney @fischettij https://t.co/YD1y5Y20qH,CathyColeborne
Central Coast,2020-07-28 07:31:57+00:00,1288014314780028928,@BiodiversityGuy @ARC_Tracker Had literally planned my whole year around having January February to polish it up. Now it's due when I'm basically teaching full time. In a pandemic.,sawsharkman
Central Coast,2020-07-28 07:26:57+00:00,1288013058632081408,Impressive opening comments to Paradox of a Pandemic by an #international #student Rubimbo Visango @Uni_Newcastle #LookingAhead @EdArtsUON @ntowney @fischettij,CathyColeborne
Central Coast,2020-07-26 07:48:04+00:00,1287293594244587525,"@DeanChong2 @ShayneRarma @Buddha14 The origins of the pandemic are irrelevant. Countries like Sth Korea and Vietnam are neighbours with China and have controlled it.
Trump first labelled it a hoax, then downplayed it, all these mixed messages from his leadership have led to the mess the US now finds itself in.",hecivan70
Central Coast,2020-07-26 07:22:12+00:00,1287287087234859008,"@DeanChong2 @ShayneRarma @Buddha14 With Russia's presence in Syria, it was a smart move to withdraw US involvement to prevent a potential catastrophe there🤔
Overall his term in office has been overwhelming bad, highlighted by his whole handling of the pandemic.
The US is in decay and in a mess.",hecivan70
Central Coast,2020-07-26 03:39:55+00:00,1287231144170123265,"@sexenheimer These Bunnings employees should've just gone to their Manager,  who should've then called the police. Let her get on her soapbox trying to explain to them why she is ignoring a Health &amp; Safety protocol during this Pandemic.",hecivan70
Central Coast,2020-07-26 02:50:58+00:00,1287218825826463744,"@carolduncan @Bunnings 😡😡😡
The arrogance and selfishness of this woman totally pisses me off.
She just wanted a confrontation here...blabbing on about a 1948 Discrimination Act🤪
We are in a Pandemic FFS and the communities best interests are &gt;&gt;&gt; then her selfish ""rights"" to be a #COVIDIOT",hecivan70
Central Coast,2020-07-25 06:12:12+00:00,1286907081501495297,"Not only during a global pandemic .... wellbeing of all our staff and students is key to a happy, healthy and productive schools #lovewhereyouwork @KotaraSthPublic @kotaracos @GlenrockNetwork @nswppa @NSWEducation @NSWSLI https://t.co/UHsnzm0elb",suemaxworthy
Central Coast,2020-07-23 10:21:21+00:00,1286245005120561152,"@BCFerrys You had me at hi 👋, due to the pandemic",AussieEcom
Central Coast,2020-07-21 00:23:14+00:00,1285369709483835392,"@Raymartin55 Do the 1.5
Wave to your mates
Put a mask on, it’s great
Sanitise
Isolate
And learn that we are in a pandemic mate.",kaeleneak
Central Coast,2020-07-20 17:36:23+00:00,1285267321422929920,"3 months ago this #COVID19Aus  pandemic was “new”, so little evidence for #MasksOn #Masks4All Now there is evidence they are effective at a #community level. #WearAMaskSaveLives #maskup #evidencebasedpolicy #ScienceMatters #WearADamnMask",Jenntrix
Central Coast,2020-07-20 17:34:09+00:00,1285266762003443712,"@mjchippy77 @newscomauHQ 3 months ago this #COVID19Aus  pandemic was “new”, so little evidence for #MasksOn #Masks4All Now there is evidence they are effective at a #community level. #WearAMaskSaveLives #maskup #evidencebasedpolicy #ScienceMatters",Jenntrix
