City,Datetime,Tweet Id,Text,Username
Central Coast,2021-03-08 23:51:22+00:00,1369073287129493504,So whose responsible for misleading people #fox #FoxNews #coronavirus #trump #pence https://t.co/JKZbCJ7ora,davidsguest
Central Coast,2021-03-07 04:42:28+00:00,1368421769120346113,"Czech Republic has basically run out of hospital beds due to the massive spike in coronavirus cases and is asking for neighbouring countries to take in sick people.
Those who still feel our State Premiers went too hard with Lockdowns need to read this...
https://t.co/cCE4nIEuBy",hecivan70
Central Coast,2021-03-06 00:37:39+00:00,1367997771458879490,"“Australian Trade Minister Dan Tehan and the EU's top trade official have held talks after Italy blocked a shipment of 250,000 AstraZeneca coronavirus vaccine doses set for Australia.” https://t.co/TuKg8dmC9V",carolduncan
Central Coast,2021-03-05 23:30:01+00:00,1367980750948036610,@BenBramble we were never going to get the @AstraZeneca #coronavirus #vaccine quick my own common sense tells me that we are not losing people like Europe @ScottMorrisonMP likes to throw grand statements out to look great but we’re never the #truth we have been played,meekjulie
Central Coast,2021-02-13 22:43:55+00:00,1360721390144430080,"@twitmitch ""The vaccine will protect a person who receives it by lowering their chances of getting COVID-19 if they encounter the coronavirus."" https://t.co/ygQti433bQ",mediahunter
Central Coast,2021-02-13 22:43:26+00:00,1360721269876920321,"@MsLaynieK ""The vaccine will protect a person who receives it by lowering their chances of getting COVID-19 if they encounter the coronavirus."" https://t.co/ygQti433bQ",mediahunter
Central Coast,2021-01-27 09:01:17+00:00,1354353776447037441,"Tony Abbott attacks ""coronavirus hysteria""...well piss off back to the UK then. If it's all ""hysteria"" why didn't you stay there you arsewipe!!!
https://t.co/niHmlVPMAH",hecivan70
Central Coast,2020-12-15 22:06:43+00:00,1338968757960495105,"Mundo: Preocupado com o Coronavírus e a vacina. 

Austrália: Recorde de praga de cigarras em NSW e algumas enchentes por causa da chuva. ZERO novos casos de coronavírus.",hnrqfelix
Central Coast,2020-12-09 01:58:36+00:00,1336490399037227014,We don't need this negativity in 2020! #cyclops #xmen #lockdown #coronavirus #marvel https://t.co/9IUwshku6A,sindelism
Central Coast,2020-11-29 00:41:37+00:00,1332847146735865861,"Some are still throwing the dictator tag at Dan Andrews and refuse to believe just how serious Coronavirus is😳
What is it that so many want to believe that there is some sort of conspiracy behind what is a pandemic? https://t.co/Rtx8zZ434a",hecivan70
Central Coast,2020-10-02 05:09:56+00:00,1311896172437467139,Yowza. “US President Donald Trump says he has tested positive for COVID-19 after close senior aide Hope Hicks tests positive for coronavirus” https://t.co/ZpwcFKGHaT,AinslieClaire
Central Coast,2020-09-30 15:23:06+00:00,1311325705125330945,"More than 1 million people have died from COVID-19 since the coronavirus was first identified late last year in China, according to data compiled by Johns Hopkins University https://t.co/TlW1EUplfn",IwanSchana
Central Coast,2020-09-05 18:29:02+00:00,1302312804020486144,Anti-lockdown Melbourne activist can't talk about ANYTHING coronavirus https://t.co/Gbwq6V6Bif,IwanSchana
Central Coast,2020-09-04 06:34:23+00:00,1301770568736284672,Coronavirus Australia: Scott Morrison’s hopes of reopening state borders crushed https://t.co/u6KRbKdjvP,IwanSchana
Central Coast,2020-09-02 13:18:20+00:00,1301147450070020096,"#Oliverscampaign Sad to see that for the first time in History, Australia is now in Recession  #coronavirus",PaulaMc007
Central Coast,2020-08-31 03:45:30+00:00,1300278516034883586,Coronavirus crisis: Scott Morrison slams ‘amoral and hideous’ suggestions elderly should be sacrificed | PerthNow ⁦@Peter_Fitz⁩  https://t.co/h0kfcvpDsh,trishgl54
Central Coast,2020-08-30 08:33:07+00:00,1299988507713089537,@Dr_J_Underwood @EdHutchison @DrLindaDykes #Oliverscampaign A good diet and healthier lifestyle will help your body fight most things but it won't prevent you from catching airborne infections. We haven't yet got immunity from #coronavirus,PaulaMc007
Central Coast,2020-08-30 08:30:08+00:00,1299987757251526658,@EdHutchison #Oliverscampaign Who said diet would protect a person from #coronavirus,PaulaMc007
Central Coast,2020-08-29 07:44:53+00:00,1299613980164419586,This is one time I’m thankful for coronavirus. The drive home from Tamworth would not have been a pleasant one...,MareeEdwards4
Central Coast,2020-08-20 08:39:21+00:00,1296366199123505152,"The hidden impact of coronavirus on Gypsy, Roma Travellers via @TC_Africa https://t.co/yOeiBmCb2z",RhondaWilsonMHN
Central Coast,2020-08-17 14:19:53+00:00,1295364731704766467,Coronavirus or flu? Officials warn Australians not to write off winter sniffles as testing rates drop https://t.co/6SEH6NqmZw,IwanSchana
Central Coast,2020-08-17 05:48:35+00:00,1295236060247719937,"When the old is taken away (by Coronavirus or not), what is the new?
Never seen before how immediately and prominently Paul the Apostle answers that question in 2 Cor 5:17-20. 
When all things become new, the new is… https://t.co/IoPi5vyFzt",MissShazJones
Central Coast,2020-08-06 05:50:37+00:00,1291250305779118082,"Hockey shut-down in the News!
Newcastle hockey centre closed as community sport deals with latest coronavirus cases https://t.co/TuCzTIO6Tn via @newcastleherald",NorthsHockey
Central Coast,2020-07-04 07:20:24+00:00,1279314098899922944,@heatherpeace Agreed! Coming to Australia after all this coronavirus is over? Stay safe💜,Leah18444379
Central Coast,2020-05-22 02:11:09+00:00,1263653596752568321,Would really like to know who joined the All Staff Forum as “Coronavirus” and “Donald Trump.”,erinannmcc
Central Coast,2020-05-17 23:23:06+00:00,1262161753690894338,Three Queensland Reds rugby players stood down after refusing to accept salary cuts in the wake of the coronavirus pandemic https://t.co/etZQ5PhQpg,LloydRothwell
Central Coast,2020-05-15 06:43:59+00:00,1261185540012929024,"Former A’s manager Art Howe, portrayed by Philip Seymour Hoffman in the movie Moneyball, is in hospital battling coronavirus https://t.co/CnDtrxmr5L",LloydRothwell
Central Coast,2020-04-19 04:35:21+00:00,1251731083986522113,"Colleague using work email to spread Chinese coronavirus theories. I've told them most of what they've said can be de-bunked with a Google search when really I should've just said, 'You realise this is a work email, yeah?'",abstalavista
Central Coast,2020-04-14 03:05:32+00:00,1249896542628007938,Proposed Women’s Australian Baseball League which was due to start in 2021 may be delayed due to the broader impacts of Coronavirus https://t.co/oS8VzSmomF,LloydRothwell
Central Coast,2020-03-13 10:49:37+00:00,1238416920816185346,"https://t.co/FWbunyQpJF advice. • “If you have been in close contact with a proven case of coronavirus, you must isolate yourself for 14 days from the date of last contact with the confirmed case.” #covid19australia #ScottyFromMarketing",BrenSurfer
Central Coast,2020-03-13 07:22:38+00:00,1238364834858594304,"Australia: 'I wouldn't wish coronavirus on anyo-' 
#coronavirusaus #auspol #dutton https://t.co/oRpdp1kHPa",abstalavista
Central Coast,2020-03-13 07:09:37+00:00,1238361558356389888,"So has our PM be in contact with @PeterDutton_MP ? If so going to a large event, say the footy for example is probably not a great idea! #coronavirus #covid19australia #COVID19 #ScottyFomMarketing #auspol #scottmorrison @LNPQLD #lnp @LiberalAus #CoronaAlert",mon_marsh
Central Coast,2020-03-13 07:02:55+00:00,1238359870232875009,So if Dutton has coronavirus and he has been at meetings of cabinet etc does that now mean the entire cabinet need to go into self isolation for 14 days? Fingers crossed #auspoI,bigtruth2
Central Coast,2020-03-13 05:42:39+00:00,1238339672541020160,"@carolduncan @SeanBradbery If the PM had listened and taken advice from the experts months ago and acted proactively we would've been better prepared for the devastating bushfires. 
Now it would seem he is being just as blase about the increasing threat of the coronavirus. 
MORRISON IS INCOMPETENT!!!",hecivan70
Central Coast,2020-03-13 04:59:47+00:00,1238328885000847360,"Things to add to list that are just a poor #remotework fit: building #submarines Dang. Submarine builder shuts down operations after worker tests positive to coronavirus
 https://t.co/AvADOQ4aVw",laughingmind
Central Coast,2020-03-13 04:06:43+00:00,1238315528365563904,I just signed a petition to demand paid special leave for all Australian workers affected by Covid-19 #coronavirus #auspol Pls sign &amp; RT &gt;&gt; https://t.co/1NLs1n1g4A via @MegaphoneAU,RGratton
Central Coast,2020-03-13 03:13:43+00:00,1238302191305162752,"Currently waiting at new #Sydney #NorthernBeaches #Hospital for #coronavirus testing

20 people told to sit in garden for more than an hour so far no information, no masks given out &amp; no nurses available 
#weareunprepared @James_HGriffin @ScottMorrisonMP @GregHuntMP #auspol @smh https://t.co/XKoM1j9f97",adrianmcgregor
Central Coast,2020-03-12 23:14:04+00:00,1238241882049634304,Now confirmed Australian GP CANCELLED #f1 #supercars #coronavirus,SplashyWindow92
Central Coast,2020-03-12 23:10:36+00:00,1238241007629561857,Can we sue government if we go to “footy” on PMs advice and contract Coronavirus? #auspol https://t.co/0Rm0l67aE4,bigtruth2
Central Coast,2020-03-12 21:18:53+00:00,1238212895109812225,"This #coronavirus is ruining people's lives.....its stopping sporting event's round the world. Not good enough Corona Virus, you have proved your point now fuck off",deformo96
Central Coast,2020-03-12 21:07:25+00:00,1238210009449656320,"Uma coisa em relação ao coronavírus é certeza: desdenhou, pegou.",hnrqfelix
Central Coast,2020-03-12 19:18:35+00:00,1238182618220265472,"@Adam_Creighton .. in case you've been under a rock the economy has crashed. It's tanking harder than the Hindenburg if you've been paying any attention, but let's not blame #coronavirus for that, because you &amp; I both know economists predicted this crash years ago. There's articles and stuff. 😐",rputland
Central Coast,2020-03-12 19:14:26+00:00,1238181573314228224,@Adam_Creighton The #CoronavirusPandemic hasn't even started to climb it's mountain to it's peak in most countries around the world you ill-informed twatwaffle. Pandemics can take 2-3 months to hit it's peak once unleashed. Time for a solitary shut your word hole pill maybe? 🖕🤐 #coronavirus,rputland
Central Coast,2020-03-12 18:59:36+00:00,1238177841692307456,"@cenkuygur Congresswoman Porter seems to have forced the Director of the CDC's hand recently by having him acknowledge that the costs involved for testing, treating &amp; quarantining #coronavirus would be fully covered by the CDC. Is this now set in stone or are there further hurdles?",rputland
Central Coast,2020-03-12 18:51:46+00:00,1238175871027957760,"@AlvarezHashi @Prospector105 I'm afraid that they'll be the ones who will be the end of us all, because let's be honest, they're going to claim #coronavirus is a deep state hoax designed to undermine their Führer and completely ignore any quarantine measures or health precautions. 😷🤬",rputland
Central Coast,2020-03-12 11:38:30+00:00,1238066836534480897,"I could think of worse things than being quarantined for 14 days for our own safety. 

Like....getting the coronavirus. 

We'll all still have our devices. 
We'll all still have Netflix.

Not that big a deal.",itsAJBack
Central Coast,2020-03-12 10:50:40+00:00,1238054797825077251,Would you attend a footy match or any other large group gathering this weekend? #auspol #coronavirus #COVID19,mon_marsh
Central Coast,2020-03-12 10:43:23+00:00,1238052966096965632,Business is stuffed. The #recession without #coronavirus was already happenning. @ScottMorrisonMP  government is totally incompetent+ corrupt + weird cultist leader. https://t.co/LqpTkJrVpi,GovIn21st
Central Coast,2020-03-12 00:11:05+00:00,1237893841849479170,"maka paranoid maning coronavirus oy, di man ko mahadlok nuon pero kanang ka ubohon gud ko in public kay natuk-an ko or smth dili nalang nako dayunon kay bsing pagtuo nila naa koy coronavirus esp nga asian ko AHAHAHHAHA",janinemntflcoxx
Central Coast,2020-03-11 21:39:11+00:00,1237855614862127108,"Reuters - 'The White House has ordered federal health officials to treat top-level coronavirus meetings as classified, an unusual step that has restricted information and hampered the U.S. government's response to the contagion, according to four Trump administration officials.' https://t.co/fBMMbBFya9",GlendaIkundi
Central Coast,2020-03-11 16:34:07+00:00,1237778842296582144,"'Woi will deciode who comes to our country with coronavirus, and the circumstances in which they contaminate the Australian Grand Prix! https://t.co/IGFwRx3Ncv",shootin4love
