City,Datetime,Tweet Id,Text,Username
Newcastle,2020-10-04 04:18:43+00:00,1312608062956429313,"@Jukes01 @Balkanite87 @pmens72 ""I honestly don't understand all the hate for Trump""🤣
I really don't know where to begin Joe, you must have been living under a rock these past 4 years.
Whether it's the pandemic, action on climate change, strengthening relationships with allies etc...he has failed as a leader.",hecivan70
Newcastle,2020-09-29 11:25:10+00:00,1310903442626326528,@twensor @juliasilvertop @MrSirUgly @ScottMorrisonMP Should of had the pandemic insurance Wimbledon hooked up.,kaeleneak
Newcastle,2020-09-25 23:50:54+00:00,1309641560124915712,"@MicallefPhilip @FFA @ALeague @TheWorldGame I'm over it tbh Phil.
I still take interest in what is happening concerning the Jets and the A-League but for me some of the passion ""the fire"" has gone.

Also, the pandemic has highlighted just how much influence RL has at a political level in NSW.",hecivan70
Newcastle,2020-09-22 08:50:12+00:00,1308327726776872961,"Murdoch's tentacles reach far and wide. Going by this logic, alcohol should be banned too because it kills people😳
Yep lets unleash the pandemic so hospitals get totally inundated because hey worst case scenario is ""only"" 200 deaths/day for the UK. https://t.co/gq6e65L1TH",hecivan70
Newcastle,2020-09-21 13:51:00+00:00,1308041036577435649,I’m amused that all these companies that “helped” us during the start of the pandemic are starting to really tighten up and introduce price hikes.,druey
Newcastle,2020-09-20 03:15:40+00:00,1307518763630116864,Seen today at The Bavarian Greenhills. Closed since pandemic. #mymaitland https://t.co/bIc8d5yeOt,PhilipPenfold
Newcastle,2020-09-15 18:35:59+00:00,1305938430367416320,"Criminal Corporation that has been allowed to spread COVID19 and many other diseases for decades onboard to crew &amp; passengers.
They feel they are untouchable making billions of dollars each year. 
Our small community was affected by Ruby Princess COVID19 pandemic. https://t.co/REkXLY1M8f",MicheleD2020
Newcastle,2020-09-11 03:25:31+00:00,1304259751572844546,@OccupyMyGov Got me some pandemic insurance.,kaeleneak
Newcastle,2020-09-10 00:13:45+00:00,1303849104586334208,"Golf was one of the few sports that could continue during the pandemic and now Lake Macquarie golfers have even more reason to sharpen their skills, with a new driving range opening up at Toronto Country Club. @nbnnews https://t.co/uEtXuSBvYf",LydiaBilton
Newcastle,2020-09-09 01:03:41+00:00,1303499284675928064,@nakkiahlui Every human service that has been privatised immediately turns their focus to profit over the quality of service. The greedy are profitting from this pandemic.,bevhenwood
Newcastle,2020-09-08 03:04:40+00:00,1303167339232337922,"@DeanRosario @PoshVictory Ultimately we are still in the midst of the pandemic and It's probably still premature to make any assertions until we probably get through the ""other side"" and can make an overall judgement. 
Cases in some European countries have for eg once again exploded.",hecivan70
Newcastle,2020-09-07 01:22:23+00:00,1302779212235898881,Commentary on what NOT to do in a pandemic. https://t.co/n1Rcvk1Qti,MJA_Editor
Newcastle,2020-09-06 00:20:51+00:00,1302401341260591110,@mister_wynn @mcreal15 What did she have to say aboutvthe businesses who have reached record profits during the pandemic?,bevhenwood
Newcastle,2020-09-03 07:23:05+00:00,1301420433892208642,How to Stop the Next Pandemic https://t.co/PookTIveu2,alison_hutton
Newcastle,2020-09-02 05:08:20+00:00,1301024136966201346,"@BenFordhamLive @TimSmithMP A Tragedy is 1 million people dying 
Or black deaths in custody 
Or small children with terminal disease 
Having a AFL Grand Final played in another state is what is required in a  pandemic 
Mr Smith needs to reassess the real priorities",RoyanWg
Newcastle,2020-08-31 20:20:51+00:00,1300529001715253254,"@LouiseRawAuthor They know how much better off Britain would be if he was PM. Instead we have a double whammy of an ignorant Tory and a pandemic he has done nothing to tackle, aided by an austerity opposition.",djmarley6
Newcastle,2020-08-31 02:55:40+00:00,1300265975288270848,"The curve has finally been flattening the past week in Vic with Restrictions most likely to be eased in less than a fortnight, so what does farkwit Newman suggest...to have a mass protest in the CBD🤪
Nearly 80k new cases in India alone would indicate this pandemic is not over. https://t.co/iUxIA3ZFG2",hecivan70
Newcastle,2020-08-30 22:37:03+00:00,1300200888682778625,"Dan Andrews is doomed if he does and doomed if he doesn’t loosens restrictions. People acting inappropriately have caused the mess in Victoria. Will there be another attack on him if numbers go up again if restrictions come off too early?
Stop politicising the pandemic Fed Gov",chereeONeill10
Newcastle,2020-08-30 10:21:30+00:00,1300015781304913920,"@GemmaTognini First and foremost I'd be questioning the corruption rampant within the Federal government...the vested interests, the kick backs, jobs for mates, the rorts etc
In dealing with a pandemic, of course our politicians are going to take on the advice of health experts...you moron😳",hecivan70
Newcastle,2020-08-22 22:21:32+00:00,1297297882681245697,@vanOnselenP The whining of privilege strikes a discordant note in a pandemic that has killed millions and will kill millions more if it is allowed to run riot. Just shut up.,djmarley6
Newcastle,2020-08-21 02:56:24+00:00,1296642278589493252,"Uh Flybuys, you know there’s a pandemic on and the borders are closed, right? 🙄 https://t.co/f19p9k9tOR",CJ_Levinson
Newcastle,2020-08-20 09:36:36+00:00,1296380606868107265,Extremely proud and privileged to be part of @TheMatilda_USyd and @BHPFoundation COVID-19 Mental Health think tank and contributing to building our resilience and recovery from this pandemic @UON_research https://t.co/4Bp6Q4Ucf3,ProfFranKayLamb
Newcastle,2020-08-19 00:39:26+00:00,1295883035783487489,"Inspiring words from Ronni Kahn about using space created by the pandemic to reflect on our core selves; find our own sense of what purpose is; and live that life in a meaningful way. Importantly, “make the biggest impact we can on those around us” #workplacewellnessfestival",rehabinnovat
Newcastle,2020-08-19 00:23:43+00:00,1295879080336752641,"@normanswan says uncertainty during the pandemic is affecting us all, but “we will get through this”. He encourages healthy eating and regular movement to maintain physical and psychological wellbeing during this time #workplacewellnessfestival @LizDitton @gillyminn @CRI_Director",rehabinnovat
Newcastle,2020-08-18 23:16:02+00:00,1295862047557574657,@BethanyinCBR Dangerous leader... in the world of a pandemic’s and climate change,bretto_dudley
Newcastle,2020-08-17 23:14:30+00:00,1295499272826150913,"This 100% from @MikeCarlton01 
Andrew Bolt is a vile, compassionless human being at the best of times but the pandemic has exposed another ugly aspect to his character... https://t.co/1yJMyWKC2U",hecivan70
Newcastle,2020-08-16 21:36:51+00:00,1295112310026055680,Life long friends are very special. When this pandemic is over we can catch up with those special people again yehhh💋#mondaymotivation #bestfriends #specialtimes #memoriesforlife #wewillmeetagain #covid19 @ Iona on… https://t.co/EAVeysQxIQ,WayneRogersAUS
Newcastle,2020-08-16 09:53:10+00:00,1294935223038177282,"@recneps51 Yes, I've read recently too that the Spanish Flu actually originated in the good ol USA. Kind of hypocritical that Trump has been labelling covid19 the China Flu but the poor Spaniards have been unfairly given ""naming rights"" to the 1918-19 pandemic!",hecivan70
Newcastle,2020-08-15 08:14:08+00:00,1294547910273544192,". @GladysB does the right thing making the 300+ page Ruby Princess report public immediately upon receipt, stating she’ll read and respond on Monday. Jodi McKay instead seeks to make to politics hay showing her lack of character to lead. Gladys has handled the pandemic well. 👏👏",PhilipPenfold
Newcastle,2020-08-10 23:20:09+00:00,1292963979812208642,"@Frank__Davies The most absurd of many utterances Trump has made during the pandemic was when Trump said in June: ""If we stopped testing right now, we'd have very few cases""🤪🤡
He truly is mad...and dangerous!",hecivan70
Newcastle,2020-08-10 19:08:04+00:00,1292900541433933824,For alcohol/gambling indty pandemic represents a unique marketing n sales opportunity aided n abetted by some complicit govts @peter_g_miller @lewest @KatedaCosta1 @ncdalliance @AsiaPacAPA @alikjones @dianehmartin https://t.co/jmkL4Ey6Vq,tony4newcastle
Newcastle,2020-08-05 22:28:31+00:00,1291139046983364608,Sign the petition: We need national paid pandemic leave https://t.co/OQRmslAfRA,unoauntymark
Newcastle,2020-08-04 12:15:19+00:00,1290622341664268289,"Eh, W.T.A.F are people doing going on cruise ships in July during a global pandemic where the worst possible place to be was proven unquestionably to be on a cruise ship?!! 😷🤯🤧🦠🚢
https://t.co/rep8Odcooq via @illawarramerc",Dublinactor
Newcastle,2020-08-04 11:04:52+00:00,1290604610386669569,@PatDollard1 @mprpearson That is so strange. I’m getting the urge yet again during this pandemic to re-read Blindness by Jose Saramago.,eleaud
Newcastle,2020-08-03 10:57:02+00:00,1290240253702234114,@prudinx The proliferation of Casual labour is a blight on our society. It's coming home to roost now during this pandemic the negative impact it's had on so many levels.,hecivan70
Newcastle,2020-08-03 10:39:35+00:00,1290235862270087169,"@asu_nsw_act @sallymcmanus @leighsales 100%👊
The pandemic has exposed how the heavy reliance on a casualized workforce is a liability on our society. It breeds instability and insecurity and has been a major factor in the spread of the virus.
People need job security...that is how you build a functional society!",hecivan70
Newcastle,2020-08-02 08:18:50+00:00,1289838053935083521,"@Adam_Creighton It's a pandemic you f#%kwit.
Do you need reminding of what has happened in cities in Spain, Italy, the UK and US etc because Restrictions were not enacted quick enough???
What has ensuring the health and safety of the public got to do with ""Respect for the individual""?🤬",hecivan70
Newcastle,2020-08-02 07:12:25+00:00,1289821337251274752,"Well, dying in a pandemic is an option. https://t.co/52hGGvImoz",carolduncan
Newcastle,2020-08-02 06:05:11+00:00,1289804419312128001,"@australian No politician could be re-elected overseeing a recession soon to be depression and tens of thousands dying from a pandemic.
Greg's in La La Land.",brushhandsigns
Newcastle,2020-08-02 04:27:12+00:00,1289779761179324416,@MagdaSzubanski @MpBev @McDonalds I have been working with cash all through this pandemic..myself and my coworkers have not been sick or gotten corona..It’s safe to use cash as long as you follow the rules and wash your hands..As you should always do when handling cash,katrina0405
Newcastle,2020-08-01 00:26:25+00:00,1289356776115073024,"@AusOpinion @australian @vanOnselenP Hard to see what feds do these days.
Bushfires and Pandemic show States do the real governing.
Should have turned the colonies into seperate countries instead of Federation back in 1901.",brushhandsigns
Newcastle,2020-07-31 10:21:17+00:00,1289144091033219072,"@Jukes01 Come on Joe, he's been pushing to open up the economy for ages, now all of a sudden he thinks it's too risky to hold elections. Trump doesn't deserve any ""benefit of the doubt"" as his approach to the pandemic has been incompetent and inconsistent since the beginning.",hecivan70
Newcastle,2020-07-31 07:42:39+00:00,1289104170708959232,@Bluestethgirl @peteevansnot Her nursing home has gone above and beyond throughout this pandemic.,KristenJayne1
Newcastle,2020-07-30 01:00:09+00:00,1288640490653417477,"@Serrels My wife and I really enjoy:
Pandemic + On the Brink
Carcassonne
Hive
Bannanagrams",NicholasPrior
Newcastle,2020-07-29 05:11:19+00:00,1288341313205596160,"@bevpaterson Hi Bev, I am doing MAE so it’s a bound volume of chapters on malaria epi and surveillance in the Solomons, a program evaluation in PNG, an outbreak (pandemic!) and the capacity building work I’ve been a part of. I enjoy writing a lot, but I love (and miss!) being in the field 🌴",s_wheeler_
Newcastle,2020-07-29 00:39:40+00:00,1288272946331389953,No wonder the #USA is hot fucking mess during the #COVID19 pandemic. https://t.co/eQk3W0OURI,miKeyVF
Newcastle,2020-07-28 20:45:06+00:00,1288213916716130304,This is what leadership is about. Read all of this @DanielAndrewsMP thread.  Premier Andrews sees this pandemic as a medical crisis that is affecting the economy whereas our Federal govt is seeing it as an economical crisis affected by a medical problem. https://t.co/P0Zk0y33Cq,beviesplace
Newcastle,2020-07-28 08:18:33+00:00,1288026041307414529,For the first time in a long time the pandemic forced us to asses the impact of our actions on others. #LookingAhead #UoN https://t.co/yMhsNkHZUj,digitaldocs
Newcastle,2020-07-28 08:01:47+00:00,1288021821233586178,Great panel for Paradox of a Pandemic #LookingAhead @Uni_Newcastle @UON_CEEHE @EdArtsUON @ntowney @fischettij https://t.co/YD1y5Y20qH,CathyColeborne
Newcastle,2020-07-28 07:26:57+00:00,1288013058632081408,Impressive opening comments to Paradox of a Pandemic by an #international #student Rubimbo Visango @Uni_Newcastle #LookingAhead @EdArtsUON @ntowney @fischettij,CathyColeborne
Newcastle,2020-07-26 07:48:04+00:00,1287293594244587525,"@DeanChong2 @ShayneRarma @Buddha14 The origins of the pandemic are irrelevant. Countries like Sth Korea and Vietnam are neighbours with China and have controlled it.
Trump first labelled it a hoax, then downplayed it, all these mixed messages from his leadership have led to the mess the US now finds itself in.",hecivan70
Newcastle,2020-07-26 07:22:12+00:00,1287287087234859008,"@DeanChong2 @ShayneRarma @Buddha14 With Russia's presence in Syria, it was a smart move to withdraw US involvement to prevent a potential catastrophe there🤔
Overall his term in office has been overwhelming bad, highlighted by his whole handling of the pandemic.
The US is in decay and in a mess.",hecivan70
Newcastle,2020-07-26 03:39:55+00:00,1287231144170123265,"@sexenheimer These Bunnings employees should've just gone to their Manager,  who should've then called the police. Let her get on her soapbox trying to explain to them why she is ignoring a Health &amp; Safety protocol during this Pandemic.",hecivan70
Newcastle,2020-07-26 02:50:58+00:00,1287218825826463744,"@carolduncan @Bunnings 😡😡😡
The arrogance and selfishness of this woman totally pisses me off.
She just wanted a confrontation here...blabbing on about a 1948 Discrimination Act🤪
We are in a Pandemic FFS and the communities best interests are &gt;&gt;&gt; then her selfish ""rights"" to be a #COVIDIOT",hecivan70
Newcastle,2020-07-25 23:46:07+00:00,1287172307371220992,"@xskinn I'm so pissed off to hear about your awful experience, at the hands of other Australians. It would appear that most are ill informed, ignorant and rude fuckwits. Wow, you are only following medical advice during a pandemic. It's no laughing matter. Stay safe mate! 😷",miKeyVF
Newcastle,2020-07-25 06:12:12+00:00,1286907081501495297,"Not only during a global pandemic .... wellbeing of all our staff and students is key to a happy, healthy and productive schools #lovewhereyouwork @KotaraSthPublic @kotaracos @GlenrockNetwork @nswppa @NSWEducation @NSWSLI https://t.co/UHsnzm0elb",suemaxworthy
Newcastle,2020-07-21 00:23:14+00:00,1285369709483835392,"@Raymartin55 Do the 1.5
Wave to your mates
Put a mask on, it’s great
Sanitise
Isolate
And learn that we are in a pandemic mate.",kaeleneak
Newcastle,2020-07-20 03:15:12+00:00,1285050600141410304,@lukeacl Oh so TCC have declared the pandemic over?,druey
Newcastle,2020-07-18 22:42:42+00:00,1284619633471848449,"The candle that burns twice as bright, burns for half as long due to the pandemic. https://t.co/vsp8yq5HIq",mangrovemike
Newcastle,2020-07-18 05:45:09+00:00,1284363559342727170,"@ChrisGr49000925 @SwannyQLD Federal Parliament sat uninterrupted during the far more deadly influenza pandemic of 1919.
Churchill insisted Commons sit during the Blitz because he didn't expect factory workers to attend work and politicians not.
Today's mob are a bunch of wimps.",brushhandsigns
Newcastle,2020-07-17 21:01:49+00:00,1284231858733998080,@SBSNews With a global pandemic it's interesting that the number one concern is protecting the intellectual property so that it can be profited from as opposed to addressing the pandemic on a global scale,unclecraigums
Newcastle,2020-07-16 05:12:18+00:00,1283630516151844864,"Community-led responses, the need to integrate climate action &amp;economic recovery &amp;a determination to not go back to ‘business as usual’ are key to addressing social &amp; health inequities exacerbated by the pandemic - YES! It’s not new but we need to keep saying it #HealthReimagined https://t.co/7afLYHh1OO",s_wheeler_
Newcastle,2020-07-15 20:34:52+00:00,1283500301136261120,@GladysB The pandemic appears to have a bit to run yet perhaps we might focus on public health as a number 1 priority the economy will have to take a seat and be redesigned in the aftermath?,unclecraigums
Newcastle,2020-07-14 23:20:03+00:00,1283179481834766336,"Latest reports in the US are that the state of Florida has no more ICU's available and Texas hospitals have run out of beds. Do we wait till the situation reaches those levels here in Australia before we accept...ok it is a pandemic?🤪
Alan Jones...YOU ARE A KNOBHEAD!!! https://t.co/OsXHeyFiM4",hecivan70
Newcastle,2020-07-14 22:27:04+00:00,1283166149018963968,NSW govt has effectively abrogated responsibility to combating the covid pandemic to the all powerful NSW alcohol lobby @crozi3r_john @Pat_gooley @BigAexposed https://t.co/XVYU8KFZ4H,tony4newcastle
Newcastle,2020-07-14 03:16:00+00:00,1282876471057375233,"@DonaldJTrumpJr You are obviously a Trump - blame everyone else - what exactly did you do to help the pandemic? I wouldn’t throw stones if I were you. Oh yes and learn English, you’re embarrassing yourself.",CaitrionaDowse
Newcastle,2020-07-10 23:15:07+00:00,1281728687080013824,"The number of covid19 cases dwindled to virtually zero in June. The experts were constantly warning that this pandemic was far from over but complacency crept in and now we find a ""2nd wave"" especially in Victoria is very real.
Was this inevitable or could've been avoided?",hecivan70
Newcastle,2020-07-10 09:35:51+00:00,1281522511780261890,"@Peter_Fox59 @realDonaldTrump The worst part about that Tweet is that 148k people agree with his BS. 
He has lied and spread disinformation since the beginning of this pandemic and yet so many ignoramuses still believe every word he says🤪",hecivan70
Newcastle,2020-07-08 04:28:38+00:00,1280720423437561856,"We are ‘looking at a drought of expertise, as the very people whose skills are sorely needed to handle the pandemic are on the verge of burning out’. To all of my #epitwitter &amp; #publichealth friends on #COVID19 - please take care of yourself, and let others care for you too ❤️ https://t.co/SO9fFhwrxS",s_wheeler_
Newcastle,2020-07-07 20:57:36+00:00,1280606916738154496,"🍇Throw back, to summer days and wine tours🌿
-
-
-
-
-
-
#lgbtq #lgbtq+ #gay #lesbian #pride #pridemonth #happy #bi #pandemic #prepandemic #summer #winetour #vineyard #huntervalley #wine #grapes #kmart #factorie… https://t.co/WqJ11TZD0o",imlaceyjane
Newcastle,2020-07-06 22:54:23+00:00,1280273921250476032,"@albericie @dailytelegraph It's been my life of being a Vic in NSW.

But it applies to potato cakes and footy.

Not a global pandemic.",nicklowther
Newcastle,2020-07-05 07:52:19+00:00,1279684521403641856,@newscomauHQ What is to say that this is not correct?  The origin and where it first emerged as a pandemic are vastly different.  The anti China narrative seems to make a lot of assumptions.,unclecraigums
Newcastle,2020-07-03 22:41:45+00:00,1279183575233908736,@hagsie Most of us are not. Look how well we have controlled the pandemic. But we do need to be more innovative in showing all the consequences as well as the costs of our decisions.,DrCraigGedye
Newcastle,2020-07-03 02:29:56+00:00,1278878612326739968,"@della79 But make them fashion! My friends and I were talking about this early in the pandemic, saying it would be a good idea for places like CO to sell them and make them a ‘cool’ item to get youngies to wear them.",E1MaWa
Newcastle,2020-06-29 02:56:19+00:00,1277435701382877185,"Remember when Trump predicted that the covid19 pandemic in the US would be over by Easter?
Remember when he predicted that the deaths would peak at 50-60k...then 80k?
Deaths are now 125k and the infection rate is rising rapidly again... https://t.co/CV8gvUknPy",hecivan70
Newcastle,2020-06-26 05:50:21+00:00,1276392334381346816,"@vladoblazeka Imagine how many deaths there'd be around the world by now due to covid19 if there were no restrictions and Lockdowns in place?
It's called a pandemic for a reason!!!",hecivan70
Newcastle,2020-06-25 00:47:59+00:00,1275953854807289856,@FishingDB1965 I cannot fathom to politicisation/weaponisation of GOP response to this pandemic in your country ..it’s beyond criminal ..it is evil.,Lisabiartch
Newcastle,2020-06-21 20:48:13+00:00,1274806352573894656,"@LaTrioli I heard him on radio say, and repeat, “It was tongue in cheek”... how? Don’t joke about COVID-19 and testing! 
TRump seems to dismiss the 120,000+ dead. Think of the families, husbands, wives, kids, friends who are grieving, and need testing. This pandemic is also one of grief!",georgie_hoddle
Newcastle,2020-06-21 06:05:40+00:00,1274584249920675840,"@MKrob @RNogarotto @TonyTannousTRBA @peterfilopoulos No one envisaged this pandemic and the effect it would have on society at all levels. To discuss a timetable for pro/rel at this point in time is unfortunately unrealistic.
Lets get thru this year and reassess.",hecivan70
Newcastle,2020-06-19 02:52:57+00:00,1273810974965825536,@IKnowNato *cries in Pandemic Studios*,NicholasPrior
Newcastle,2020-06-13 06:30:02+00:00,1271691279936573440,Real estate prices across #Newcastle appear to be holding steady despite the #COVID19 pandemic.  @nbnnews https://t.co/QUwWN0c4wm,SamBurbury
Newcastle,2020-06-10 22:03:36+00:00,1270839055601725442,"I wish something other than the extreme stress caused by a global pandemic had prompted me to start doing daily yoga, because that particular change has made my mornings (and general strength and balance) so much better. I guess I just have to accept it and keep going.",eleaud
Newcastle,2020-06-08 23:11:08+00:00,1270131276616368128,#pandemic https://t.co/ZLcksX19mQ,Austbloodstock
Newcastle,2020-06-06 08:13:55+00:00,1269180705474396161,So is there a fu#%ing pandemic or not?! 🤬 https://t.co/CmwwRVlsp5,NickArkoudis
Newcastle,2020-06-06 04:30:55+00:00,1269124586290831360,".@newyparkrun - 8 years old today! 🥳

Only ever been derailed by a path upgrade (2013) and a pandemic (2020).

Pic taken before the start on Sat 9 June 2012, 77 runners/walkers and 5 volunteers. 

#twasonthe9thofJoon #BlaydonRaces @newcparkrun https://t.co/zZXAMid8sN",mrdaverobbo
Newcastle,2020-06-05 01:44:01+00:00,1268720197038305282,This is the first time world exposed to pandemic condition and also the first time  to see a real qualification of organizations that we interact with them especially in academic world. It is  a real regret to see EUBCE behavior with their speakers,JalalabadiT
Newcastle,2020-06-04 20:24:10+00:00,1268639704506707973,"Don't let the media and #ScottyFromMarketing lies fool you. We were already in a #recession before the bushfires and #pandemic . 
#auspol #AuspolSoCorrupt #scomolies https://t.co/vS3VyqeNsg",Tonee65834913
Newcastle,2020-06-04 12:06:52+00:00,1268514556524916737,"We have to learn to make things again.Pandemic reveals Australia vulnerable from narrow, fragile manufacturing base https://t.co/pWa4M4qz62 via @MichaelWestBiz",djmarley6
Newcastle,2020-06-02 19:46:20+00:00,1267905408611397632,"Pandemic, riots, anger, mistrust, sadness and frustration. No wonder we have anxious staff and students trying to return to learning. The “new normal” is the worst part of every disaster movie ever. Be better; be strong.",bmaher1976
Newcastle,2020-05-30 14:06:59+00:00,1266732846053421057,"@MarkPearsonMP is right let use the funding from non essential government  funded ""services"" instead of freezing the wages of those who worked tirelessly throughout not only the #COVID pandemic but also the recent #bushfires . #nswauspol shame on you https://t.co/SkeOgg6xJO",Tonee65834913
Newcastle,2020-05-30 08:21:05+00:00,1266645797778554880,"“So many things make America combustible right now:mass unemployment,a pandemic that’s laid bare murderous health and economic inequalities,teenagers with little to do, police violence,right-wingers itching for a second civil war &amp;a president eager to pour gasoline on every fire” https://t.co/33mlspzAwz",DeclanClausen
Newcastle,2020-05-30 05:01:58+00:00,1266595687489130497,"@pmens72 @RNogarotto Yes, racial tensions have always been under the surface, ready to explode regardless of who the President is.
The fact is though that the pandemic has exposed just how broken the very social fabric of American society has become.",hecivan70
Newcastle,2020-05-28 10:07:03+00:00,1265947687381274627,"☄️POST RUN STRETCH☄️
-
So we have all been doing a lot more running 🏃‍♂️ recently with this global pandemic and lockdown. Stretching out after couldn’t be more important to prevent injury and stiffness.  15 minutes… https://t.co/SUQUmqgNz3",AdamHindley
