City,Datetime,Tweet Id,Text,Username
Newcastle,2020-05-27 20:28:52+00:00,1265741784342163457,This is a great thank you from #auspol to the people who put their lives at risk &amp; worked tirelessly throughout the pandemic.  Thanks #koalakiller for you generosity.#covidshame https://t.co/umg4x0wN2M,Tonee65834913
Newcastle,2020-05-26 07:11:55+00:00,1265178838352293888,"@BenFordhamLive @marklevy2gb @PaulineHansonOz Isn't Qld Premier Palaszcuk acting on advice from health authorities?
These are extraordinary circumstances, there is a worldwide pandemic FFS. Why would the High Court intervene because Pauline Fckn Hanson wants them too???😡",hecivan70
Newcastle,2020-05-24 00:54:40+00:00,1264359122637475840,@ProfPCDoherty As Senator Wong mentioned; there are so many issues and challenges that have arisen from this pandemic. Way too much focus has been given to this spat with China over the need for an investigation into its origins at the expense of focusing on our long-term strategy re: Trade.,hecivan70
Newcastle,2020-05-22 10:13:15+00:00,1263774920770641926,@Ortmann_ Remember back in our day our pandemic was the swine flu... ah to be young again!,nickintheworld
Newcastle,2020-05-22 05:11:43+00:00,1263699036898381824,"""...Racism is also undermining the nations political response to the pandemic.""😳
What a mess the US is in both politically and socially. They seem to be a lost case which is why we in Australia must reassess the path we are on to ensure we do not end up like this... https://t.co/s1QHrims2h",hecivan70
Newcastle,2020-05-22 02:13:31+00:00,1263654191425155073,"@Independent Please reconsider Boris, these migrant are putting their lives on the line to help you and your fellow Britons get through this pandemic.",djmarley6
Newcastle,2020-05-21 10:51:37+00:00,1263422188985520129,"@AnnastaciaMP Premier, how to enable co-parenting in this pandemic constrained world? My 2 Girls live in Qld &amp; I haven’t seen them since Jan. Cancelled 3x visits/time together &amp; July school hols was our next chance. Not with border restrictions = 2 weeks of quarantine + 2 permits + ..?",DrWilso
Newcastle,2020-05-19 01:39:53+00:00,1262558564616269825,It has been interesting getting emails about the pandemic from every hair salon I visited while on research trips during my postdoc. That platinum pixie cut didn’t maintain itself!,erinannmcc
Newcastle,2020-05-17 06:55:12+00:00,1261913138644975616,@TimSmithMP So it seems Victoria has a contender for biggest sookie la la tweet of the pandemic.,eleaud
Newcastle,2020-05-16 09:37:28+00:00,1261591586061774852,"There is no cure!                                there is no vaccine!
it only took 1 person to start the pandemic ! the virus is out there! BEWARE",leonard_fabre
Newcastle,2020-05-13 12:50:06+00:00,1260552900360540161,Equally serious question. Was The United States really a super power  in the few years before the pandemic? https://t.co/dahdOJfgQg,allanasher
Newcastle,2020-05-11 09:16:02+00:00,1259774253991251968,A timeline from January 3rd when Trump was first informed of the coronavirus to March 17 when he finally admitted that it was a pandemic. Make your own mind up but IMO he has got to be the most incompetent US President in living memory in dealing with a crisis... https://t.co/71HMGxiOvv,hecivan70
Newcastle,2020-05-10 06:27:34+00:00,1259369470172119041,Police are warning drivers the #COVID19 pandemic is no excuse for breaking the law.  The results from ‘Operation Northern Roads’ in @nbnnews at 6 https://t.co/Tq85ItNm4u,SamBurbury
Newcastle,2020-05-09 23:04:27+00:00,1259257955620237312,"@sallymcmanus @ProfPCDoherty This system is unsustainable. 
Just look at the US now, with all their wealth, power and influence but they have been exposed now during this pandemic. We are on this path too if we continue to follow Neoliberalist ideology.",hecivan70
Newcastle,2020-05-09 09:45:42+00:00,1259056946310606850,"HOW TO CONFIDENTLY BUY PROPERTY WITHOUT ACTUALLY SETTING A FOOT IN IT! 

As a result of the pandemic, the way the property market is now operating has changed.

In this conversation:
 🏘 Confidently Purchase A… https://t.co/d3XvaHmiRW",hoooeey
Newcastle,2020-05-09 07:34:22+00:00,1259023893215338497,"@Lindycleeland What are his staff doing? This is all about ignoring unions,even when they represent essential workers. Result, a spread of the pandemic and unnecessary deaths",djmarley6
Newcastle,2020-05-09 02:29:00+00:00,1258947047404658688,"Rotarians in Kurri Kurri are cooking up a storm to help the vulnerable during the pandemic.
Find out the reason why tonight at 6.
@nbnnews https://t.co/iMQjOIkhGM",Adam_Murray97
Newcastle,2020-05-08 05:46:17+00:00,1258634304403333120,Love working with such a fantastic team who are keen to embrace the opportunity that is here to develop systems and capacities that address #COVID19 but are also applicable to other current and future #publichealth issues that don’t stop just because of a pandemic 🧪🩺🧼📊🦟 🌊 https://t.co/8wRMmP5jay,s_wheeler_
Newcastle,2020-05-08 05:33:00+00:00,1258630963019444225,I visited the Apple Store today. They are very well set up for pandemic retailing. https://t.co/bvVu3QcHXk,HyperBrendan
Newcastle,2020-05-08 00:38:07+00:00,1258556751244230656,#CancerWontWait during the #COVID19 pandemic. Don’t hold off - see your doctor if you notice a change which isn’t normal for you. Visit https://t.co/0WoCaVHFEd https://t.co/0NRgZ3B2sh,DrCandiceWoods
Newcastle,2020-05-07 03:37:52+00:00,1258239600583049216,"@ClearBluSky2 @grottyscotty @JonesHowdareyou He had two years and lots of warning to be ready. He trashed the Obama era pandemic plan, he has spent resources on persecuting migrants instead of making America safe. All he cares about is four more years, no matter how many die.",djmarley6
Newcastle,2020-05-06 00:11:15+00:00,1257825216551546880,"@reidhoffman When the pandemic clears untreated oral health concerns will lead to a rise in doctor/dental visits and hospitalisations!

We can connect your sore throat or sore tooth to a doctor or dentist from the comfort of your own home with TelScope!

https://t.co/wJzKm5hu47",hollandhealth_
Newcastle,2020-05-04 23:45:35+00:00,1257456369210458112,"@PEYESTRO @rdsva @mattyglesias And this failure to address the virus, to allow it to become entrenched will impact on how US citizens will be treated by the rest of the world as they will pose a health risk. The tourism industry will also be hit. Who wants to visit a country that wont manage a pandemic?",JaneoOakley
Newcastle,2020-05-03 20:25:57+00:00,1257043740268453888,Absolutely not and in contravention of the Biosecurity (Human Biosecurity Emergency) (Human Coronavirus with Pandemic Potential) (Emergency Requirements—Public Health Contact Information) Determination 2020 - no coercion. https://t.co/Q3dpwgVWNm https://t.co/f0qLIDN0NM,carolduncan
Newcastle,2020-05-02 02:09:14+00:00,1256405357238181888,"What's more, she asks an extremely valid question: which terrible event on the residents affected did more harm? The Invasion or the Pandemic? https://t.co/bfYh0qnRAD",bevhenwood
Newcastle,2020-05-02 00:45:24+00:00,1256384258836271104,@TheIPA @evmulholland Ate you brave defenders of James Cook or a bunch of neo Liberals using feigned outrage to sabotage a successful strategy to contain the pandemic? The latter I think.,djmarley6
Newcastle,2020-05-02 00:33:01+00:00,1256381143630245888,"Population: Wearing a homemade mask doesn't protect you from others. 
Personal: I want to protect others from me and signal to them that I’m taking this pandemic seriously.",jed_duff
Newcastle,2020-05-01 23:51:51+00:00,1256370783909105664,"@JDBudgie It’s not scaring folks to be realistic about the behavioural impacts of a shock like the pandemic - what would be scary is if folks ignore reality and then are surprised when things don’t go back to “normal”

Humans, life, society adapts - Covid has been an accelerant to trends",gregorymckenna
Newcastle,2020-05-01 07:51:03+00:00,1256128989212536836,"#LungCancer remains the number one cause of cancer death in Australia, and during the #COVID19 pandemic it is important to remember that respiratory symptoms may not be due to COVID-19. Read @CancerAustralia’s new #ISLCGuide: https://t.co/lDuu7dC6MV",DrCandiceWoods
Newcastle,2020-05-01 01:41:25+00:00,1256035968747855872,@MichaelCouacaud @PlatPodcast Thanks for patiently waiting. Unfortunately trying to get schedules to align during this pandemic is harder than changing Shinra's climate change policy at the moment.,NicholasPrior
Newcastle,2020-04-30 10:14:40+00:00,1255802744595558400,"@realDonaldTrump @CNN You fired him.
He plead guilty.
There are 60,000 dead from a disease you said was going away when there were only 15 cases in the USA.
You spent February playing golf and holding rallies instead of preparing for the pandemic you were warned about.",paullyfromaus
Newcastle,2020-04-27 09:09:39+00:00,1254699216586240002,Does living in New York make any financial sense after this pandemic? https://t.co/G9EFi24jpY,carolduncan
Newcastle,2020-04-27 06:48:43+00:00,1254663753427070976,"@SuzanneKorff @TonyRoberts101 @PrincessCruises In Memoriam: Cruise Ship Crew Members Lost in COVID-19 Pandemic   https://t.co/gvTs1zcdhJ
As the COVID-19 pandemic spreads across the world, our fellow crew members, our sisters, brothers, and friends on the cruise ships are among the casualties. https://t.co/GHMNZcztmY",MicheleD2020
Newcastle,2020-04-26 07:53:03+00:00,1254317553838510080,"@MikeCarlton01 Just look at the US...for all it's wealth, it's power and influence throughout the world. The #COVID19 pandemic has truly shown on so many levels just how much it is failing as a society. The system that created Trump is well and truly broken!",hecivan70
Newcastle,2020-04-25 21:50:12+00:00,1254165839701356544,"--tapos ko na gawin, nandito ako sa labas (this is at night and almost late) nagahanap ng malakas na signal"" like grabe lang jud ni karon kay pandemic man gud ni, dili basta2 makagawas para makahanap ug signal. one mistake of going out can lead to possible infection.  //",janinemntflcoxx
Newcastle,2020-04-24 15:51:21+00:00,1253713145610174466,"URGENT ENQUIRY:
67 Cruise Ships have been infected with COVID19.
#Deaths 
#COVID19
In Memoriam: Cruise Ship Crew Members Lost in COVID-19 Pandemic
https://t.co/ixES17vlq3
Report from Business Insider 
https://t.co/ApFp1jbPj6
Pg 2 https://t.co/r1nrf7hDLO https://t.co/CVarbSD7FX",MicheleD2020
Newcastle,2020-04-24 02:01:49+00:00,1253504388196454401,"This boy really is my heart, soul and my reason for everything!

He is growing so fast and is just an incredible human. During this pandemic and horrible time, he is our light on some of the darkest days! 

We are so… https://t.co/IafYB8b9K4",leecy_osh
Newcastle,2020-04-23 01:07:43+00:00,1253128386433581056,"@TravelLeisure 67 cruise ships worldwide have been infected with the coronavirus   
See the list and links below?  
Ruby Princess is taking bookings from Seattle for July. 
All of the cruises that have been affected by the coronavirus pandemic - Business Insider https://t.co/HFKksUZEG6",MicheleD2020
Newcastle,2020-04-21 23:41:44+00:00,1252744360120029185,"@realDonaldTrump 820,00 infected. 45,000 dead including almost 3000 just today. Outstanding job handling the pandemic.  Imbecile.",MyKing1968
Newcastle,2020-04-21 05:43:07+00:00,1252472913745203202,"@gavflano If he had acted back in early March instead of labelling the pandemic a hoax, there is no doubt that the number of deaths would not have been this high.
It's just unfathomable that he can now gloat as if his actions have saved millions of lives😡
#CriminalTrump",hecivan70
Newcastle,2020-04-21 01:47:28+00:00,1252413610069864449,"@mark_frye @parscale Oh honestly stop carrying on about FREEDOM and socialism and stupid, stupid theories. We are in the middle of a pandemic and trying to save lives.",CaitrionaDowse
Newcastle,2020-04-20 09:28:51+00:00,1252167336401891329,"Hey @danilic, this tweet didn’t age so well. Only months after you praised him as a “great leader”, @AndrewConstance now wants to sell more public services. Of course @LiberalAus use a #pandemic to cut more #PublicServiceJobs. #NoToPrivitisation #auspol #nswpol @psansw @unionsnsw https://t.co/c3baUXhknU",RGratton
Newcastle,2020-04-18 23:51:08+00:00,1251659558411370496,"@thehill And here I am thinking he junked his inheritance, such as national parks and the pandemic response group.",djmarley6
Newcastle,2020-04-18 23:23:17+00:00,1251652552724119553,".@PlanningNG .@ProfOsinbajo  After we have fully contained COVID-19 pandemic in Nigeria, the NPC should start thinking on the next population census.The last one we had was in 2006. It's 14 years already. Global practice is every 10 years.We are 4 years behind.We need the data.",IamLanreDaodu
Newcastle,2020-04-18 08:32:20+00:00,1251428338180034561,The worst thing about being pregnant in a pandemic is the lack of alcohol and (legal) drugs to get me through 😭,abstalavista
Newcastle,2020-04-18 02:34:19+00:00,1251338240272904192,"@fYv9Bl8gmUK140e 違ったー🤣🤣🤣
ポールダンスいいわん💃🏻
pandemicは沖縄ちゃうーっていうことかしらん⁉️

爪擦り合わせるのいいかも。私はオンオフスイッチ設定してていまんとこ問題ないけど、ストーンヘンジでコントロール不能になったので、またそんなのきたらやってみまーす❣️",Reikibudo
Newcastle,2020-04-17 21:21:41+00:00,1251259563505938439,"@Vlad_Mykhnenko Highlights the problem of each state/city doing its own thing. I was on a zoom yesterday with Mayor TenHaken of South Dakota. In his state, the governor hasn’t issues orders, so each Mayor is issuing a version of shelter in place. 
In a pandemic, good national government matters",DeclanClausen
Newcastle,2020-04-17 12:30:27+00:00,1251125871542296576,"@AustinCarr @BW Is it just me or does a cruise (even without the viral pandemic) legitimately sound like hell? A lecture on the films of Clint Eastwood, a ukulele concert, crowds of old people and a buffet....I’ll be  good from now on Lord, just don’t send me to Hell!",Dublinactor
Newcastle,2020-04-17 08:58:03+00:00,1251072419306934272,Doctor Death spruiks close contact in a pandemic. https://t.co/FptPydK9Bb,djmarley6
Newcastle,2020-04-16 22:32:07+00:00,1250914897853992961,Coronavirus pandemic: teachers don't deserve Morrison's guilt trip https://t.co/xALcvg7t6d,Paula_E_M
Newcastle,2020-04-16 12:25:35+00:00,1250762259489415168,@NickBryantNY It is good that a world leader understands the actual underlying science of the pandemic. Imagine following logical rational reasoning. Hey @Peter_Fitz @ScottMorrisonMP @JoshFrydenberg @deemadigan @MatthewBevan @bencubby Science driving policy. Shocking.,adlrope
Newcastle,2020-04-16 05:23:30+00:00,1250656038417649666,@MadamEarth Yeah. Ok. Because of the pandemic   😉,kaeleneak
Newcastle,2020-04-16 02:15:10+00:00,1250608644279787520,"@Megan_Palin @newscomauHQ @NYGovCuomo Australians are being ordered to stay home or receive a big fines.  One man refused to stay with 14 day self isolation period, he was caught several times sneaking out to his girlfriend, now he is in jail. Australia's tough love during the COVID19 pandemic.
Stay safe. ♡",MicheleD2020
Newcastle,2020-04-16 00:09:01+00:00,1250576898175823872,"Seriously, who would give this fox of a Government the keys to your henhouse because that is exactly what you are doing if you take up their Tracker App.oh and another Question who among you trust this mob to turn off the App once The Pandemic is over? you believe in Santa Claus",RoyanWg
Newcastle,2020-04-14 00:08:50+00:00,1249852076307304448,"Wow, @charliekirk11 is not aware of 2 things.
1. @realDonaldTrump did nothing to prepare the USA for a pandemic in February.  And 2. That San Francisco is in the USA. (Look at a map of California, Charlie. On the west coast - that’s the left hand side)
Glad to help Chuck https://t.co/6oUTgNkBPk",paullyfromaus
Newcastle,2020-04-12 02:12:02+00:00,1249158305391534080,I believe that the efforts by this athlete to finish the race is akin to what we all have to  do in many different ways to get through this pandemic. https://t.co/XOnsiIvzR6,BruceCookRugby
Newcastle,2020-04-09 13:12:17+00:00,1248237296190545920,@karl_trotsky @JulieLyford 2012 Health Act degraded the NHS and it failed in 2016 during a pandemic drill.,djmarley6
Newcastle,2020-04-08 07:41:53+00:00,1247791763378434048,"Good framework in this article for fashioning all public health information, especially relating to a pandemic https://t.co/M2hMaX868f",billie_bonevski
Newcastle,2020-04-07 02:02:29+00:00,1247343959128461314,"I think everyone agrees this pandemic has the potential to have devastating effects on those with mental health battles.
Yet still, it’s absolutely crushing to hear of someone you care for taking their own life while in isolation💔💔
Please reach out if you need support x https://t.co/mPiixPbJFb",RachRay_Beauty
Newcastle,2020-04-07 00:17:55+00:00,1247317646061629440,The powers that be trying to sneak this through mid pandemic https://t.co/0o8wqXRTRc,SliccMick
Newcastle,2020-04-06 12:15:28+00:00,1247135836857970688,"@LittleBDBarks @Peter_Fitz Glad to see that despite these difficult, pandemic times there're still people as utterly ignorant ill-informed &amp; stupid as you Colin. 

Ever thought of doing some basic research, such as seeking out evidence, or facts, before commenting?

Nah, thought not.

Wallow in ignorance",adlrope
Newcastle,2020-04-06 10:53:44+00:00,1247115266154049536,"@lisafryar @DaveWallsworth He’s my favourite and top of my post-pandemic bucket list is to fly with him! And you, Lisa! x",carolduncan
Newcastle,2020-04-06 08:06:08+00:00,1247073087775887361,"@LyleShelton @ItaButtrose So right @LyleShelton, I mean it’s not like the ABC did a tremendous job during the bush fire crisis, or are doing an equally excellent job during the COVID-19 pandemic. Oh, no they did &amp; they are. Maybe stop being constantly wrong Lyle.",paullyfromaus
Newcastle,2020-04-05 10:23:58+00:00,1246745388662415360,Ongoing public health campaigns should include reference to the importance of smoking cessation during the pandemic @GregHuntMP @SanchiaAranda @CancerCouncilOz @NSWHealth https://t.co/kpgjMaP6ym,billie_bonevski
Newcastle,2020-04-05 06:52:14+00:00,1246692102097911808,"@Pandemic_Times Yep, that's all it would take...just for one player or staff to become infected and the whole thing would have to be aborted.",hecivan70
Newcastle,2020-04-05 02:12:15+00:00,1246621641653678080,Hardware stores including Bunnings #Belmont are doing a roaring trade despite the #COVID19 pandemic.  @nbnnews https://t.co/1yPA1JrXsb,SamBurbury
Newcastle,2020-04-04 23:26:32+00:00,1246579940201361409,Arundhati Roy: ‘The pandemic is a portal’ https://t.co/uIpRMbsn4N,CathyColeborne
Newcastle,2020-04-04 22:56:45+00:00,1246572443386499073,@BradGarraway @ScottMorrisonMP Thank goodness for the ABC...fire and pandemic!,CampbellSher
Newcastle,2020-04-03 21:03:04+00:00,1246181446353473536,The immediate threat of the #COVID19 pandemic has overshadowed the fact that humanity is still heading towards the abyss if it does not address Climate Change and the threat of Nuclear War... https://t.co/alZjkErHNs,hecivan70
Newcastle,2020-04-03 10:20:15+00:00,1246019676976476160,"@WorkCoverQLD @QldPolice  who is ensuring police maintain social distancing at the border or use PPE,This is as bad as conducting local elections in the middle of a pandemic. #fairdinkum @QLDPremier @abcnews https://t.co/0ji11M0YU7",jkellyot
Newcastle,2020-04-02 06:59:55+00:00,1245606873807519744,"@RonniSalt At  least we might come out of this with a better public health system.  Smoking is about choice, not a pandemic",djmarley6
Newcastle,2020-04-01 12:17:12+00:00,1245324330679939072,@BeaCurious @CityKat75 Exactly! Too bad if we actually get sick and need leave once this is all over. Should have thought about that during the pandemic!,MotherOfRays
Newcastle,2020-03-31 06:12:02+00:00,1244870046360330240,"TONIGHT IN SPORT: The Mariners have followed Adelaide United and stood down their players as the economic pinch of the coronavirus pandemic hits. 

All players have been returned to their families for the time being until April 22.

@nbnnews https://t.co/15VMttR9v2",SkaieHull
Newcastle,2020-03-29 05:48:48+00:00,1244139424792727552,Coronavirus pandemic prompts WA to consider hard border closure to restrict spread of COVID-19 https://t.co/FeX0Pe0oke,MicheleD2020
Newcastle,2020-03-29 03:53:31+00:00,1244110412976500738,"Played @Whatdoyoumeme last night w/ @cmcau &amp; fam. This meme comes up. Freestyle.

Me: ""When you plan the perfect vacation, but then a pandemic hits.""

Silence. Then, laughter.

Chris: ""You're the only one here allowed to make that joke.""

Don't I know it. Won that round. #COVID19 https://t.co/NH4i7t0crx",TheHeidiK
Newcastle,2020-03-29 00:00:30+00:00,1244051771275636736,"@RonniSalt My customers are on Centrelink. I've been giving small interest free loans with no repayment timetable for a while now b4 the pandemic. Yesterday I ""loaned"" several hundred to mum &amp; daughter on DSP so they could do a big shop and then stay home. I'm privileged to be able to share",JaneoOakley
Newcastle,2020-03-27 14:10:07+00:00,1243540808571269120,"Missing this place already!
Hope the ghosts are keeping the place spooky for us.

I'm wondering tonight hiw the prisoners dealt with the Spanish Flu Pandemic in the early 1900's?

Must do some research on that… https://t.co/xBM6jDN0ji",spookyliscious
Newcastle,2020-03-27 11:59:25+00:00,1243507916251877377,"Today I am calling for an immediate global ceasefire in all corners of the world.

It is time to put armed conflict on lockdown and focus together on the true fight of our lives – the #COVID19 pandemic.

https://t.co/R0idWQJIiO https://t.co/BGAUM3lprE https://t.co/WVCcurgIhH",MicheleD2020
Newcastle,2020-03-27 10:42:36+00:00,1243488586722205696,"why not advertise #holidayrentals in the middle of a #pandemic #convidiot  #StayHomeAustralia  #DontBeASpreader  our Hostpial has a total of 10 beds!!
scared for my son this winter not to mention the rest of the community https://t.co/NhysiDBPDq",GaleCass
Newcastle,2020-03-27 06:02:50+00:00,1243418181856718849,"@bysarahayoub We’re getting takeaway Ethiopian 😋. Take it easy, nothing like first trimester exhaustion (in a global pandemic!)",nicoheath
Newcastle,2020-03-27 02:07:48+00:00,1243359030501769216,@MayneReport Why do you care? Holiday plans cancelled?  Meeting to get to? Story to investigate?  A highly contagious pandemic trumps all of that https://t.co/VCZFbDYoiD,JaneoOakley
Newcastle,2020-03-26 05:11:50+00:00,1243042960046010369,"#Repost @rach_main
・・・
Join @luke_main and I on @beyond_church_ instagram LIVE tonight 8pm as we chat from our lounge room about how to navigate life during a global pandemic!

Our friend geraldmorillo from… https://t.co/SG7M68QprO",Luke_Main
Newcastle,2020-03-26 00:16:28+00:00,1242968625373470721,"In light of the ongoing COVID-19 pandemic, Battlezone Laser Tag will be closed until further notice. The health and wellbeing of our customers and staff remains our utmost priority.
We understand this is a trying… https://t.co/VBW0TKPtm3",bzplaylive
Newcastle,2020-03-25 07:08:42+00:00,1242709979108233216,Do you think China should stop their wild life trade? Then why shouldn't we? Kangaroos hang in the back of utes for hours in the dust and air. It's  a pandemic waiting to happen. Please sign. #covid19australia #wildlifetrade https://t.co/0vzsu5U5D4,Tonee65834913
Newcastle,2020-03-25 05:32:52+00:00,1242685864737533955,@menamckeena @jamesmiller62 @smh Many income protection policies have specific exclusion for WHO declared pandemic.,MyKing1968
Newcastle,2020-03-24 21:34:30+00:00,1242565478217908225,"Stuck at home during the pandemic 😷? Make some special treats for your dogs 🐶!

👉Homemade Baby Food Dog Treats - 3 ingredients

1 cup of tapioca flour*
1 egg 🥚
120g packet of baby food 👶 (or blend your own smooth… https://t.co/XZtfF9DTjY",DogTrainingNew
Newcastle,2020-03-23 09:47:13+00:00,1242025098657202176,@carolduncan @DrTehan No one covers pandemic I’m afraid - it’s in the list of exclusions along with meteorite strikes etc...,ascornwell1
Newcastle,2020-03-23 09:14:34+00:00,1242016879834591234,@DrTehan Not all insurance covers ‘pandemic’?,carolduncan
Newcastle,2020-03-21 08:35:53+00:00,1241282368159113216,"@LesStonehouse Some time ago I posed the question?
Can anyone think of  a worse Government than our current one to manage and recover from this Pandemic that is Covid19?",RoyanWg
Newcastle,2020-03-21 01:45:03+00:00,1241178980570537986,"@McAlmanac I know mate, that's why I said it might seem ""far fetched"".
It is surprising though how for a pandemic, a massive population like China has seemingly now got it under control...within 3 mths. Having said that I don't think we should in any way be complacent either.",hecivan70
Newcastle,2020-03-21 01:39:13+00:00,1241177510370578433,"@synapse101 @JordanRenouf Probably should've worded it differently but some things just don't add up and raise more questions. Like why these half-hearted restrictions in place if it's a pandemic and why were 2,700 passengers allowed off the cruise ship? Too late now to try quarantine them.",hecivan70
Newcastle,2020-03-21 00:32:47+00:00,1241160791639724032,"@JordanRenouf It's officially a pandemic but is it?
The situation in Italy in particular is very serious and a few other countries for various reasons but China has a population of 1.4 billion and there were 3,000+ deaths...hardly a ""pandemic""?🤔",hecivan70
