City,Datetime,Tweet Id,Text,Username
Newcastle,2021-03-10 20:40:23+00:00,1369750000654184449,@GayeFreeman8 @AnnastaciaMP It's state premiers playing the parochial card and this state against state attitude that has been the saddest outcome of the pandemic.,mediahunter
Newcastle,2021-03-08 11:54:54+00:00,1368892983198707713,"@southwaleswill Give it a year, a pandemic to lose some mass and then try and gain it back in time for #GayChristmas .. not easy lol",YahHugh
Newcastle,2021-03-07 04:01:48+00:00,1368411536268529666,"I’ll never forget that night. #MardiGras2019 , before we heard of the words; Corona Virus, and a global pandemic never happened and before my gym junkie craze 😂
An estimated 500,000 people lined Oxford St and this one moment was fabulously captured #pride #SydneyMardiGras https://t.co/A3VrHqE6TQ",YahHugh
Newcastle,2021-03-05 22:42:17+00:00,1367968738230734851,"Much like the US under Trump, Brazil also have a fwit President in Bolsonaro who refused to take the Pandemic seriously. Now the hospital system is on the verge of collapse with reported cases and deaths rising. He should stand down as he has failed his people. https://t.co/wT3XPd8lcC",hecivan70
Newcastle,2021-03-03 04:56:49+00:00,1366975830509817857,"@DavidHodgettMP So because this Gov and it’s independent employees cannot draft   An emergency pandemic law for the past 12 months, we fools suffer their incompetence for 9 more, let them lock in people for 23 hours a day ...yet dogs can be hair cut and washed!! Really? insanity rules.",davidcgrey
Newcastle,2021-02-27 05:37:25+00:00,1365536495524741121,@Adam_Creighton @MDosNK Quite the contrary. I'm glad our politicians have shown strong leadership during the pandemic and listened to the advice of the medical experts. Would you have preferred Trump-style misinformation and placing economics&gt;&gt;&gt;lives leading to thousands dead?😳,hecivan70
Newcastle,2021-02-19 22:17:41+00:00,1362889115700580352,Interesting article about the changes in lifestyles as a result of the pandemic. https://t.co/i0x2zLllxh,druey
Newcastle,2021-02-18 22:15:21+00:00,1362526143551737856,@Johnkehoe23 @ozrock67 @TomMcIlroy that is 80 million dollars of taxpayer money not going to schools or hospitals in the middle of a pandemic or aged care facilities or pensions or anything else that we actually need to spend it on,unclecraigums
Newcastle,2021-02-18 01:36:49+00:00,1362214455883440133,Middle of a pandemic and bushfire season and Facebook decides that now is the right time to pull the plug on all news sources in Australia? Seriously? You guys couldn’t have waited a little longer to make your point?,CJ_Levinson
Newcastle,2021-02-14 20:39:55+00:00,1361052575915667456,Covid-19 pandemic: China 'refused to give data' to WHO team https://t.co/EjB8UlgWsL,MicheleD2020
Newcastle,2021-02-13 03:07:09+00:00,1360425247510417411,"@drpete00 @antsharwood And considerably less interruption to life here. It's a pandemic, there will be breaches, there will be cases. No state is perfect but I appreciate the way NSW has handled it",mediahunter
Newcastle,2021-02-12 00:48:59+00:00,1360028088776622081,@GlennHampson @AshleyLeahy We're fortunate not to live in fear of snap lockdown here. There are always going to be small outbreaks. It's the nature of a pandemic. We need to manage without lockdowns.,mediahunter
Newcastle,2021-02-03 21:44:41+00:00,1357082605183590402,@mansukhmandviya Dear sir we seafarers eagerly waiting for your valuable outcome regarding nre days reduction for seafarers during this pandemic. We are positively hoping for certain relaxation this financial year.,SanjivssSs
Newcastle,2021-02-01 21:47:44+00:00,1356358598473863169,"“Fewer Australians have died in total (909) than the average number of deaths every day now in Britain and the United States.” One Case, Total Lockdown: Australia’s Lessons for a Pandemic World https://t.co/fq49wO9agf",carolduncan
Newcastle,2021-01-28 02:14:41+00:00,1354613837882748928,"@vanOnselenP But...but they're entitled to their ""opinion"", ""freedom of speech"" blah blah blah😊
When an idiot tries to undermine and spread misinformation about something as serious as a pandemic, the PM as a leader needs to speak up and show true leadership!",hecivan70
Newcastle,2021-01-27 21:05:22+00:00,1354535998135234562,Can we get this pandemic under control so we can have 10 years of Flash Flood Of Colour next year pls.,Coreyfromaus
Newcastle,2021-01-24 00:56:28+00:00,1353144605659656194,"Parenting during a pandemic can be pretty lonely business. 

I adore my kids, but I am really looking forward to them going back to school at the end of this week.",tonyarnold
Newcastle,2021-01-23 21:20:13+00:00,1353090183579660288,@colinmcfarlane I keep saying you Brits won’t ever get on top of this Pandemic until you stop importing it. Just plain stupid,KiwarrakRailie
Newcastle,2021-01-21 08:22:23+00:00,1352169661081665544,News reports claim that 90% of Australians who lost jobs because of the pandemic are back in work. Really? What about all the tourism jobs? All the airline jobs? All the travel agent jobs? Sorry but I don't believe unemployment is at 6.6%,DebHoggoz
Newcastle,2021-01-18 23:29:05+00:00,1351310673288912898,To be so out of touch with reality. You're in the middle of a pandemic 🤦‍♀️ https://t.co/HplBHgyu1g,DrLizzieManning
Newcastle,2021-01-18 20:14:52+00:00,1351261799782379521,The #Inequality consequences of this pandemic have been remarkably similar across countries. https://t.co/FqSHbJGjJo,ricyet
Newcastle,2021-01-17 21:39:40+00:00,1350920750832656384,"“It turns out that stopping the disease from spreading is the only thing that matters in a pandemic, and the state premiers did that.

Their efforts should never be forgotten.” @AlanKohler https://t.co/3jFc7suSNV",DeclanClausen
Newcastle,2021-01-16 00:08:36+00:00,1350233454596669441,How successful has our pandemic response been? Australia was one of a few countries to record fewer than expected deaths in 2020 from medical conditions. https://t.co/rodwUHOh3A,mediahunter
Newcastle,2021-01-14 03:10:14+00:00,1349554389514547203,"@craftyguru We had just 8 cases of community transmission in Australia last 24 hours. Zero in NSW. While I concede the US is a much larger &amp; harder country to control the pandemic, it could have been handled so much better.",mediahunter
Newcastle,2021-01-08 21:09:23+00:00,1347651639071567872,"Man, I’m sick of seeing pieces in the national news about “Naww poor so and so rich mofo had to cancel their extravagant wedding”. 

I’m not saying they don’t have the right to be sad about it, but is it really national fuckin news - this stuff happens in a pandemic? #jernalism",druey
Newcastle,2021-01-05 03:14:34+00:00,1346293988232368128,@IamAustinHealey I guess you tell them the truth. It’s a once in a generation pandemic and the only rules are there are no rules. Twitter is a cesspit of cry baby’s who need to blame someone or something. It’s life. Let’s just get over it and move on. Surprised you have joined the naysayers.,Jamersthoughts
Newcastle,2021-01-05 02:29:23+00:00,1346282619923664897,@avrilduck @mister_wynn @L_DeWeaver Yes I thought this was a while ago. But they still haven't held the govt to account for the scandal that has killed more people during this pandemic than any other sector,JaneoOakley
Newcastle,2021-01-03 13:46:12+00:00,1345728170255732736,I’m curious as to why or how the Australian former PM Tony Abbott was given a ‘return trip’ exemption to the UK when the covid pandemic is out of control in the UK and Boris Johnson is considered tougher lockdown restrictions? @abc730 @NSWHealth https://t.co/Dej3G2VjvQ,MAW18208322
Newcastle,2021-01-02 08:45:18+00:00,1345290055313575936,"@fictillius Oh no, drivers will have to perform some basic fuckin pandemic customer service.",druey
Newcastle,2020-12-31 23:51:13+00:00,1344793261035044865,"“Today’s pandemic puppies will become tomorrow’s recovery dogs, requiring spending on day care, treats and food well into the future.” 

This is truly an example of Smith’s Invisible Paw of the Market at work 🐶

@nytimes https://t.co/xPw8Sa9Xpn",DeclanClausen
Newcastle,2020-12-30 23:37:15+00:00,1344427359294771201,"@Jakie_1993 Tough and challenging year that it was Jackie, it was also very revealing in that we saw both the good side and bad side of humanity. 
Sections of the media and some politicians were exposed for trying to use the pandemic for political gain. We learn from this...and don't forget!",hecivan70
Newcastle,2020-12-30 02:37:25+00:00,1344110312367083522,"@a_dzyj @contiki God! I have been planning on going back to America! I was meant to go in May, but oh no!! It got knocked out by a global pandemic 😷 
So I’ll try again at Xmas next yr !",YahHugh
Newcastle,2020-12-28 07:42:01+00:00,1343462193145106432,"I mean, a pandemic doesn’t cut it, but you’ll jump if the universe dumps an sky full of cold hard ice rocks on your lime green SS Commodore.",tonyarnold
Newcastle,2020-12-26 05:18:06+00:00,1342701198588010496,Doin’ a pandemic wrong. https://t.co/IJBkvKTneh,druey
Newcastle,2020-12-26 00:31:17+00:00,1342629018579783681,Billions of masks are thrown away during the coronavirus pandemic – where do they end up? https://t.co/vuaWjNSImb,alexmorriswrite
Newcastle,2020-12-21 07:08:16+00:00,1340916984456704000,"@ValentinoxRM Yes, but not really the fresh material I'd wanted. But a pandemic might have delayed their plans.",mediahunter
Newcastle,2020-12-20 06:07:45+00:00,1340539365735317505,"@PrisonPlanet How would you be able to ""enjoy"" 1 year of a ""full life"" with a pandemic raging outside you dufus🤪
Doesn't make sense that any elderly person would choose to want to just live life as ""normal"" and therefore greatly increasing their chances of catching the virus and dying!",hecivan70
Newcastle,2020-12-19 20:24:27+00:00,1340392574712877056,@ChristiansRomy @ChristIsComing4 The living in the pandemic thing is questolionable though.,zorrothewonder1
Newcastle,2020-12-16 18:10:21+00:00,1339271664475860993,"The apple doesn't fall far from the tree😳
Over 300k dead from the pandemic and still putting $$$ before lives. 
The Trumps are a despicable bunch of human beings. https://t.co/ljEYqaUTCV",hecivan70
Newcastle,2020-12-13 23:59:13+00:00,1338272293479333888,My editorial in the MJA. Health and medicine in a pandemic year: moving from the “winter of despair” to the “spring of hope” in @theMJA https://t.co/qYaOaHmTr9 https://t.co/YeXrgWBYSr #MedTwitter,MJA_Editor
Newcastle,2020-12-12 23:09:21+00:00,1337897357623455744,"Why is it that many people seem to have short memories when it comes to the  PM Scott Morrison?
We have the State Premiers to thank for bringing the Pandemic under control. #Scomo showed the same sort of leadership he showed last year during the Bushfire crisis...NOTHING https://t.co/BsImZNplau",hecivan70
Newcastle,2020-12-12 22:02:53+00:00,1337880631766777856,"@MaralynParker @smh Todays opinion piece by Jacqueline Maley was good...as is usual..but the headline was badly put  'Morrison's pandemic response: exceptional  Shame about climate '
The sucessful pandemic response should always be attributed to each and every State Premier..not the recalcitrant PM.",bkbaguley
Newcastle,2020-12-12 00:43:43+00:00,1337558719157075968,"""And it will go away. Just stay calm"" said Trump in early October😳
Things have got worse, much worse in the US since then. Yep...stay calm people, a pandemic will just ""go away"". How can anyone defend this f-wit???🤡 https://t.co/MtZirJj1iI",hecivan70
Newcastle,2020-12-06 21:40:41+00:00,1335700717126864896,"@maxblackhole Certainly the extreme form of pure Capitalism that is the American system is decaying society there.
Especially with a leader such as Trump at the helm who cares more about $$$ over lives, the pandemic has truly exposed the US for what it is.",hecivan70
Newcastle,2020-11-29 21:41:18+00:00,1333164156447387648,"@JimRHoughton @LennaLeprena Absolutely👏
The pandemic truly exposed Newscorpse, the Conservatives in the LNP, the IPA and the RW shock jocks in the media for what their true agenda is. Dan Andrews is a popular, strong Labor leader and these bastards basically tried to use a crisis to try undermine him😡",hecivan70
Newcastle,2020-11-29 19:54:47+00:00,1333137351141330945,This pathos of this this picture shows me how lucky Australia was to skirt the edges of this #Covid pandemic https://t.co/FbZlYzEIiU,gregorymckenna
Newcastle,2020-11-29 00:41:37+00:00,1332847146735865861,"Some are still throwing the dictator tag at Dan Andrews and refuse to believe just how serious Coronavirus is😳
What is it that so many want to believe that there is some sort of conspiracy behind what is a pandemic? https://t.co/Rtx8zZ434a",hecivan70
Newcastle,2020-11-28 04:48:26+00:00,1332546873853308932,100s of refugees are being kicked out of their homes by Peter Dutton in the middle of a pandemic. I just signed the petition calling on him to ensure they have adequate support to find a house and buy food. Can you join me?  https://t.co/b5aixFc4aU,colinelvy11
Newcastle,2020-11-27 06:47:08+00:00,1332214356893863936,"@joeylynchy @TheWorldGame Due to the situation regarding a world pandemic...meaning less visa players, yes we will probably see clubs give more opportunities to youngsters. It just seems a rather ""reactive"" mindset rather than being ""proactive"" regarding player development🤔
Take a chance with youth👍",hecivan70
Newcastle,2020-11-25 12:21:39+00:00,1331573762454556672,Massive shout out to @Newcastle16Days for the powerful launch of #16Days in Newcastle this evening. Standing together in global solidarity to end the pandemic of  violence against women and girls #OrangeTheWorld #16DaysOfActivism https://t.co/3dZItKyq6c,SharonClaydon
Newcastle,2020-11-22 02:18:20+00:00,1330334771780599808,"@Peter_Fitz @johnlittle As soon as someone comes across as a Trump sympathizer, my opinion of them as a decent person lowers immediately. He wants to ""make America great again"" yet throughout this pandemic he has shown time and again he couldn't give a rats arse how many Americans die.",hecivan70
Newcastle,2020-11-21 09:06:09+00:00,1330075013228224513,David Rockefeller senior in photos and David Rockefeller junior put corona virus in wuhan China. #pandemic #plandemic https://t.co/EKa8Isyo5Q,telepathicland
Newcastle,2020-11-19 09:56:13+00:00,1329362838587015169,"@SkyNewsAust @marshall_steven So who is Chris Kenny? 
What expertise does he have in the Health &amp; Medical field that his opinion should be considered in these matters concerning stopping the spread of a pandemic???
His opinion holds as much substance as pissing in the wind😊",hecivan70
Newcastle,2020-11-15 23:02:36+00:00,1328111185502191616,"DR. ANDREW KAUFMAN AT RED PILL EXPO (OCT 10, 2020) - THE PANDEMIC FRAUD RUNS DEEPER THAN YOU THINK https://t.co/X2vCVkZkPz",ChristineUCowin
Newcastle,2020-11-13 09:01:19+00:00,1327174692868788227,"@chrisjackis Remember months back when he said that the pandemic would be over and people would be able to go to church at Easter time?😳
Yet the morons totally disregard his BS and keep listening to his lies...how the hell did he still get &gt;70million votes🤪",hecivan70
Newcastle,2020-11-11 00:03:36+00:00,1326314599063318529,Locals pause to remember the fallen in Civic Park for Remembrance Day. The service has been scaled back this year due to the pandemic. #ArmisticeDay https://t.co/IR3HwLGAcU,LydiaBilton
Newcastle,2020-11-10 04:54:58+00:00,1326025532794761216,"BREAKING NEWS:   After careful consideration of the impact of COVID-19 pandemic, organisers have reluctantly determined that Surfest Newcastle Australia will not run in February - March 2021. https://t.co/jkN4amiQCz",surfest
Newcastle,2020-11-10 01:53:50+00:00,1325979949400952832,"Happy International Accountants Day to my fellow accounting colleagues. What a year it’s been! You are all amazing and have been absolute super heroes 🦸‍♀️ 🦸‍♂️ during this pandemic.  Your family, your teams, your clients, your colleagues and your industry appreciate you! https://t.co/mXbXQhEQQi",amandagascoigne
Newcastle,2020-11-09 00:35:49+00:00,1325597931307585537,"The mask debate never ends. But the precautionary principle has served Australia well during the pandemic. Masks are another important line of defence. And community transmission of #covid is still a concern, at least in NSW and Victoria. I agree with Brendan here. #COVID__19 https://t.co/m9fPK6HjzJ",MJA_Editor
Newcastle,2020-11-08 01:36:09+00:00,1325250724515622912,"It’s a big task this new government has in America. In the middle of a global pandemic, a nation divided. There will be mistakes and frustrations and hurdles - no one is perfect. But this is the start and there is hope and that’s infectious.",kiahandley
Newcastle,2020-11-07 23:04:59+00:00,1325212683604381697,@mpesce I hope so. Serious question: what can they actually do now to get on top of the pandemic? The response to strict lockdown there would be volatile.,mediahunter
Newcastle,2020-11-07 03:54:55+00:00,1324923260052463616,Finally an American leader discussing the pandemic and economic consequences properly. Only 9 months too late. #JoeBiden #USAelection2020,mediahunter
Newcastle,2020-11-07 01:25:11+00:00,1324885577649459201,"@Cim38838006 @heath_parkes @Buddha14 Couldn't care less about what Biden or Trump's kids have been involved in, they aren't running for President.

As for Biden, regarding the pandemic he has seemingly understood the seriousness of the situation. Lets be honest, Trump doesn't care &amp; his handling has been disastrous",hecivan70
Newcastle,2020-11-07 01:08:11+00:00,1324881300361080832,"@heath_parkes @Buddha14 @Cim38838006 Withdrawing the US from the Paris Climate Change Accord, Trade War with China, dismantling democratic institutions throughout the country, having no regard for strong relationships with long-term allies, constant lies &amp; misinformation throughout the pandemic etc etc etc",hecivan70
Newcastle,2020-11-06 23:01:32+00:00,1324849428205727744,"@Buddha14 So on what basis do you make such a claim?...Fox, Skynews reports?
All US Presidents are liars and actors of various degrees but Trump is right at the top. FFS he's been lying and spreading misinformation throughout the pandemic.",hecivan70
Newcastle,2020-11-06 21:29:58+00:00,1324826382354903040,"Sadly, a pandemic doesn't wait for, or change because of election results... https://t.co/AlQvsXve3A",mediahunter
Newcastle,2020-11-05 07:07:42+00:00,1324246998883606528,"If Trump &amp; the GOP had invested as much time &amp; energy into a serious pandemic response as they put into campaigning &amp; voter suppression, they'd likely have been comfortable winners. #AmericaDecides2020",mediahunter
Newcastle,2020-11-05 02:08:14+00:00,1324171637424443393,@JesseFink @RNogarotto I can sort of understand the novelty of voting for him in 2016 but surely his total lack of leadership during the pandemic alone would dissuade any reasonable human being from wanting to give him a second term in office?😳,hecivan70
Newcastle,2020-11-03 05:31:56+00:00,1323498122387972096,".@CityNewcastle has risen to the occasion, responding to the COVID pandemic by: delivering a local resilience package before JobSeeker/JobKeeper were announced, bringing together key leaders to form @Nuatali_Nelmes’ City Taskforce, &amp; embarking on a record $116m stimulus program",DeclanClausen
Newcastle,2020-11-03 01:55:36+00:00,1323443679579697153,@SisterMick Isn't it great how in a pandemic these leeches exploit the situation for their own gain😡,hecivan70
Newcastle,2020-11-02 10:53:28+00:00,1323216650447941632,"In response to the COVID pandemic this year, our decision to further escalate our works program was the right call. REMPLAN estimate that our decision this year created 700 local jobs. 

It's an economic legacy that I'm proud of.",DeclanClausen
Newcastle,2020-11-02 09:11:54+00:00,1323191089788932098,"@pmens72 Remember a few months back when Trump urged the ""Liberation"" of 3 states? As the nation's leader he has been sending the wrong message out to the people since the pandemic began. Not much the Governors can do when the President is an absolute lunatic.",hecivan70
Newcastle,2020-11-01 07:48:16+00:00,1322807657888059393,"@maxblackhole Yep their whole ""keep Australians safe"" mantra is a total smokescreen for pushing through other agendas.

The LNP have truly been exposed during the pandemic for the liars they are.",hecivan70
Newcastle,2020-10-31 11:56:51+00:00,1322507826011402240,@TheKouk Trump hasn't handled the pandemic well and will lose because of it. Incumbency is relative to the pandemic outcomes in each country. Aus / NZ will return governments. US / UK and others in trouble.,mediahunter
Newcastle,2020-10-31 11:14:50+00:00,1322497251273437186,@TheKouk Every current govt is Australia is a special to win reelection for next 12 months based on our handling of the pandemic.,mediahunter
Newcastle,2020-10-30 11:29:06+00:00,1322138456500285440,Newcastle city cycleway project a path out of pandemic and towards 'better liveability' https://t.co/TKZ8Zxe7oD,ajscully
Newcastle,2020-10-30 10:31:31+00:00,1322123962734686208,@caitlinchang Having a baby is a lot like a pandemic lockdown,nicoheath
Newcastle,2020-10-28 21:26:21+00:00,1321563983850033153,@mikeredes Polls and the dire state of the nation with pandemic. Just my opinion. Yes I know the polls were wrong in 2016.,mediahunter
Newcastle,2020-10-28 20:53:15+00:00,1321555650674003968,"@millionsofmyles The polls have been unwavering (yes, I know, 2016) and I believe enough people see through Trump's BS now. Buy this is really a referendum on his handling of the pandemic. People want to feel safe again.",mediahunter
Newcastle,2020-10-28 19:10:27+00:00,1321529781767172096,@BobWilletts @pasi_sahlberg @NSWPPAConf It’s a bigger pandemic than COVID as it’s  already in everyone’s hands.,suemaxworthy
Newcastle,2020-10-28 02:21:46+00:00,1321275939234275329,@BernardKeane @deniseshrivell Throughout this whole pandemic the Conservative side of politics have pushed this angle but ultimately the Economy will eventually recover...in contrast you can't bring back dead loved ones!,hecivan70
Newcastle,2020-10-26 21:51:11+00:00,1320845458055467008,@ljayes disappointed you didn’t challenge Trump cheerleader Miranda Devine on her lies about the pandemic in US cases are counted on testing not symptoms so flu cases can’t be counted as Covid! Miranda should be label as spokesperson not journalist,fosicker
Newcastle,2020-10-26 05:15:30+00:00,1320594884080799744,@DanielAndrewsMP @TheTodayShow So proud of how strong you have stayed throughout the pandemic 😷,annewheaton17
Newcastle,2020-10-26 00:01:06+00:00,1320515762897862657,@BenFordhamLive @TimSmithMP Like Tim Smith has been a voice of reason and unity throughout this pandemic and his opinion is valued🤪,hecivan70
Newcastle,2020-10-23 23:25:53+00:00,1319782125575442432,"@Balkanite87 @souwalker @chrisjackis He's spread misinformation, sending inconsistent messages and blatantly lied since the beginning of the pandemic. The high number of deaths in the US can be mainly attributed to Trump without a doubt!",hecivan70
Newcastle,2020-10-23 21:58:22+00:00,1319760099263479808,"Sure, there's a little pandemic raging out of control, massive unemployment and 1 in 6 people moving toward food insecurity....but let's pretend we're going to the Moon and Mars! https://t.co/pwFyshfNmD",mediahunter
Newcastle,2020-10-21 09:05:48+00:00,1318840900571729921,"Alan Jones, the arsewipe who in 2005 incited the Cronulla riots now saying Covid19 is not a pandemic.
Just like Murdoch, he has been a cancer on our society for over 3 decades. Can't he just fuck off to an island or something with his $millions🖕 https://t.co/FeNMrmJlDa",hecivan70
Newcastle,2020-10-20 19:21:12+00:00,1318633385602936832,@franksting We seem to be one of the few countries with the ability to manage this pandemic.,mediahunter
Newcastle,2020-10-20 19:08:38+00:00,1318630221818470400,MAKE CHINA PAY....Bianco: Trump Administration can repatriate $1.8T in CCP bond debt for pandemic relief https://t.co/OF2HGnqBlj,tonialdous6
Newcastle,2020-10-19 22:23:11+00:00,1318316794805854209,"""I know that we're in a pandemic/recession right now so its the perfect time to legislate jobs away and tax to death the people who can work.""",Diesel_R00
Newcastle,2020-10-17 10:54:49+00:00,1317418786580951042,"Massive congratulations to Jacinta Ardern - she’s led NZ with tenacity &amp; dignity through a terrorist attack, volcanic eruption &amp; global pandemic in her first term, all while nursing a newborn! You go girl! https://t.co/LPl73HKVsL",SharonClaydon
Newcastle,2020-10-15 03:15:43+00:00,1316578471385001984,Got 5 laugh reacts in the group chat overnight. Probably gonna be able to ride this high for the rest of the pandemic,Jrafferty43
Newcastle,2020-10-13 03:10:09+00:00,1315852294970208257,Treating dental patients in the covid 19 pandemic.1: all visits 1 hour 2: double wipe down between each patient 3: change and dispose PPE after each patient 4: spray the air in room with Glen 20 5: patient covid declaration and temperature check,leonard_fabre
Newcastle,2020-10-11 02:54:23+00:00,1315123551054094336,"@leighsales @normanswan @CaseyBriggs Not sure, but is it that the NSW track &amp; tracing has been superior for most of the pandemic?
I’ve not got data in front of me, but I have a feeling from what was reported, most MSW cases were tracked to clusters, pretty quickly in comparison to Vic.",paullyfromaus
