City,Datetime,Tweet Id,Text,Username
Townsville,2020-11-28 12:02:57+00:00,1332656221187313667,"In February, I struggled to get my head around Coronavirus. I thought back to a movie, “Smallpox 2002” which I had seen back in 2003, and right through 2020, I felt the documentary style movie to be prescient and even educational to what was to come.  5/",MarcoParigi1
Townsville,2020-09-02 10:20:55+00:00,1301102801880190977,"@SChandlerBing Ahh, but coronavirus is a scam!",ccharles93
Townsville,2020-07-30 06:24:01+00:00,1288721996692328449,"JUST IN: Three women have now been charged for allegedly lying about their travel history at Queenslander’s border, when returning from coronavirus-ridden Victoria. All 3 are now cooperating with police. Details coming up @WINNews_TVL https://t.co/GXGT9zQ2j7",CiaraEJones
Townsville,2020-06-13 05:55:58+00:00,1271682705806094336,USA: 4 months of coronavirus in 2020 now equates to 4 years of losses in WW1 https://t.co/UXQh54O7aj,ccstockwell
Townsville,2020-06-07 04:04:04+00:00,1269480219414392835,"Y en a leur seule réaction par rapport aux rassemblements BLM c‘est „gneugneu le coronavirus“ , remettez-vous en question",wickedpeep
Townsville,2020-05-26 01:12:20+00:00,1265088346310639616,Coronavirus case confirmed at Waverley College in Sydney's east - ABC News https://t.co/QyjpIC9ltK,sbv72
Townsville,2020-05-24 02:38:53+00:00,1264385350811570176,"Who are the frontrunners in the coronavirus vaccine race?
https://t.co/N0D6CzJJvA #BrentJamesThomas",BJThomas_Comp
Townsville,2020-05-18 11:57:16+00:00,1262351544848007168,https://t.co/cxwS4kq1kf @TEDx @BillGates @BarackObama @UN @realDonaldTrump @ScottMorrisonMP #COVID19 #CoronaVirus @GlblCtzn @marshawright #WorldBank #WeFindACure #StopTheHate #StopTheTorture #PeopleAreDying #HelpTheHomeLess #News #WorldNews,JessieJamesLan
Townsville,2020-05-13 02:17:20+00:00,1260393659301638144,TONIGHT: Police have fined four men - two from Brisbane - for breaching coronavirus restrictions. It’s alleged the men were camping on Brisk Island off the Townsville coast. The bodycam footage tonight @WINNews_TVL @EmilySteinhardt https://t.co/MiMFzKlHy4,CiaraEJones
Townsville,2020-05-05 23:06:55+00:00,1257809025959292930,Wednesday update: ZERO new #coronavirus cases recorded in Queensland overnight. Just 52 active cases remaining @WINNews_TVL,CiaraEJones
Townsville,2020-04-28 23:25:07+00:00,1255276889436028928,"A small business owner from Charters Towers won $1.9 million in Saturday’s Gold Lotto 💰💰

“We’ve had to shut down due to coronavirus so it’s been tough. I was getting really worried that I’d have to close for good, but this means I won’t have to”. Report @WINNews_TVL https://t.co/WtxyqmMa1z",CiaraEJones
Townsville,2020-04-27 09:07:17+00:00,1254698623834587138,@theprojecttv The Coronavirus safe app. Are we worried that the others are tracking us? #hellogoogle,PaullLisa
Townsville,2020-04-24 07:22:59+00:00,1253585209389314050,Coronavirus risks widening intergenerational wealth divide https://t.co/LxzgOAQpkz,Trisrove
Townsville,2020-04-24 07:12:49+00:00,1253582653929910272,Coronavirus risks widening intergenerational wealth divide https://t.co/LxzgOAQpkz,Trisrove
Townsville,2020-04-17 22:08:52+00:00,1251271434086711296,"We all need to think of ways we can bring down the Chinese Communist Party. They have brought the world to its knees, they have to be held to account, not the Chinese people just their evil authoritarian government. @coronavirus @covid19  @ChinaLies @wuhanpandemic @china",ThePlatinumBac1
Townsville,2020-04-17 10:39:06+00:00,1251097849284096000,Fighting a half-hearted battle against #fakenews over on a local #Coronavirus fb group honestly too weary to put my heart into it but people will defend any old rubbish if it supports their existing beliefs #digidex,librarian_bro
Townsville,2020-04-17 01:03:10+00:00,1250952913536475138,"Finished! Now I can say back in the ""CORONAVIRUS"" days I painted this mural. 🤔😜
Follow @bidju_designs 🖤💛❤️
-
#bidjudesigns #smallbusiness #indigenousbusiness #indigenousart #artist #ayr #australia #schoolmural #mural #streetart #painting #yarningcircle #rainbowserpent #snake https://t.co/GDjIlKp5Vv",BidjuDesigns
Townsville,2020-04-15 20:59:57+00:00,1250529316548599811,Before coronavirus..... before the @vivienne_starr studio closed....before social isolation.....before we had any clue what life was going to become.....I’d started teaching ‘Never be the same’ to a great group of… https://t.co/y3ZfpcUHg8,vivienne_starr
Townsville,2020-04-12 18:21:55+00:00,1249402381298622470,"Okay, Covid-19. Now you’ve gone too far. (And thanks, Tim. For everything.)

Goodies star Brooke-Taylor dies with coronavirus https://t.co/G5ZgrXW9HO",OzhoopsDrek
Townsville,2020-04-12 07:17:31+00:00,1249235182298644480,"Je suis à l’université en Australie
Les étudiants internationaux on paie une FORTUNE pour étudier là-bas et il n’y a AUCUNE MESURE pour nous aider avec le coronavirus et tt
Alors que les étudiants Australiens reçoivent de la thune en plus toutes les deux semaines du gouvernement",wickedpeep
Townsville,2020-04-06 04:38:48+00:00,1247020913498832896,Home isolation with a 3yo &amp; 3mo... it’s fair to say we’re all going a bit stir crazy 😝 🦸🏼‍♀️ 🦸‍♂️ #SideEffectsOfQuarantineLife #athometogether #coronavirus @Avengers @MarvelStudios @CaptainAmerica https://t.co/oaalBmjoxi,katebanville
Townsville,2020-04-05 00:11:22+00:00,1246591222040289280,"You may be able to spread coronavirus just by breathing, new report finds https://t.co/E6nmzd3f22",physiologyfish
Townsville,2020-04-03 08:00:19+00:00,1245984462002728961,@3M Mike Roman is a POS.  Denying health workers PPE for a profit at a time like this.  I hope he gets coronavirus and is refused treatment.  3M as a brand now represents the lowest of the low.,AlanBirrell1
Townsville,2020-04-03 07:57:34+00:00,1245983768692674565,@elkspotter3 @3M I hope he gets coronavirus.,AlanBirrell1
Townsville,2020-04-02 21:21:39+00:00,1245823733668777985,From gripping sagas to personal essays: Australian books for the coronavirus lockdown https://t.co/fjP8tuC0bK,MaryWho4810
Townsville,2020-04-02 10:03:52+00:00,1245653164549746691,The Chinese Government must pay. This evil regime needs to take responsibility. This is their nasty government not about the suppressed Chinese people. #china #ChineseVirusCorona #ChinaLiesPeopleDie #COVID19Pandemic #coronavirus #freechina #liberatechina,ThePlatinumBac1
Townsville,2020-04-02 02:14:37+00:00,1245535074688225281,Every time ScoMo finally gets to the important coronavirus changes ....... https://t.co/7hlMkaxTe9,casgarvey
Townsville,2020-03-30 05:41:27+00:00,1244499962576044032,"Then I realised that with the Olympics postponed, as well as virtually all popular sport, the only tally number crunchers could study is the Worldometer Coronavirus tallies. The idea is the “hammer and dance” “flatten the curve” ideas. Who’s ahead in this medal tally?",MarcoParigi1
Townsville,2020-03-30 05:41:25+00:00,1244499954938179584,"One thing I’ve been obsessing about since the start of March is this: What is the optimal strategy for countries in the long term for attacking the #Coronavirus Pandemic? Then I saw this:

https://t.co/J8ys7fY02l https://t.co/TcKiRp0GtZ",MarcoParigi1
Townsville,2020-03-26 06:22:10+00:00,1243060657613705216,"Really good explanation of what people with #diabetes  (type 2 and type 1) are facing with #coronavirus / #COVID19 via CNBC 
[https://t.co/V9k0BfORVm](https://t.co/V9k0BfORVm)",aussiebrite
Townsville,2020-03-25 19:34:02+00:00,1242897549087789056,"I’m wondering why it is that the world is not angry at China for bringing about the Coronavirus because of disgusting practices of keeping and eating bats, pangolins and snakes?  Markets should be cleared if those animals and sanctions against the Chinese should occur. @DJ_Rod",polgodsgirl
Townsville,2020-03-23 17:12:51+00:00,1242137243419938816,"Coronavirus is devastating Italy, but one town says its testing regime is containing the outbreak https://t.co/BZnL6HPOut via @ABCaustralia",NeenyGee
Townsville,2020-03-22 21:10:30+00:00,1241834662520971264,The USA is on terrifying trajectory... #coronavirus #COVIDー19 🦠 🇺🇸 https://t.co/YZt9VW7eAu,lukeacl
Townsville,2020-03-22 03:55:05+00:00,1241574090013433856,"The USA under Trump is always winning. Always shooting (pun intended) to be number one. Don’t stop, never give up, hold your head high and reach the top! 💫 🦠 #coronavirus #COVIDー19 https://t.co/nygH2UigMv",lukeacl
Townsville,2020-03-22 02:43:44+00:00,1241556138115518464,Coronavirus pandemic: Tense times for bookshops as an unwelcome chapter opens https://t.co/bzJFma25KY,MaryWho4810
Townsville,2020-03-22 01:33:39+00:00,1241538499129438209,"Infographic: Queensland coronavirus flight details -  https://t.co/bRrYDkXGSu   If you have been on the relevant flights and rows listed, contact 13 HEALTH immediately - people who need to self-quarantine for 14 days are those who are in the identified rows of the flights listed",NeenyGee
Townsville,2020-03-19 01:22:30+00:00,1240448528503189505,"Coronavirus Pandemic, day 16.
If anyone is still out there, I’m alive but struggling. Food is running low. Down to only 459 days worth. My hands are super sanitized and my butt is super clean. Down to 1599 rounds of… https://t.co/G1eZkV0b8P",UMFTownsville
Townsville,2020-03-17 10:20:26+00:00,1239859130992439297,"I Will Survive, Coronavirus version for teachers going online https://t.co/5OIdBurT1v via @YouTube",BanNonWat
Townsville,2020-03-12 08:11:22+00:00,1238014708352831490,Coronavirus: Why You Must Act Now by @tomaspueyo https://t.co/V6aiMFhAEw,sbv72
