City,Datetime,Tweet Id,Text,Username
Sunshine Coast,2020-04-17 06:26:07+00:00,1251034183671197696,Only a few hours to go and the latest interview drops with @wayneschwass @puka_up We cover his career and what he’s done to be a leading spokesman for mental health #thrivethroughadversity nationalmakegoodsolutions… https://t.co/Nfx1XjfFrl,CoreyMcKernan
Sunshine Coast,2020-04-15 19:34:21+00:00,1250507773768462336,"Note to self for today:

Stop responding to #MoneyOverNonni accounts ARGH!!!

#MentalHealth #SelfishTossers https://t.co/lMbX4SiUvV",YaThinkN
Sunshine Coast,2020-04-14 11:05:51+00:00,1250017418539413505,"Good clear advice: COVID-19’s mental health effects by age group: Children, college students, working-age adults and older adults https://t.co/d8Hx9atDH5",VirtualOT
Sunshine Coast,2020-04-07 11:21:58+00:00,1247484760340873216,The mental health and wellbeing of our junior doctors is paramount during this crisis. Sign up to @HandnHandAU to get support from your peers #InThisTogether #MentalHealthAwareness @ama_media @blackdoginst @PatMcGorry @orygen_aus https://t.co/iCpY7MiF1B,Tahnee_Bridson
Sunshine Coast,2020-04-05 00:35:52+00:00,1246597389407879169,"Above all else, mental health needs to be your top priority in these times. Without it, all else fails! #mymorning #selfcare #selfisolation @ Sunshine Coast, Queensland https://t.co/IqRqVnKj8p",Paul_Barrs
Sunshine Coast,2020-04-04 17:59:22+00:00,1246497605422477313,"Right. Refusing to look at Facebook at all, will just assume extended family ok, as that is just enraging me. #MentalHealth

Starting my morning again....

GOOD MORNING 😎
Please enjoy this lovely serene photo my friend took on Friday morning on her way to work. https://t.co/jASdUoVIP1",YaThinkN
Sunshine Coast,2020-04-03 22:58:14+00:00,1246210428310413312,"@Sheoakbloke1 @traceywithhope @L1I9N6K4 @deniseshrivell The one that wanted the funds for sending the kid off for the totally inappropriate 'trial job' was one of the religious providers. Could not believe was told to lie on form about mental health, why else at a disability provider for FFS! Was horrified.",YaThinkN
Sunshine Coast,2020-04-03 22:50:23+00:00,1246208455058149376,"@traceywithhope @L1I9N6K4 @Sheoakbloke1 @deniseshrivell Not come across an exceptional one yet. Not as an employer dealing with them, nor any person ever in my circle who has had to deal with them in this area. In fact, the one disability one you have to use in my area - no choices - wanted kid to lie about mental health for interview",YaThinkN
Sunshine Coast,2020-03-31 00:14:22+00:00,1244780038072893440,"We are all in this together💓 
stay connected＆stay safe😊

#InThisTogether, an initiative of mental health organisations, experts＆leaders, provides tips to help Australians remain socially＆emotionally connected with family, friends, neighbours＆your community.

#Australia🇦🇺 https://t.co/mRRwbIGmx4",Yukika_OVDM
Sunshine Coast,2020-03-30 09:10:51+00:00,1244552658616086528,"At first look, the economic support for workers announced today by @ScottMorrisonMP &amp; @JoshFrydenberg looks on the money. Huge boost to the #mentalhealth of millions. Australia can come out of this pandemic in pretty good shape. #COVID19Aus",johno0910
Sunshine Coast,2020-03-30 00:19:09+00:00,1244418853905416192,Lots of articles appearing abt mental health &amp; msgs like 'how do u know ur having MH issues'.. while I agree now more than ever it's so important to look after ur mind.. I wonder if these r more clickbait &amp; panic inducing... 🤔 #covid19 #socialisolation #mentalhealth #coronavirus,gtd_andrew
Sunshine Coast,2020-03-24 08:12:04+00:00,1242363538242404352,"Hey friends, just checking in on you all for the evening. How are you feeling? Mananging to keep calm? How are you practicing self care?
I've got some vodka chilled and a candlelit bath planned after miss 5 heads off to sleep.
#mentalhealth #checkin #covid19 https://t.co/JCzVOWw1dq",ALP_Australia
Sunshine Coast,2020-03-24 07:27:29+00:00,1242352317950619648,Community mental health services are withdrawing home visits &amp; transporting consumers to depots &amp; clinics. Must “Flip-the-home-visits” &amp; include free internet for consumers. NOW. #COVID19Aus https://t.co/8FmZiossme,johno0910
Sunshine Coast,2020-03-23 19:58:25+00:00,1242178908855795712,"Over the coming weeks, most of us will experience social iscolation for longer than ever before. 
Its incredibly important to consider our mental health during this time.
In such uncertainty, take some time to check in with your friends/family. You are not alone x 
#coronavirus https://t.co/V4uyTN5dlw",ALP_Australia
Sunshine Coast,2020-03-23 12:03:53+00:00,1242059488422551552,Please take care front line doctors: Physician Mental Health: ‘We are not Immune’ https://t.co/gG80Dmaua7,VirtualOT
Sunshine Coast,2020-03-22 23:42:39+00:00,1241872953513373696,"Oh, if you care about your mental health, turn off the commentators now.

Just more bullshit about 'game of politics' rubbish, as in ""sombre, sober""... Just bullshit PR, it won't help your lives.",YaThinkN
Sunshine Coast,2020-03-22 13:28:41+00:00,1241718444455792649,@peterstefanovic This is going to be a mental health minefield. What about kiwis that are residents not normally able to access payments through centre link.,Tsfraser777Tim
Sunshine Coast,2020-03-21 12:25:21+00:00,1241340115659534343,@rahmstorf @motogogowww Good call - especially the mental health issue !,chesney_bea
Sunshine Coast,2020-03-21 02:33:09+00:00,1241191083326885889,"We are not in lock down yet! In QLD, we are lucky to live in coastal areas that aren't densely populated. While in isolation, be smart, keep your distance but PLEASE remember to get outside! ☀️ It's so important for our physical &amp; mental health to soak up the sun &amp; fresh air 💙 https://t.co/VAKILSyhx2",stephsocial_
Sunshine Coast,2020-03-20 21:59:13+00:00,1241122149202452480,"I love ABC, I really do. 
But... I have to turn it off for my own mental health. The stupid, utter stupid that has not helped inform or educate anyone this morning in reality is just astounding.
Whoever the producers/editors are on the weekend need a reality check. https://t.co/en8oEU6t2V",YaThinkN
Sunshine Coast,2020-03-16 00:10:17+00:00,1239343193755275265,"I haven’t had a true ‘day off’ coaching in over nine months. To be frank, it’s not hard when you love it. But today, a needed ‘mental health day’ is in order. Always good to take a day every now and then",triathlonlachie
Sunshine Coast,2020-03-15 23:03:47+00:00,1239326456108290049,"@shane25873 Apparently, being dead is bad for one’s mental health too. Who knew?

Stay safe, friend.",MikeFitzAU
