City,Datetime,Tweet Id,Text,Username
Townsville,2021-02-11 03:57:22+00:00,1359713110911717382,"Prayer ...
More powerful than anxiety. 

Blessya!
 #lovegod #lovepeople https://t.co/Z1ezrLgtNb",PastorWas
Townsville,2020-10-22 09:31:28+00:00,1319209746700775424,"So Bruce just scared the crap out of housemates mum who has a heart condition, so my anxieties have kicked in hard core, he didn't mean to scare her and she not used to big dogs, but I feel so bad 😢😢",slotheswench
Townsville,2020-07-22 11:18:39+00:00,1285897039151116289,We are currently receiving wet season levels of rain here in #Townsville in the middle of winter... It’s obviously not going to stick around for long but anxiety.. 😬,lukeacl
Townsville,2020-07-10 03:41:38+00:00,1281433371495653376,"@TheBeagleGirls Yes I do , mine suffers bad seperation anxiety and when I leave he tries to find me , I settles him for a while,",slotheswench
Townsville,2020-06-27 03:13:49+00:00,1276715330413268992,Just had a coffee for the first time in a year and I'm just wondering if it's socially acceptable to have an anxiety attack in the middle or a shopping centre,itsmaddyrowe
Townsville,2020-06-11 10:50:20+00:00,1271032008664215552,Let the record state that I will be going on 2 X Tinder escapades over the weekend because treat YOself (to social anxiety),itsmaddyrowe
Townsville,2020-03-23 21:07:44+00:00,1242196356606951425,"In times of great uncertainty, stress and anxiety you can only try to control your reaction to the situation you find yourself in. 

Breathing, meditation and stretching are all key practices FGS would recommend you… https://t.co/JVjuspSKEB",FitGreyStrong
Townsville,2020-03-18 09:57:24+00:00,1240215721109417989,@StirlHinchliffe @gracextwo @StevenJMiles please don’t forget about the school staff who are in at risk categories (+70yo 👴 pregnant 🤰 woman etc). They can’t social distance in the classroom. No comms on what they should do. UK ordered 🤰 to stay home. Lots of anxiety.,raroson
