City,Datetime,Tweet Id,Text,Username
Melbourne,2020-03-10 22:59:36+00:00,1237513466501423105,"@MeganM4Kids  highlights A connection between children’s exposure to violence and their mental health, safety and wellbeing #EYSummit2020 @BeYouEarly #earlychildhood #mentalhealth",DebYates_1
Melbourne,2020-03-10 00:31:00+00:00,1237174080345796608,Wonderful morning at the @tandemcarers International Women’s Day breakfast exploring the themes #Mentalhealth asylum and community-based care in Sandy Jeff’s &amp; Marg Leggatt’s new book. https://t.co/Uw9Iw5e9t6,Lisaannesweeney
Melbourne,2020-03-09 10:26:42+00:00,1236961604484259842,"Final 24hours! Last chance to donate &amp; show your support for people with lived experience leading change in #earlyintervention in #mentalhealth! Donate Now: https://t.co/gVHp7WYnRW 

#codesign #livedexp #timetoact #timetochange https://t.co/bLhTDKscBG",IEPAnetwork
Melbourne,2020-03-09 01:35:32+00:00,1236827931634044930,"@Gaohmee Hey there! I’m Sarah ☺️
I’m a community and social media manager who cares a lot about mental health. I’m also looking to take on another part time contract role! My DMs are always open 💕 https://t.co/XYscGGK38r",sarah_crowe
Melbourne,2020-03-07 06:55:04+00:00,1236183568050556928,I think the fact i can only see snippets of this might just well save my mental health this weekend. @HillaryClinton you were robbed of the Presidency...  #HillaryOnHulu,JohnOSullivan36
Melbourne,2020-03-07 06:45:16+00:00,1236181102491926530,@zinoviev1 @BevanShields Or mental health and mental illness,g_sheehan1
Melbourne,2020-03-07 06:43:09+00:00,1236180569295163394,Would be amazing if Gov put this amount of scientific effort into the science of #Mentalhealth ... 8 suicides a day and millions living without the treatments they need to live a mentally well life https://t.co/tvweQrfKwa,g_sheehan1
Melbourne,2020-03-07 05:30:19+00:00,1236162239683424256,But insulting politicians based on their percieved intelligence or mental health is too easy and conveniant for people who don't think about ableism and stigma. It doesn't require people to acknowledge that mental illness or disability doesn't make someone a bad person. 2/3,CatherBernard
Melbourne,2020-03-07 00:32:18+00:00,1236087240880611328,"#Day5 My psychologist played a huge role in keeping my #Mentalhealth in check. I had never seen one before my PhD, and I am forever indebted to her taking care of the “less cared about” part of our bodies. #MentalHealthMatters #AcademicChatter @AcademicChatter https://t.co/4nN1B222V5",R_Haddara
Melbourne,2020-03-06 23:06:43+00:00,1236065704165568512,"IABC APAC has decided to postpone #Fusion20 - not an easy decision, but people’s health and wellbeing need to come first, which perfectly aligns with insights I was due to present about #mentalhealth Take good care of yourselves #communication colleagues https://t.co/Qw2ASFnZiM",mairibarton
Melbourne,2020-03-06 20:42:24+00:00,1236029384705769472,"Twitter is seriously bad for my mental health. It often reminds me of my school days: wanting to be liked by the cool kids, antagonized by the bullies, occasional laughs but mainly depression.
Twitter is, sadly, an addictive cacophony of brainfarts. Maybe it is time to step away.",Ben_Ripley42
Melbourne,2020-03-05 11:49:30+00:00,1235532888747266053,"Anyone grappling with their #Mentalhealth may wish to take a peek at this website &amp; book which saved my life #bipolardisorder ...

https://t.co/iU7kZwPyhD https://t.co/vnqiJ5Y2W1 https://t.co/BtKviWDi2m",D_M_Clark_
Melbourne,2020-03-05 11:47:36+00:00,1235532410898354176,"And, yet,
even I know
that I deserve
everything—

every insult,
every wince,
every grimace,
every exclusion.

Everything.

#poem #poetry #poetics #amwriting #deserving #thoughts #self #narrative #pain #mentalhealth #writersoftwitter #poet #poetsoftwitter",scripturient_me
Melbourne,2020-03-05 09:21:59+00:00,1235495767168544768,After a week struggling on the idiot line I asked for tomorrow off and it was declined...So much for caring about my mental health! Liars! Oh well they'll get what they've asked for 🤣,nursebinky
Melbourne,2020-03-05 07:02:03+00:00,1235460550215098369,"Mental health is just as important as physical health and it’s important to look out for those who may be finding this outbreak stressful - some sound advice here from the @WHO
This weekend we’ve decided we’re going to switch off the news in our house to give us a break 🙏🏻 https://t.co/4iVsdi5ZYB",Louisa_Aus
Melbourne,2020-03-04 20:33:34+00:00,1235302385708302336,This is an important reminder - please support people’s efforts to quit smoking - it’s frightening to think of how badly some people already struggling with multiple physical and mental health issues may be impacted @mindaustralia https://t.co/QdSBXotHGj,LisaMBrophy
Melbourne,2020-03-04 18:48:27+00:00,1235275934682378240,Students To Get Mental Health Support After Bushfires https://t.co/bPvIRATOVo via @danielandrewsmp,Frank_McGuire
Melbourne,2020-03-04 13:16:57+00:00,1235192506792329222,"Globally #mentalhealth is not fit for purpose because #livedexperience is not valued as it should be, there’s no incentive to help people heal &amp; there’s no systemic learning or evaluation globally to bring together those who’ve been through the nightmare of “diagnosis” &amp; survived https://t.co/xvm287tw1A",D_M_Clark_
Melbourne,2020-03-04 13:11:11+00:00,1235191056406200320,Who knows we may yet see a fit for purpose approach to #Mentalhealth when #psychiatry releases patients matters and stop all this back-scratching 🥳 https://t.co/mvClN1Eevf,D_M_Clark_
Melbourne,2020-03-04 13:08:08+00:00,1235190291612585985,"Maybe this book might help as you lead in delivering a fit for purpose approach to #Mentalhealth 🤔

https://t.co/iU7kZwxWT3 https://t.co/b5VUsvcnmz https://t.co/G29sodr0Gi",D_M_Clark_
Melbourne,2020-03-04 13:05:02+00:00,1235189508976439296,"Maybe some adults and elderly people who live on the cusp of society might like a visit too 🤔...

@DukeCambridge1 @BorisJohnson @MattHancock @TheBMA #Mentalhealth #mentalhealthmatters @bmj_latest @NHSProviders @NHSEngland https://t.co/8YAlLLIBOc",D_M_Clark_
Melbourne,2020-03-04 13:01:29+00:00,1235188617401655298,#ageism is rife in #Mentalhealth 🥳 https://t.co/vaxsWZNZry,D_M_Clark_
Melbourne,2020-03-04 10:04:34+00:00,1235144094080360448,"Where are you global leaders?

And why are you abusing our #humanrights for fit for purpose #mentalhealth care focused on improving outcomes?

@ScottMorrisonMP @AlboMP @GregHuntMP @Bowenchris @jacindaardern @BorisJohnson @MattHancock @RCMentalHealth @ozprodcom @NMHC @TheBMA https://t.co/8lQ78MN3IH",D_M_Clark_
Melbourne,2020-03-04 00:09:20+00:00,1234994298308849664,"Hi,

Well, I’m at my nice mental health appointment I’m not to worried about my doctors charging me with split personality disorder. I’m just a nice man doing my music and mental health groups thru out the weekdays.

I’ve done music all my life buy an album. https://t.co/u0T4TB3vv5",KAtChEM_CS
Melbourne,2020-03-03 22:03:02+00:00,1234962515714396160,@mana_kailani @gencheats Can people stop showing the head grifters gruesome visage ?? I fear for my mental health if I see it one more time 🤮🤮🤮🤮,Culldogfarms
Melbourne,2020-03-03 19:04:50+00:00,1234917667129020416,NEW #vlog for @HeadTalksNews listing 4 top things to do post panic attack. I’ve so enjoyed partnering with Headtalks to make this. Give them a follow for all things #mentalhealth related. #MentalHealthMatters ❤️❤️ https://t.co/8RHGK6h71N,emilyseyesexplo
Melbourne,2020-03-03 11:59:44+00:00,1234810689597865984,"Welcome to #ssa (Soul Searchers Anonymous).... @sophieloulife ft. miami_writes 
・・・
As we all know, Mental health is very real and should never just be a conversation for a week or 2, or when we hear about a public… https://t.co/ImUeHJcDG8",MrmiamiUk
Melbourne,2020-03-02 14:08:50+00:00,1234480788294356995,"@DamienHamilto17 @LyleShelton Salvation Army &amp; St Vinnies are brilliant. But many churches aren't doing enough. If homelessness is on the rise, poverty isn't declining, mental health issues &amp; drug addiction are increasing - all the while many churches amass record wealth: then more can and should be done.",LotToThinkAbout
Melbourne,2020-03-02 09:00:32+00:00,1234403202310623232,@akaBarni It’s not a case of forbidding. It’s what your government guarantees as a right. People with mental health issues get care. Australia has a homeless issue too.  But no street poo.,welshalan
Melbourne,2020-03-02 03:34:18+00:00,1234321106112114691,"@peggymel2001 What planet are these cretins from?..clearly not this one because Australia is set for an unprecedented mental health crisis as the fallout from bushfires..mental health, environment, climate are inextricably linked..do they honestly think economic growth is the panacea of all?",Meldawson6
Melbourne,2020-03-02 01:23:14+00:00,1234288121778278401,"https://t.co/GeFBs0upSy mental health issues include childhood rearing , exposure to domestic abuse poverty drugs certain mental illnesses",ManjulaOConnor
Melbourne,2020-03-01 23:32:06+00:00,1234260154473799680,"@divpfriends @ServicesGovAU Pack a lunch and drinks, visit a centrelink office and meditate for calmness. After appointment,  book a medical mental health plan for a psychologist to support your distress from the experience.",koropaul
Melbourne,2020-02-29 10:37:41+00:00,1233702876045643776,And Chairperson of the Mental Health Foundation Australia https://t.co/JiIDwr2KyM,KathyDu28302384
Melbourne,2020-02-29 10:13:22+00:00,1233696755872456704,He is also Chairperson of the Mental Health Foundation of Australia https://t.co/VlwfTQMoGU,KathyDu28302384
Melbourne,2020-02-29 05:02:54+00:00,1233618627036774403,"@MathiasCormann @KKeneally @JEChalmers @JoshFrydenberg Dear Mathias, have you for a moment thought how offensive mocking #wellbeing is to those of us who struggle with our physical and mental health everyday? And last time I checked you were the government so do something. Labor are a long way from raising any taxes. 🤦🏻‍♀️",cinquecento62
Melbourne,2020-02-28 23:32:17+00:00,1233535425148485632,"""Mental health may be the only field of science where a piece of art can teach you something that data can’t."" 

I love this❤️ @TheFlorey @daxcentre https://t.co/mE1evMVZVi",Deena_Ebaid
Melbourne,2020-02-28 22:06:03+00:00,1233513721252712448,"Brave is the word that comes to mind reading @willwilson1997 story💜 Mental health in athletes is and should be a priority, @WaspsRugby 👏🏾👏🏾👏🏾, stories like this will resonate with so many, thank you for your courage @willwilson1997 https://t.co/u3j9M3yh3K",Moanaleilua
Melbourne,2020-02-27 23:18:48+00:00,1233169641830092801,"Let’s not forget the other consumer in home based care - the carer(s) at home.  The transfer of nursing care, role of monitoring “pt” needs, time forgone for domestic duties; the mental health of carers, their children etc need to be considered. @SaferCareVic #VCC #homebasedcare",hnguyen2012
Melbourne,2020-02-27 08:26:56+00:00,1232945194938466309,"Listening to Hugh from @ResilienceP Project: “24% of kids in primary school have a mental health issue.” He says 3 things needed for resilience: gratitude, empathy and mindfulness",ReneeHancock1
Melbourne,2020-02-27 08:20:00+00:00,1232943450837749761,"I was aiming for 12km tonight, but I pushed to 13km.
Guess why?...I was super motivated by @DemocracyTalk’s donation to my @SANEAustralia fundraiser! Who’s gonna help me get to 14km? https://t.co/1oMFkFBmC1

#Running #MentalHealth #HalfMarathonTraining https://t.co/Zp6T1vnXt2",TimothyKariotis
Melbourne,2020-02-27 04:20:29+00:00,1232883174897664000,Tfw you so insecure [bc your past or mental health or some shit?] that a harmless comment triggers you into sadness. 😭😭😭😭 why am I a baby lol,AnnekaNZ
Melbourne,2020-02-27 00:35:40+00:00,1232826598568714241,#literacymatters #ebooks #nook #barnesandnoble #selfhelpbooks #mentalhealth #abusesurvivor #abuserecovery I hope this helps. @ Some Where on Earth https://t.co/2xYMbKP7RP,DenebolaZenFoto
Melbourne,2020-02-26 12:00:33+00:00,1232636568466100224,"@GirlTalkZA Food, beauty , vlogs &amp; mental health 💕🤗

https://t.co/ENoXmTZgF4",IamTheLorr
Melbourne,2020-02-26 07:52:06+00:00,1232574041799544833,"Wonderful Wesley College - Melbourne!  An incredible 5 hours delivering to the amazing Year 7, 8 &amp; 9 students, empowering, inspiring and equipping students to build resilience, and get the “monkeys” of their backs 💪
#GetTheMonkeysOffYourBack #leaderofyourlife #MentalHealth https://t.co/DvpCZegvPf",DanielMerza
Melbourne,2020-02-26 06:38:03+00:00,1232555405450129409,"Take care of your mental health 🙂✌ @ Melbourne, Victoria, Australia https://t.co/uOW1Xt1Pld",ShanleyJason
Melbourne,2020-02-26 03:50:12+00:00,1232513164278820865,"I've been so extraordinarily fortunate to have friends looking after me, taking me on mental health holiday and helping pay bills and rent for the last 12 months, I've had no steady income and no Centrelink despite doctors certificates... and now I have the flu. 1/~",Glitch_Witch_
Melbourne,2020-02-26 02:31:21+00:00,1232493321399914496,Haha. True but they're really the ones we want to ignore for our mental health #auspol https://t.co/cox6wEJTHw,ShainaIsaacs
Melbourne,2020-02-25 05:11:56+00:00,1232171347146502146,"@HMMurti @warren_bunting @Lisa_Wilkinson @beyondblue @LifelineAust If suicide is not a mental health problem what is it? That he should have started with that instead of hannah and her kids, would that make him sane?",SimonB1958
Melbourne,2020-02-25 03:41:21+00:00,1232148552643571712,"@FloralAndy @n_dav94 It’s great that you’re sharing your mental health struggles which MANY ppl can relate to... but i struggle to believe u don’t see the dissonance between the post and two shirtless selfies of u looking like a fit, conventionally attractive white dude.",ANDY_P_S
Melbourne,2020-02-25 00:14:17+00:00,1232096439301328896,@lozf85 @todd_hodkinson9 @sammysaway @warren_bunting @Lisa_Wilkinson I totally agree. I don't mean to suggest its the vast majority of people who deal with mental health issues and dont murder their family. I am not a mental health expert.,SimonB1958
Melbourne,2020-02-24 21:40:27+00:00,1232057728329084929,Thanks @ahmhealth for using your expertise with this experiment #mindfullness #mentalhealth  https://t.co/fapGZ1Xt5R,juleshughan
Melbourne,2020-02-24 20:37:28+00:00,1232041878477893632,PM should take the lead on mental health funding reform https://t.co/1R6IG8IYd3 via @theage,PatMcGorry
Melbourne,2020-02-24 12:34:34+00:00,1231920349714907138,"Nearly 80% of Australians affected in some way by the bushfires, new survey shows..get ready for the human impact that will cause unprecedented pressure on already pathetic mental health structures in this country..we are soooo unprepared for fall-out.. https://t.co/weD1c647Nz https://t.co/1TmFCFL3mP",Meldawson6
Melbourne,2020-02-24 09:07:35+00:00,1231868264109592578,After a rough mental health day it's so good to get all the positive vibes off Twitter. Thank you all ❤,nursebinky
Melbourne,2020-02-23 21:54:41+00:00,1231698921275047936,"Nothing to see here, just a young man experiencing mental health challenges... #IslamIsCancer #PaedophileSkyfairy #MayHeBeCoveredInPigShit Man shot dead by police following stabbing incident in Brisbane CBD  https://t.co/mZ9BxDjCv2",Aussie_14
Melbourne,2020-02-23 15:15:09+00:00,1231598375780278273,"Struggled with feeling depressed tonight despite having a good meal, walking the dog and watching a romantic comedy. Tried looking at some day jobs, managed to apply for one despite feeling anxious about it. I wish improving my financial situation wasn't so elusive #mentalhealth",belillustrates
Melbourne,2020-02-23 14:44:16+00:00,1231590603848208384,Greg Hunt: Stop cuts to holistic mental health care - Sign the Petition! https://t.co/Ld7fcZQqr0 via @ChangeAUS,elgmaster
Melbourne,2020-02-23 09:39:25+00:00,1231513886777470976,Mental health card played. ✔ Angie #dwtsau,simonshirley72
Melbourne,2020-02-23 05:44:14+00:00,1231454702107185152,A master class. A win for mental health. Fury is the best heavyweight in the world. #WildervsFury2,kelvinfiji
Melbourne,2020-02-22 03:49:44+00:00,1231063498529984512,@EduTweetOz I developed this FREE presentation to help teachers to take care of themselves https://t.co/jn5HzjMqLA it’s about self care and be present matching your educational goals #pe #physed #mentalhealth #teachers #health,SportandiAndres
Melbourne,2020-02-22 01:25:11+00:00,1231027119481749504,"Why work 4 what they paid 4?Instead of punitive measures what about rewards.I agree pensioners have so much to offer, guards against poor mental health etc. I see the decline in my mum 89 who gave up volunteering last yr https://t.co/rXvo19uLB3",YcookBlog
Melbourne,2020-02-21 10:21:51+00:00,1230799787236020225,Went on my first walk today in 5 years! I used to walk the same route 6 days a week. I used to love it and it’s great for mental health too. Now to keep it up 😬,RayeCharles
Melbourne,2020-02-21 09:46:58+00:00,1230791012290678785,"Thank you for sharing @_JulieGoodwin , these are the pickles and traps we get ourselves in by soldiering on. It’s a great reminder to check in #Mentalhealth https://t.co/XXkWJGpZJm",SportsChiroLD
Melbourne,2020-02-21 06:01:17+00:00,1230734215668305921,"Huge news that we are going to be partnering with the Rugby League World Cup to offer groundbreaking mental health &amp; resilience training to 8,000 young players! @MovemberUK @MovemberAUS https://t.co/4vP9cdAshW",zacseidler
Melbourne,2020-02-21 02:42:35+00:00,1230684211448672256,Sharing a video online of a child having a breakdown probably isn't the best thing for their mental health no matter how good the parent's intentions are. https://t.co/Tjk4ADnakb,Shuttlecock
Melbourne,2020-02-21 01:45:39+00:00,1230669882838024192,"@slayer_white @prudinx @RichardAOB @raywilton4 @AntonyGreenABC @thebettinaarndt He didn't burn himself alive. Sure he probably did have mental health issues, like hundreds of thousands, if not millions of Australians. It was his fucking responsibility to get treatment for his mental health issues, not to burn his ex and their 3 children alive.",ealesy05
Melbourne,2020-02-20 23:55:22+00:00,1230642127274561541,Length of time causes concern for mental health both if detainees and staff themselves. Frequent transfers exacerbates sense of hopelessness and mental health deterioration. #detentionalternatives #justiceforrefugees,rar_australia
Melbourne,2020-02-20 23:05:15+00:00,1230629517246390272,"As visitors, do we report our concerns about mental health? It may result in that person being locked up in isolation. #detentionalternatives",rar_australia
Melbourne,2020-02-20 21:12:00+00:00,1230601014702530560,"@kempspace @ClinPsySussex Yep, the “us and them” divide was frequently mentioned by mental health professionals with lived experience in the studies included in my scoping review. 
I hope you know how valuable both of your work in this space is!",AliciaJeanKing
Melbourne,2020-02-20 12:35:35+00:00,1230471057363980288,‘Spike in number of referrals to children's mental health services leaves hundreds on waiting lists’ via @irish_news https://t.co/TyLrsPc6cp,Dr_FaithG
Melbourne,2020-02-20 11:02:38+00:00,1230447666158391296,I did 9 months in my basic training and it was invaluable.  Addiction is part of mental health care not a separate domain https://t.co/moSiErqWPS,PatMcGorry
Melbourne,2020-02-20 08:37:18+00:00,1230411089881387008,Final reviews for my M.arch summer studio: campus follies: designing for student mental health @msdsocial https://t.co/0nz5E52zf0,TanzilShafique
Melbourne,2020-02-20 06:59:37+00:00,1230386505392115712,"Enough of the fallen hero and ‘good bloke’ nonsense, please! Let’s talk about family and domestic violence (mostly against women), and mental health.",EuanRitchie1
Melbourne,2020-02-20 04:07:46+00:00,1230343258137493505,@RavinEmerald @tbutson @Fem_Kat @laura_la_rosa_ Nope all of that is putting a stigma &amp; the blame on mental health disease. It's really dangerous wording &amp; takes away the fact that he was a violent abuser she was trying to escape &amp; his actions were intentional &amp; deliberate.,Karina_Melbs
Melbourne,2020-02-20 03:13:09+00:00,1230329516276342784,@brownyj97 @clementine_ford Josh you stigmatise half the country who live with mental health disease by inferring he is mentally deranged. Men who commit these acts do so with deliberate sane intent. He went &amp; bought the petrol &amp; entered the car &amp; poured it on 4 people. Deliberately &amp; sanely. #Baxter #DV,Karina_Melbs
Melbourne,2020-02-20 02:42:50+00:00,1230321883943292928,https://t.co/L3sIjZqZ5O check out my new podcast on mental health #changingthegame https://t.co/EVRyQt7OoT,CoachWoodford
Melbourne,2020-02-20 02:07:11+00:00,1230312912654233600,@RavinEmerald @tbutson @Fem_Kat @laura_la_rosa_ As someone with mental health disease it's really not great when people try to add the label to a murderer - who is usually completely sane when committing such an act. It adds yet more stigma to mental health disease &amp; suggests we are all capable of such acts.,Karina_Melbs
Melbourne,2020-02-20 00:30:47+00:00,1230288652430798848,Research supports benefits of animals for older persons’  #mentalhealth  ⬆️quality of life ⬇️depression ⬇️anxiety &amp; useful for persons living with dementia #ATL2020 .@pachana 👍🏻,JacquiVdeV
Melbourne,2020-02-19 23:51:11+00:00,1230278688882618369,@therealseacat @wano_kanat @femmocollective No. Mental health is not the reason he murdered his family. Mentally unwell people are not dangerous! Stop assuming we are.,georgetweets2u
Melbourne,2020-02-19 21:20:23+00:00,1230240740225118208,"Some positive signs here, with Federal Labor edging towards adopting a wellbeing budget.

This would put measures of real-world community wellbeing (like mental health, levels of homelessness, etc) on par with economic measures (GPD, surplus/defeict, etc)
https://t.co/shXnQhbhV3",VCOSS
Melbourne,2020-02-19 20:46:12+00:00,1230232137686601729,Another great piece of work on an important but often neglected topic in mental health care by @TUCollab https://t.co/iyUlQ50RlN,AliciaJeanKing
Melbourne,2020-02-19 20:20:03+00:00,1230225553573076992,Mental health blah blah. You can’t lower the bar of sympathy when it comes to torching your family.,Jizzlobberz
Melbourne,2020-02-19 19:30:41+00:00,1230213129876856832,"Point missed. Lifeline is an important charity, but perhaps our PM could have said something about domestic violence and men’s violence towards women and children. Instead this message reads like this whole situation can be explained solely as mental health problems. #vaw #fvdv https://t.co/6zt5SRzCHJ",DancingDanB
Melbourne,2020-02-19 12:46:59+00:00,1230111536712048640,"@samanthamaiden @katelhunter Get angry when males try to make them being the victims too, I work in addiction/mental health, yes on occasion males are victims of domestic violence, but it’s as rare as an honest LNP politician #domesticabuse #domesticviolence",demon_dave
Melbourne,2020-02-19 11:56:24+00:00,1230098807955701760,How I became a Physed teacher and the connections between physical education Mental health and wellbeing https://t.co/azIt9QXwFs #AppleEDUchat @asiaEDchat @EdChatEU @SHAPE_America @aussieEDchat @Global_Vic @steven_kolber @SchleiderJustin @ZeinaChalich 🇦🇺👍 https://t.co/GhwJro7IPd,SportandiAndres
Melbourne,2020-02-19 11:39:39+00:00,1230094593074446336,Hey Ed Thank you for the opportunity it was great 👍 to speak about the connection of physical education and Mental health and how #theolascoagamethod helps physical educators to engage more students in positive #Physed #pe #teachers https://t.co/5aaJAPCcE2,SportandiAndres
Melbourne,2020-02-19 06:07:21+00:00,1230010967443963904,"🚨#Melbourne group are heading to #Geelong for a seminar on ""Impact of #nutrition on #cognition &amp; #Mentalhealth 

Thursday 27th Feb, Deakin Geelong 6pm to 8.30pm

✍️Register here: https://t.co/ICBFn503ux… https://t.co/yALorwYDn4",nutsocaus
Melbourne,2020-02-19 05:21:58+00:00,1229999544173088769,"I’m not sure what a band 7 position equates to here in Australia but, judging from the comments, it’s a senior role. 
We need more of these in mental health services to provide discipline specific support &amp; strategic direction for the lived experience workforce. https://t.co/Ff7wJXBjP3",AliciaJeanKing
Melbourne,2020-02-18 22:56:10+00:00,1229902457125212160,"@bbcthesocial Talks of simplicity, yet lives by some fantasy made up nonsense whereby it doesn't know if its male of female 😂. We need to invest more in helping those with mental health issues.",TheGentleman789
Melbourne,2020-02-18 22:02:31+00:00,1229888954062659584,@geny2435363634 The whole thing is a mess. Also have a look at what happens on the mental health side. Private v public.,psimpsonmorgan
Melbourne,2020-02-18 20:09:40+00:00,1229860555759865856,We are looking to the second wave of psychological support for Australians following the #australianbushfires. Thank you to @ourANU for collaborating with us to deliver this free webinar for mental health workers this coming Friday 21st @AustPsych https://t.co/ku8YRe78kf,FLMirabelli
Melbourne,2020-02-18 10:08:49+00:00,1229709346918948869,"gon’ live stream on Instagram tomorrow night. talk about snow, mental health, more music, life. 7.30PM come chat :) https://t.co/WHzNbtmpDe",yaboydylanj
Melbourne,2020-02-18 04:41:39+00:00,1229627013234774017,"@jakepaul Isn’t that the doctrine of the lunatics at @Scientology , mental health issues, anxiety, depression etc are all your own fault, just take a walk and cure yourself🙄 #anxiety #MentalHealthAwareness",demon_dave
