City,Datetime,Tweet Id,Text,Username
Melbourne,2019-07-02 08:40:39+00:00,1145975559119179776,"I had to face anxiety in the past 3 yrs, during my PhD, due to supervision issues so much so that I started taking medication. I'm fine now - the take-home msg: it's sometimes okay not to be okay. We need to raise our voices to address the stigma associated with mental health. https://t.co/ch8KV0dI0y",AinaUrooj
Melbourne,2019-07-02 07:53:27+00:00,1145963683371073536,"So @3aw693 keep a drunk who has bagged out footballers who have mental health issues, stuck by a coach who drugged his players yet has an issue with a former player laughing at the urban dictionary",sportingphotos
Melbourne,2019-07-02 07:32:19+00:00,1145958363714318337,"Occupational violence, mental health and the #OHS challenge. #mentalhealth https://t.co/PwmjgGXvV7",SafetyOz
Melbourne,2019-07-02 03:16:50+00:00,1145894070914412544,"Probably having my worst mental health week I can remember, so I’m trying to make some positive changes. Back to the gym, refocus on finding new work, and really focus on improving how I’m feeling. #mentalhealth #fuckanxiety #Fuckdepression",marc014
Melbourne,2019-07-02 02:03:26+00:00,1145875597408624640,"Spotlight on the amount of Medicare subsidised mental health sessions .. there is a initial cap of 10 per year on a mental health plan. One witness, 22yo Nicole Juniper tells #RCMentalHealth  “you have to really choose when you have your sessions” @10NewsFirstMelb #springst https://t.co/dOQGDWnSop",SimoLove
Melbourne,2019-07-02 01:21:28+00:00,1145865038189748224,"Youth Parliament debates the question of allowing public access to regional school bus routes. Some spirited back-and-forth, but to the point and well argued. Hobsons Bay UP will present their bill ‘Mental Health… https://t.co/flA2SbguRG",jonathonmarsden
Melbourne,2019-07-02 00:15:25+00:00,1145848414522920960,The nation’s first Royal Commission into a Mental Health System is underway in Victoria. Chair Penny Armytage says “Young people are more likely to die by suicide rather than in a road accident.” @10NewsFirstMelb @10NewsFirst #springst https://t.co/y6a1nqC1L6,SimoLove
Melbourne,2019-07-02 00:13:26+00:00,1145847916688371712,The Royal Commission into Victoria’s Mental Health System has kicked off with Chairperson Penny Armytage saying “a clear message emerges - doing more of the same will not be enough” @theheraldsun,moniquehore
Melbourne,2019-07-01 23:57:51+00:00,1145843991818035200,"This is a momentous day for Victoria, with the first public hearings of the Mental Health Royal Commission.

Martin Foley is right; this Commission will help fix our broken and fragmented system. #RCMentalHealth https://t.co/VYQXyll7lX",VCOSS
Melbourne,2019-07-01 23:02:39+00:00,1145830101595983873,"PSA: Don't exercise/diet to look like someone else. Do it to strengthen your physical &amp; mental health. We're so conditioned to feel the need to look a certain way &amp; fit into a made up box, but in reality we're all very unique individuals &amp; we should embrace that. Love yourself. https://t.co/3Ak6F0cvEO",earthtojenni
Melbourne,2019-07-01 11:22:27+00:00,1145653891242975233,"@vintagevixenCT I agree with you. I worked in Mental Health when I lived in SA, and it is scary how many people were unaware of their benefits (and even more so the additional benefits you get in addiction treatment).",_RoxStar
Melbourne,2019-07-01 06:22:56+00:00,1145578516177571840,"Matthew Hercus, Director, Mental Health @VicGovDHHS launching the @CMHLvic Lived Experience Workforce Strategies https://t.co/232YuiFk46",tomwoodau
Melbourne,2019-07-01 02:45:35+00:00,1145523818011566080,Can't tell you how great it's been for my mental health eating full meals again. I've gained weight but I've also gained the ability to form coherent rational thoughts and decisions not fuelled by anxiety and exhaustion. Five stars would eat again. Thanks therapy.,RealFakeEmily
Melbourne,2019-06-30 20:39:43+00:00,1145431742972456960,"@mmmhotbreakfast I would like to thank the entire MMM team for what you are doing today for mental health, I am a 52 year old male, and after my Dad died in 2001 I have suffered from major depression, this idisease can and does ruin so many people and families, but there is help.",bluey_clarke
Melbourne,2019-06-30 15:42:37+00:00,1145356976932569090,@newscomauHQ Take a break Wally! A 'mental health' day,VladdySavage
Melbourne,2019-06-30 15:01:22+00:00,1145346596432777222,"@Clairekoolkat Nicole Byer's 'Why Won't You Date Me?'. Super honest and real about dating, relationships, friendships, mental health, racial relations, and fucking funny as shit. Bonus: not a bunch of white men talking over each other.",NeptuneHen
Melbourne,2019-06-30 12:44:22+00:00,1145312120155725824,All about mental health,Romeoluzanojr
Melbourne,2019-06-30 07:13:25+00:00,1145228833651429377,It’s an interesting concept to #doitlightly.. I wonder how to achieve this.. #ruok #mentalhealth https://t.co/A3gxuCZaJq,nlarkin_photo
Melbourne,2019-06-30 01:40:48+00:00,1145145127070867457,"@LRussellWolpe We have @ACSEP_ &amp; continue to do so with team &amp; inclusive culture, flexible training program in private setting with its own funding challenges, reg practice accred, trainee on our Board &amp; comprehensive mental health plan for all members @DrLouiseTulloh https://t.co/mY0ifkYJQh",ACastricum
Melbourne,2019-06-29 23:55:07+00:00,1145118528229392384,Is Australia at a tipping point for Mental Health Reform? @Oz4mentalhealth @ozprodcom @GregHuntMP @ScottMorrisonMP @Bowenchris @DanielAndrewsMP @MartinFoleyMP @BradHazzard @NMHC @BrogdenLucy https://t.co/zU5IN6C19P,PatMcGorry
Melbourne,2019-06-29 07:12:44+00:00,1144866272569700353,"So the news/government won't talk about suicide or mental health, but happily promote terror, war, murder #interesting? Think about it! @ Melbourne, Victoria, Australia https://t.co/MxxOfDH8OZ",ShanleyJason
Melbourne,2019-06-29 07:00:19+00:00,1144863148194709504,@roseannebyrne @judyvw2 So where are the dual diagnosis rehabs There are But a few And the ones that exist are small So whilst in rehab if your mental health deteriorates while being treated for ur addiction You are kicked out,zhalli1
Melbourne,2019-06-29 05:22:12+00:00,1144838453588140033,"@DrJohnOrchard Interestingly, this week I was chuffed to accept a warm invite to speak at Northern Public Hospital medical grand round on @ruokday on the benefits of exercise on mental health &amp; physical health. Will also share how @ACSEP_ leading mental health support &amp; culture change #MH4Docs",ACastricum
Melbourne,2019-06-29 00:27:43+00:00,1144764346704117760,23% of children &amp; adolescents who present for mental health issues identify as queer. They are impressionable. They won't talk to their parents because of the homophobia in raised by this issue with @IzzyFolau @Shelley_Argent @DavidDmacca @tass1959 #satmag,SatMagJOY949
Melbourne,2019-06-28 02:08:24+00:00,1144427297451065344,Belinda Bravo @VicGovDHHS  shares the government's plan to implement emergency department crisis hubs in Victoria – to treat mental health people during times of crisis. #safetyfirst2019 @AlfredHealth https://t.co/RHBQ27vUEo,EmergEdu
Melbourne,2019-06-28 00:11:49+00:00,1144397958709858304,MDMA assisted psychotherapy for PTSD. Supporting alternative therapies. Webinar @unimelb as part of the medicinal cannabis and psychoactive plants for mental health and addiction symposium #AcademicTwitter #psychedelicresearch. More to come! https://t.co/73KFc2XEFY,HayleyAmie
Melbourne,2019-06-27 23:32:32+00:00,1144388070864646144,"PACER - Police Ambulance &amp; Clinical Early Response. Excellent collaborative initiative to address mental health crises in the community.
#SafetyFirst2019",TraumaHelen
Melbourne,2019-06-27 23:22:11+00:00,1144385465912459265,"Nearly 300,000 presentations to Australian Emergency Departments attributed to mental health.
#SafetyFirst2019",TraumaHelen
Melbourne,2019-06-27 23:15:18+00:00,1144383732763152384,"Inspiring talk from Fiona Nguyen a Lived Experience Consultant informing us about the patients experience in the face of mental health challenges.
#SafetyFirst2019",TraumaHelen
Melbourne,2019-06-27 10:38:47+00:00,1144193351710732288,"@reallykazcooke And if I may (#immodestWomen) - @DrAnitaGoh - immigrant, English as an additional language, clinician and scientist, working parent/mother, working to make life more equitable for #WomenInSTEMM, #poc, people with #MentalHealth issues, and people impacted by #Dementia.",DrAnitaGoh
Melbourne,2019-06-27 09:50:39+00:00,1144181239319891968,"A #communityinitiative to raise awareness about #homelessness on Saturday, 20 July at 6.30 PM at #LailaReceptions, #Brunswick

Tickets on #Eventbrite - $75 pp
For bookings contact Tanvi Mor on 0420 599 460.
#homelessness #MentalHealth #AOD #roughsleepers #homelesslivesmatters https://t.co/eT0my17yzH",tanvimor28
Melbourne,2019-06-27 09:40:26+00:00,1144178664965197825,"Y’all preach about bullying and mental health issues all the time but will make a thread on Twitter that’s bullying someone from “facts” that aren’t even true... I really hate twitter, it’s so fucking toxic! https://t.co/ehfWzjaIND",spunkIuke
Melbourne,2019-06-27 09:31:42+00:00,1144176470190780418,"And how can the clubs, or the AFL be accountable for the increased tendancy for Mental Health problems; methinks more likely due to personal issues that they cannot individually handle!
After all, the players involved have had sufficient incomes to assist their treatment! https://t.co/K8lIRtBExh",Catterall4David
Melbourne,2019-06-27 09:04:09+00:00,1144169533977923585,"@becklepanda As a caveat I’d say all three I mentioned deal with mental health primarily from a male perspective, centred squarely from the toxic patriarchy that sets men up for alcholism, avoidance, and anger. Clockwork City struck very close to home for me and was quite affecting that way.",BrettMichaelOrr
Melbourne,2019-06-27 08:46:00+00:00,1144164967270105088,Or you know maybe you could leave the poor guy the fuck alone!!! Wonder if the constant intrusion of the AFL media had an impact on his mental health and played a role in him walking away from the game @Stevo7AFL. https://t.co/1vMTdjgZZj,ealesy05
Melbourne,2019-06-27 08:35:40+00:00,1144162368550649856,@b_reed95 @KatherineFaire1 I think your feedback is extremely important- can you send this experience to the Director of the Mental health service you’re referring to? I am in a mental health team and certainly don’t operate this way and I absolutely agree with your comments,Ceebear71
Melbourne,2019-06-27 08:32:15+00:00,1144161509028745216,@SwitchBae @milkypixel @womanz_gg @Naysy @BriiJayx @mivaroh @Dr_GamerGirl @maediocre Calling someone with mental health issues psychotic... you a bitch dude,JackDaddy_
Melbourne,2019-06-27 01:35:49+00:00,1144056708609667072,"Dan Houston is not at Port training, suggests he’ll miss the Bulldogs game with a side strain. But great to see Matty Broadbent back out there after taking a break with mental health. #AFL #BozistheBuzz 🐝",IncrediblyBozza
Melbourne,2019-06-26 22:56:38+00:00,1144016646807248896,"Your mental illness does not define who your are. Keep going... brighter future is ahead of you. Remember always! 

HAPPY THURSDAY EVERYONE
#mentalhealth https://t.co/7Liv0CpvLr",Romeoluzanojr
Melbourne,2019-06-26 22:32:43+00:00,1144010628299759616,"Embrace your failures and suffering. After all, you can use it to your success.

Happy Thursday Everyone.
Take care of your #mentalhealth https://t.co/nGyWxSELSP",Romeoluzanojr
Melbourne,2019-06-26 13:29:59+00:00,1143874046762745857,"We’ve got youth mental health, adult and older people mental health, dementia and neuropsych, and marine biology covered! Ask us how!",DrAnitaGoh
Melbourne,2019-06-26 13:23:25+00:00,1143872393842061312,"@LeotheGreat19 @Pontifex Instead of the children being protected from those #childrapistpriests they were punished for speaking up. Many of them have serious substance abuse issues, and mental health challenges. And some didn't make it - they killed themselves. #Auspol2019",Spockarama
Melbourne,2019-06-26 02:20:36+00:00,1143705590373335040,"I did something I've been putting off for literally years now, and that's make an appointment with my GP for a mental health check-up. It isn't until next Monday, but at least I've taken that first step.",paranoidpixie95
Melbourne,2019-06-26 02:05:18+00:00,1143701739008217089,Mental health issues should always be taken seriously. Nobody is too successful to end their own life or to be depressed or anything. Always take peoples mental state seriously and remember that there's more than what's seen on the surface level,SaberSSB
Melbourne,2019-06-26 01:29:24+00:00,1143692704481546241,"I will miss seeing all the smash reactions he did as well as all the edits of him losing his shit to minecraft.
Mental health is such an important thing to take and keep hold of, it's importsnt to know that no matter how tough it gets that there is someone there to listen,",AussieYak
Melbourne,2019-06-26 00:39:01+00:00,1143680027831095296,"#climatechange and #MentalHealth, a reality in the Pacific... https://t.co/ZRq3M8owH2",obed_doc
Melbourne,2019-06-25 23:36:29+00:00,1143664289124798464,"@lenoretaylor So after his physical injuries are treated they are set on ignoring his mental health issues and charging him, exasperating his Mental illness This is torture and a dereliction of duty of care",zhalli1
Melbourne,2019-06-25 22:19:35+00:00,1143644938317398017,"@JamesMerlinoMP Thank you James. I expect we will look back to this decision as a key step that helped us, as a state, to really start addressing mental health, engagement of young people and academic achievement.",RobertSahib
Melbourne,2019-06-25 21:05:36+00:00,1143626318149345280,"Staying silent to promote mental health. Isn’t that the problem that got us here in the first place? 

Why not spent a whole day talking with some of the best mental health experts we have. Bit out of touch I think @TripleMMelb https://t.co/dnUKrX7s4T",madeleinephoebe
Melbourne,2019-06-25 04:26:50+00:00,1143374971919486978,"Medicine costs can be a massive part of the family budget, if government is serious about mental health it should be looking at this, better than the 80 billion on out of date submarines https://t.co/LRhBykWjnj",gjblue
Melbourne,2019-06-24 23:07:02+00:00,1143294491857575936,Packed session for The Early Words: Mental Health Through The Arts. Huge thank you to our Early Words sponsors  @Irrewarra1 @SchulzOrganic Coffee Supreme for keeping us energised and caffeinated! https://t.co/wl8uydje5i,EmergingWriters
Melbourne,2019-06-24 22:55:06+00:00,1143291487855136768,"'I've seen terrible, terrible violence': cocaine and meth fuel crime and chaos in Fiji

“The mindset is still very much that it’s criminal, it’s dealt with criminally, there’s no consideration that it’s a mental health issue yet.”

I wonder about Vanuatu.
 https://t.co/GIRlRmO9Jc",obed_doc
Melbourne,2019-06-24 12:12:23+00:00,1143129743891394560,Binary thinking. It’s both/and as in the rest of health care.  So over this either/or mindset which is so common in mental health but not in the rest of health. https://t.co/ROHcruUzjf,PatMcGorry
Melbourne,2019-06-24 11:51:44+00:00,1143124546536402944,@QandA Something we wrote on the impact of the marriage equality debate on mental health &amp; youth #suicide: https://t.co/LCIfqbmOUO @PatMcGorry @orygen_aus @eleanorbailey_1 #qanda,JoRobinson_Aus
Melbourne,2019-06-24 05:23:21+00:00,1143026805596512256,"Instagram is bad for your mental health.

Anyway, now back to my unfiltered abuse of random faceless strangers on Twitter.",brandycooklyn
Melbourne,2019-06-24 01:20:58+00:00,1142965807678255104,We often think people suffering with psychosis are more likely to be violent - wrong! - they are 14 x more likely to be a victim of violence. -#MentalHealth #psychosis #stigma,StephGadsden
Melbourne,2019-06-24 00:11:43+00:00,1142948379330113536,@BruceAd52147553 @Mickholloways @KatherineFaire1 I’m afraid I don’t see a link between public perception or even outright knowledge of mental health and depot injections of antipsychotic medication. Perhaps you could explain what you mean? I’m sure you have a point you’re trying to get across but it’s not clear #clarifyfirst,ShainaIsaacs
Melbourne,2019-06-23 22:41:35+00:00,1142925696592834560,When I did a clinical psychology rotation in cardiology  at a major MELbourne hospital (my choice) the senior cardiologists we’re not of the belief there was any link between mental health and cardiac events.  But they were interested in Panic episodes presenting as infarcts https://t.co/9CUVnG1eKM,lesposen
Melbourne,2019-06-23 13:38:44+00:00,1142789084118519811,"Start a go fund me for mental health. Hopefully they can use a few million to help youth struggling and contemplating suicide because ppl they once looked up to has been shown to be a greedy, self centred, homophobic twat who forgets God teaches you to love all, not hate. https://t.co/tf3XLO41Nx",ayelbee1
Melbourne,2019-06-23 10:30:49+00:00,1142741795404599296,"Yep! Way to go @selenagomez
#MentalHealth #WomenEmpowerment 
https://t.co/ckqDIIH5yW",SomyaMunjal8
Melbourne,2019-06-23 07:20:42+00:00,1142693950597160961,"In one of those “a ha, just as I thought” studies, new research by @Cambridge_Uni  indicates that the risk of #Mentalhealth problems reduces by 30% when ppl move from #unemployment into paid work of 8 hrs per wk. We all need #purpose and #social interaction @HeadUpLabs 🔬❤️",GlennRiseley
Melbourne,2019-06-22 23:10:10+00:00,1142570501732257792,"#1000steps done &amp; dusted before 8.00am. What a start to a #winter #morning 
#peaceful #challenge #inspiring
#mindovermatter #mentalhealth
#Icandoit @ 1,000 Steps https://t.co/0mDkRlfPUA",SeanClarke51
Melbourne,2019-06-22 19:56:19+00:00,1142521717023105024,"@gtconway3d You were warned by many mental health professionals &amp; Hillary long  before he was voted in Mr. Conway. You weren't listening or weren't looking at the right tweets. 
&amp; the DSM has been around for decades !
Narcissistic Personality Disorder is not new.🙄😡",ILOVERAFA1
Melbourne,2019-06-22 10:48:22+00:00,1142383823297994752,@EmergMedDr Those will be good for my mental health too.,NatsforDocs
Melbourne,2019-06-21 22:42:26+00:00,1142201136809562112,"@StaceyGLarner Yeah, I sort of figured - I’ve got a few co-morbid conditions but it seems like it’s a very difficult process to get approved for mental health stuff.",isha_leigh
Melbourne,2019-06-21 11:34:53+00:00,1142033140262637575,@Nucha73637221 My mental health has been great this week! Click my bio to see how well I've done!,nursebinky
Melbourne,2019-06-21 09:46:15+00:00,1142005801239711745,A complete 180 from failing everything to smashing it! 100% on email and webchat and in the 90%'s for my calls and as I said I halved my after call work despite the rough week. I really needed those mental health days last week 😊,nursebinky
Melbourne,2019-06-21 00:18:33+00:00,1141862938011029504,Privileged to have spent the morning going on an emotional journey listening to my childhood hero @WayneSchwass of @puka_up be open &amp; vulnerable talking about emotional well-being &amp; #mentalhealth What an inspiring start to the day! https://t.co/lp3wqdTs4n,iNondas
Melbourne,2019-06-21 00:02:28+00:00,1141858890675392513,"MTB Riding has been an amazing outlet for my mental health the last few months, it has tough me that you have to be in the moment or you'll crash. Now we just have to learn to implement these skills into life to stop the crashes  #SickNotWeak #MentalHealth https://t.co/dVj5P9asEb",sketrcher
Melbourne,2019-06-20 23:26:16+00:00,1141849777539125249,'Genuine conversation' with Wayne  Schwass on mental health and wellbeing to a full house at Michael Page event today. ❤ Look after you ❤ @puka_up @michaelpage https://t.co/ezwBDnhveu,01Rowdy
Melbourne,2019-06-20 22:36:23+00:00,1141837224671006720,"Best practice for children's mental health is to begin with psychology &amp; other therapies including parenting support @HarrietHiscock @MCRI_for_kids 

https://t.co/6WsxFBmRkq",CCCH_AU
Melbourne,2019-06-20 22:24:51+00:00,1141834324527812608,. @WayneSchwass  says ‘Sleep is the number one thing I do for my mental health. If I compromise my sleep then I open up my likelihood of anxiety and depression’.,KRitchie
Melbourne,2019-06-19 22:14:38+00:00,1141469364698275840,"Who is accountable for this headline? The kid has broken a rule and will pay for it. Can people in the media be aware of his mental health and his mum, dad &amp; family. Report it, but be more thoughtful the way you present it!! @theheraldsun https://t.co/7Zu8BEJBmY",espresso101
Melbourne,2019-06-19 21:09:01+00:00,1141452850188320768,"GOOD MORNING HAPPY THURSDAY

TAKE CARE OF YOUR MENTAL HEALTH ALWAYS

#mentalhealth",Romeoluzanojr
Melbourne,2019-06-19 21:02:23+00:00,1141451179588800518,"Such a busy and stressful week but luckily my mental health has been great! Taking those 2 days leave last week did wonders. I also had a great sleep last night, woke up once for about 30 minutes but quickly fell back to sleep 😊 https://t.co/0W9CSnNZV2",nursebinky
Melbourne,2019-06-19 19:55:38+00:00,1141434381719879681,@DannyBernie_ @Anonymous11637 It's been a rough week but my mental health has been great! Where as other days not so great.,nursebinky
Melbourne,2019-06-19 11:37:56+00:00,1141309132869210112,"Exciting to see Lady Gaga championing teen mental health first aid - a program first developed by @MHFA_Australia, an organisation I’m honoured to be Deputy Chair of! https://t.co/zdQ872xkF9",KSeibertAu
Melbourne,2019-06-19 08:34:02+00:00,1141262851484426240,@tommorris32 @FOXFOOTY Yes Tom he should have king hit Gil and he would have got less weeks!!!!!! And what about Stevo mental health it’s a joke and so are you!!!!!,crusherboehm
Melbourne,2019-06-19 07:54:40+00:00,1141252948120354816,"Essential oils can improve your mood and overall wellbeing.

It can have a profound positive impact on your emotions and mental health.

Creating my own blends has allowed me to reach many people to help manage… https://t.co/cJ063tHeL5",lsammarti
Melbourne,2019-06-19 06:02:59+00:00,1141224839723642881,"Facials for men provides a whole lot more than a simple confidence boost. They help improve stress relief, and facilitate vastly improved skin and health. 

contact @ 0414057272 for special deal
#massage #healthcare #beauty #Mentalhealth #spa #calmhomespa https://t.co/bZiZmggW6S",calmhomespa
Melbourne,2019-06-19 05:32:14+00:00,1141217101933236224,"Why would it be a parody? I've heard many similar stories from diplomats. Mental health issues, loneliness, high performance high pressure environment. Tragically also, suicide. It's such a tough gig. If it were a parody it would be a very strange one https://t.co/w1iJHeHABE",_g_kate
Melbourne,2019-06-19 00:52:05+00:00,1141146599097131008,"Georgie Dent joins @Raf_Epstein and @Jacinta_Parsons up next on @abcmelbourne #theconversationhour talking #breakingbadly, mental health and taking care of yourself. https://t.co/9TVumVI8mV",AffirmPress
Melbourne,2019-06-18 19:00:45+00:00,1141058185203048448,@itvnews So deal with mental health act,DaveChamp7
Melbourne,2019-06-18 12:16:44+00:00,1140956509842505729,"Youth Mental Health reform is a frontier of real progress in MH, as yet very incomplete, but an invaluable bipartisan endeavour and national imperative. Great to welcome @Bowenchris &amp; @Emma4Dobell to the mission! @Oz4mentalhealth @iaymh @orygen_aus @headspace_aus https://t.co/TC99ClCuR9",PatMcGorry
Melbourne,2019-06-18 06:57:27+00:00,1140876159791456256,"Vision Connect

Today, tomorrow and every day this week, for the rest of the year, eight Australian's will lose their battle with mental health.

In support of beyondblue we are incredibly excited to bring to you… https://t.co/XnukVUMmHO",visioncaulfield
Melbourne,2019-06-18 06:33:30+00:00,1140870130722729984,Thanks for sharing @brandonjack33 -we’re undertaking a Royal Commission into mental health and it’s timely. Hard to believe the leading leading cause of death for males aged 14 to 44 is suicide. Keep up the advocacy. https://t.co/TlJLqypXqE,BenCarrollMP
Melbourne,2019-06-18 01:49:22+00:00,1140798627327033344,@LiangRhea @drHelenschultz @theage I hate the fact that the system can be *allegedly* gamed using both physical mental health and impairment to avoid justice. Think Christopher Skase and that principle in Israel claiming depression to avoid extradition. I don't have a solution though. 🤷‍♂️,DrAndrewHuang
Melbourne,2019-06-17 22:31:37+00:00,1140748863461965825,Sounds good but is there a plan for redesign of youth mental health care? No more superficial tweaks and “conversations” please! We need radical reform and new cultures of care.  Keen to get details! @iaymh https://t.co/uyEjwQBQBe,PatMcGorry
Melbourne,2019-06-17 21:09:36+00:00,1140728221131952128,"@cmcaton @jensen_mr @kphoekman I’m for grouping, that’s just a classroom strategy, but having a ‘smart class’ calcifies their learning and social awareness. They tend to have terrible mental health outcomes also, partly due to being surrounded by high achievers, highly strung, parental pressure etc",steven_kolber
Melbourne,2019-06-17 19:41:58+00:00,1140706168421134337,"Vision Connect

Today, tomorrow and every day this week, for the rest of the year, eight Australian's will lose their battle with mental health.

In support of beyondblue we are incredibly excited to bring to you… https://t.co/RhWCAFK7ER",visioncaulfield
