City,Datetime,Tweet Id,Text,Username
Melbourne,2019-11-27 12:49:59+00:00,1199671709512585221,"A great read with a lot of take aways to deal with mental health 💜 
""These crowd-sourced therapy takeaways offer a welcome change in perspective""  https://t.co/vTj3Gnsv8n",Jeskikka
Melbourne,2019-11-27 07:30:31+00:00,1199591313055854593,"🌬 The Protector 🌬 @ headspace, National Youth Mental Health Foundation https://t.co/ort5Y73S9i",timotitreasure
Melbourne,2019-11-27 05:40:42+00:00,1199563677973659651,#smhr2019 if you are interested in mental health then you should be interested in sexual violence and improving responses to this. I’m speaking about uk based study @AstudyMimos tomorrow 12.12pm session Bourke room 1 level 2 concurrent session 3D.,LizHughesDD
Melbourne,2019-11-27 05:05:24+00:00,1199554793389166593,"Top Mental Health Problems for College Students Today https://t.co/fYhX0w2mdM
#MentalHealthAwareness",KirstyZi
Melbourne,2019-11-27 04:30:51+00:00,1199546099637186562,Different groups of people access mental health treatment from different sources - Helen Benassi from @CMHR_ANU #smhr2019 https://t.co/uDEDZxMwis,Louise_Thornton
Melbourne,2019-11-27 01:41:18+00:00,1199503431989219328,Remember to take care of yourself especially ya mental health 🤙🏾,yodrclams
Melbourne,2019-11-27 00:25:25+00:00,1199484334333317120,@Louise_Thornton talking about our paper that highlights the aspects of smartphone apps that people with mental health problems find most concerning. Read more here @SMHR @ozprodcom #smhr2019 https://t.co/KKVce4xrdd,ProfFranKayLamb
Melbourne,2019-11-27 00:22:16+00:00,1199483542905868288,Carer advocate Justine Wilkinson introducing session on Physical Health &amp; Mental Health #SMHR2019 https://t.co/CjgqT4uwQF,tomwoodau
Melbourne,2019-11-26 22:39:31+00:00,1199457683008438272,"Dr's @Kelly_Allott and @NTVanDam opening the Society for Mental Health Research Conference 2019, highlighting the value of having all different types of expertise; academic, and lived experience @SMHR #SMHR2019 https://t.co/xWoERkDVB5",tomwoodau
Melbourne,2019-11-26 22:23:39+00:00,1199453693126381569,"At 4:21 catch @dylan_gilbey in the Bourke Rm 1, Lvl 2 presenting “Trajectories of Mental Health Difficulties in Young People Who are Attracted to the Same Gender: A Systematic Review” ➡️ full article: https://t.co/hAU25HSnT5 #smhr2019 @telethonkids @UWApsych @SMHR",PenelopeStrauss
Melbourne,2019-11-26 22:02:43+00:00,1199448424724123648,#smhr2019 Welcome to Country #SMHR #Mentalhealth https://t.co/kK371hEa5G,SMHR
Melbourne,2019-11-26 20:19:08+00:00,1199422357602889728,"If it wins GOTY awards, I am so tempted to give up altogether.
Stop writing. Stop playing.
I don’t know how to keep going in a space that is so in love with something I hate so much that it’s affecting my mental health.",Leo__stevenson
Melbourne,2019-11-26 10:33:51+00:00,1199275064245420032,"Alcohol has major impacts on mental health - drinking even relatively moderate amounts can lead to anxiety and depression. 

On the flip side - stopping drinking can be one of the best things a person can do for their mental health. https://t.co/hqBStyEwTG",KSeibertAu
Melbourne,2019-11-26 09:13:06+00:00,1199254744092442624,"Hi #melbourne ! Here for the Society of mental health research conference #SMHR2019 Good to see you. #deliberatelensflare #neuroscience #yoga #meditation #phd #research @ Melbourne, Victoria, Australia https://t.co/86FLTDP0tp",jentayloryoga
Melbourne,2019-11-26 07:35:21+00:00,1199230142125629440,"🔮 The Fates 🔮 @ headspace, National Youth Mental Health Foundation https://t.co/mpbteKACAF",timotitreasure
Melbourne,2019-11-26 05:09:04+00:00,1199193328480219136,"Following mental health first aid training @MonashUni for staff, which to my opinion is key to create an optimal and productive environment! So happy to see that mindfulness is considered as a therapy 🙏🏼  #mentalhealth #training #staff #mindfulness #awareness https://t.co/y36V759G6W",CPattaroni
Melbourne,2019-11-26 05:02:14+00:00,1199191609033650176,"So honoured to be asked to share in discussion today around a new National Peer Workforce Framework. Thank you to the @NMHC , and @RMIT. Big ups to @DrLouiseByrne and team for making sure the voices consulted are diverse! #mentalhealth #peerwork #gratitude #livedexperience https://t.co/DJ5w4Xl8k3",tanyablazewicz
Melbourne,2019-11-26 04:42:56+00:00,1199186752839143425,#16days  #orangetheworld we are undertaking a national study evaluating how sexual assault referral centres identify and offer services for those experiencing mental health and/or substance use problems - check out @AstudyMimos @NIHRresearch,LizHughesDD
Melbourne,2019-11-25 22:55:08+00:00,1199099227948761093,"@darleysam @gamingthemind Reading the description made me pretty angry, they really need a mental health consultant before publishing content like that 😪",sarah_crowe
Melbourne,2019-11-25 10:48:11+00:00,1198916283787550720,"happysadfilm is an uplifting insight into the lives for five very different Aussie men. Touching, funny and tender, this is a must-see documentary that shines a light on masculinity and mental health.  Join us this… https://t.co/UicQYe29w9",thesuntheatre
Melbourne,2019-11-25 09:56:38+00:00,1198903312780685313,"@BeccaHayne @FOXFOOTY We at the AFL take kids mental health and ridding ourselves of toxic masculinity seriously. 

Now here's BT and Cornes to tell us if this bunch of limp wristed softcocks would survive back in the day when men were real men.

Gamble responsibly.",FkYeahMatt
Melbourne,2019-11-25 07:27:39+00:00,1198865819519700992,"@MattAF13 I find this hard, I push back a bit, but find many are not engaging in good faith, so block at times. As much to clear my timeline and maintain my mental health. 
I think people should be able to mute, block as they need to.
I admire those who engage and push back more.",Tony_3163
Melbourne,2019-11-25 07:05:11+00:00,1198860165870546945,"🌏 The Nomad 🌏 @ headspace, National Youth Mental Health Foundation https://t.co/lD6YwVnURg",timotitreasure
Melbourne,2019-11-25 06:32:42+00:00,1198851988072456193,"Unraveling men’s depression and suicide.

@unimelb #Mentalhealth #depression #SuicideAwareness https://t.co/OWhWhG1XsZ",D_M_Clark_
Melbourne,2019-11-24 23:51:47+00:00,1198751094672777217,Looking forward to speaking in Parliament this week #mentalhealth #menshealth #parliament theheraldsun 🙏 🎤 @ Parliament House https://t.co/EzRqeJbAO5,NickBracks
Melbourne,2019-11-24 22:05:35+00:00,1198724370748690432,"@CheckPointOrg I love making all different things, keeping my hands busy helps with my mental health a lot! I sew, cross stitch, make clothes, 3D Print stuff, do diamond painting, mini painting... it doesn’t end 😂",sarah_crowe
Melbourne,2019-11-24 19:00:21+00:00,1198677755786719233,"@melbomartin But yes, you are right, message IS very ""off"" both in style and timing. A Saturday? When there is no professional mental health support available? No reason given? Over 2000 suicides from #robodebt, how many from this sort of communication, I wonder?",KoparaFallsKid
Melbourne,2019-11-24 09:05:55+00:00,1198528161450848256,"@commaficionado Twitter can be hell, breaks are good for mental health.",AutisticInMelb
Melbourne,2019-11-24 07:12:44+00:00,1198499677005467649,"I think I need to appease the mental health gods this week and get a new tattoo, they always help me feel better about myself for some reason 😂",sarah_crowe
Melbourne,2019-11-24 07:07:05+00:00,1198498254243024896,"🌙 The Gatekeeper 🌙 @ headspace, National Youth Mental Health Foundation https://t.co/7riCWFC3ae",timotitreasure
Melbourne,2019-11-24 02:56:48+00:00,1198435269331996678,What a brilliant initiative to support #mentalhealth. Well done @AmbulanceVic @agwalker01 @JennyMikakos! 🐶 https://t.co/MP1UVij4So,AlexandergClark
Melbourne,2019-11-24 00:10:07+00:00,1198393321011335168,"It’s been a year since I was re-elected as your MP for #Mordialloc and what an honour it has been to rep our community. 
And we have more to do, with the Mordi Freeway, level crossings, upgrades to schools and an overhaul of our mental health system, we will keep at it! #springst https://t.co/nfAhJ40Y5d",TimRichardsonMP
Melbourne,2019-11-23 21:08:28+00:00,1198347607715667969,"@lorenzo_masci @LasseIshoei @pimvklij Pre-op symptoms associated with mental health scores and not size of cam or labral pathology in Jacobs et al 2017. This could help with outcome prediction, but also could be a target for education stategies in surgical and non-surgical management.",MarkScholes85
Melbourne,2019-11-23 09:36:19+00:00,1198173421793726464,"Fast forward to the end of the decade, I’m healthy and eating well, my mental health is on the mend, I’m progressing up my career path steadily with a solid income, most importantly I have loving friends, family, partner and pets. And I’m safe. 
That’s my decade challenge.",beansp00n
Melbourne,2019-11-23 08:33:35+00:00,1198157634873876480,"@delmaclifton The mental health implications for many is very concerning, hence why I'm highlighting it. We lost over 2,000 lives due to #robodebt, how many morewill we lose with this sort of treatment? Young families with kids to feed?",KoparaFallsKid
Melbourne,2019-11-23 07:27:05+00:00,1198140900431581185,"🔥 The Heretic 🔥 @ headspace, National Youth Mental Health Foundation https://t.co/WyURrOjgbK",timotitreasure
Melbourne,2019-11-22 09:39:09+00:00,1197811746238386176,"@TomBrowne7 @DfsPgafan Yeah, mental health , of course!",simonshirley72
Melbourne,2019-11-22 07:01:51+00:00,1197772160850432001,"🌝 The Dreamer 🌝 @ headspace, National Youth Mental Health Foundation https://t.co/cENn2s0y1u",timotitreasure
Melbourne,2019-11-22 06:53:29+00:00,1197770057083834368,"Wishing Soph all the best as she takes time to put her mental health first. 
She’s my favourite @RenegadesWBBL player &amp; I’ll miss her on the pitch, but her health &amp; happiness is of the utmost importance &amp; I get that as a sports fan. 
#Mentalhealth management in sport is crucial. https://t.co/4JMjUOEIAD",kaseysymons
Melbourne,2019-11-22 03:06:49+00:00,1197713014717157377,"Another Australian international cricketer is taking time off for mental health reasons, with Sophie Molineux stepping away from the game. https://t.co/vflzUgwZOc",DanielCherny
Melbourne,2019-11-22 02:43:16+00:00,1197707086261436417,"I wear it on my wrist as a reminder. My story isn’t over yet.                                   A semicolon is used when an author could've chosen to end their sentence, but chose not to. The author is you, and the sentence is your life. #BPD #Mentalhealth https://t.co/KmCf2ay01C",eyerockuknowit2
Melbourne,2019-11-21 18:20:24+00:00,1197580538174824448,"We know that narcissism is born out of injury 

that's why I prefer when we're struggling with mental health we avoid relating to ourselves as damaged or broken 

we're human, of flesh, with life 

we cannot become defective 

I prefer 'wounded'

If I am wounded then I am hurting",ForPalestine__
Melbourne,2019-11-21 18:20:24+00:00,1197580536346054656,"our mental health struggles are our responsibility but we exacerbate them when we give ourselves allowances as though we get a different set of moral codes to everyone

you're not less than anyone else is also - you're not better than anyone else to get away w trashy behaviour",ForPalestine__
Melbourne,2019-11-21 17:56:45+00:00,1197574583647236096,Mental health struggles don't give a license to harm others who you decide you can afford to hurt because it's more convenient and easier than respect. Especially when you're inflicting your pain onto and hurting ppl who also struggles with mental health - just extremely unjust,ForPalestine__
Melbourne,2019-11-21 08:40:45+00:00,1197434661380558849,Using resilience to build mental health in elite athletes by Dr Adam Deacon at @SMA_NEWS VIC- Managing the mind https://t.co/agAVoDJS7q,pinakingodse
Melbourne,2019-11-21 08:13:50+00:00,1197427890889142273,"✨ The Hedonists ✨ @ headspace, National Youth Mental Health Foundation https://t.co/5UKLIj75xR",timotitreasure
Melbourne,2019-11-21 08:11:23+00:00,1197427271339888645,Dr Ranjit Menon on Athlete mental health at @SMA_NEWS VIC symposium-Managing the mind https://t.co/4mWfhkVdkf,pinakingodse
Melbourne,2019-11-21 05:06:35+00:00,1197380765471764480,"So very grateful to the hundreds of sponsors and supporters of the @BuildcorpFn who are responsible for equipping 100,000 primary schools pupils and their teachers with mental health skills for life #mentalhealth #resilience #wellbeing https://t.co/O8JYKttai7",JosephineSukkar
Melbourne,2019-11-21 02:06:33+00:00,1197335460193783808,At @latrobe taking about sexual health and safety in mental health and why we need to talk more about this topic in mental health care @mhresearchleeds https://t.co/ufpJRE7uyl,LizHughesDD
Melbourne,2019-11-20 22:56:30+00:00,1197287631769362432,"I only lost because of my mental health issues 

Jesus Christ https://t.co/K5Dqv4OQMt",eyeamtom
Melbourne,2019-11-20 20:47:08+00:00,1197255074428227584,"@SamRC1987 Yeah people say that, but I disagree. It’s become the “thoughts and prayers” of mental health. Yes sure it’s become more open but time and time again I see how that just keeps on isolating those going through tough times.",mornedownunder
Melbourne,2019-11-20 18:35:27+00:00,1197221935165382657,"@emmahusarmp What a fucking joke, this very gutless weak human being who gets off on bashing defenceless women, trying the mental health card, sick of swine like Sheehan getting away with crime because they’ve got fake MH issues, hope the judge doesn’t fall for it!",demon_dave
Melbourne,2019-11-20 13:40:30+00:00,1197147711394463744,"Gave an Interview today about my take on mental health and my year of 2019 for moodismtv with changchilla!⁣
⁣
Thanks for having me! @ Prahran, Victoria https://t.co/wCYxCIVSa4",steinmusic
Melbourne,2019-11-20 13:21:22+00:00,1197142893410078720,"Gave an Interview today about Mental Health and my year of 2019 for moodismtv with changchilla!⁣
⁣
Thanks for having me! @ Prahran Market https://t.co/VIZXm7MiyI",steinmusic
Melbourne,2019-11-20 10:27:53+00:00,1197099236774408192,Very proud to be representing #MBT and #mentalhealth at the @AlfredHealth 2019 Recognising Excellence Awards Night. It’s a privilege to work alongside the MBT Team at Alfred CYMHS. https://t.co/ksYQLu2XR1,breeannacampbe1
Melbourne,2019-11-20 08:39:31+00:00,1197071965917286400,"@radio_fodder @UMSUunimelb The award dedicated to Kat Muskat that focuses on mental health and feminism

We are proud to give this to A’bidah Zaid Shirbeeni for her column on dating 💕 we would also like to congratulate her on becoming one of the Queer OBs for @UMSUunimelb 💕",FarragoMagazine
Melbourne,2019-11-19 23:07:51+00:00,1196928099910209537,@themasething We must hang in different circles of the internet. I saw only good things about mental health for men's day (even donated to a few causes).,its_seantime
Melbourne,2019-11-19 22:23:16+00:00,1196916878435745793,"Dear Twitter, please make this thing on my lip worthwhile... Donate to the @RMHICU @MovemberAUS team raising money for men's mental health and cancer. https://t.co/yUPEKGTYxI https://t.co/UMcJUTcAuI",ajtwood
Melbourne,2019-11-19 18:57:32+00:00,1196865104920240128,Do we need to extend the physical activity guidelines for mental health? Shout out to @RhiannonLWhite @JRLovesCycling @SchuchFelipe @simon_rosenbaum @JasonBennie for the team effort bringing this paper together. https://t.co/BaDMgGSvxQ,MeganTeychenne
Melbourne,2019-11-19 18:56:13+00:00,1196864773633130496,@marstogo1234 @Michael99908062 So we’ve gone from ‘Pascoe is inaccurate and that is academically offensive’ to ‘fucking socialists’ in 3 tweets.  This is why we socialists support more public spending on mental health services.,richard_HSE
Melbourne,2019-11-19 18:01:09+00:00,1196850915598168064,@Gary_Croton It was a pleasure to meet you all and hear about all the great work you are doing. It’s also nice to be back to my original interest of. co-occurring mental health and substance use. This is the consultant nurse group in uk - @dualdiagnosisuk and link to journal here @advancesDD,LizHughesDD
Melbourne,2019-11-19 07:19:16+00:00,1196689379785240578,"@KarakMufti @anthroprofhage @MomodouTaal @DandiaAsad @im_PULSE @NishMorris @OzKaterji @HarunAgain @hpstorian @Remroum In 2018, Herring used the attention to ... raise more than £150,000 for domestic violence charity Refuge.

""The aim is to celebrate positive male role models and to raise awareness of men’s issues..such as mental health, toxic masculinity and male suicide""
https://t.co/LSsSvkiJrf",ForPalestine__
Melbourne,2019-11-18 19:38:17+00:00,1196512972274749440,Do you or someone you know live with complex mental health issues? @saneaustralia wants to understand if and how a person’s experience of mental health issues impacts the way they’re treated by others in different areas of their lives. https://t.co/TxOtwbKcr1,Lisaannesweeney
Melbourne,2019-11-18 16:53:44+00:00,1196471562628583426,@10NewsFirst #7NEWS  Melbourne needs more entertainment to overcome from mental health issues..! https://t.co/PtSUE69ilv,UmeshBajaj11
Melbourne,2019-11-18 13:31:54+00:00,1196420768462032896,@realDonaldTrump Trump is going through a mental health crisis that makes his judgment even more impulsive and ‘catastrophic’: psychologist 🙄 He definitely needs to resign and then locked up😠 https://t.co/bPOSPrtJTO,awty_maureen
Melbourne,2019-11-18 10:14:58+00:00,1196371207970443264,Stephanie Liddicoat takes a poll from the audience in the architecture space that they would like to live in (and how it impacts mental health). #nerdnitemelb #nerdnite #nerdnitemelbourne #architecture #design #Mentalhealth https://t.co/L4KgNW4UGq,nerdnitemelb
Melbourne,2019-11-18 08:59:05+00:00,1196352113133019137,"So earlier today I appeared at a public hearing #mentalhealth - looking back at the recording I feel 👌🏻.

Thank you @ozprodcom for the opportunity 🙏🏻. https://t.co/18DTGtzhnV",D_M_Clark_
Melbourne,2019-11-18 08:31:25+00:00,1196345150596739073,Running with @victoriapolice to shine a light on mental health and wellbeing in the force and legal profession at the @yourLIV fun run around #TheTan. #LIVEvents https://t.co/WtCkLBQGXe,BenCarrollMP
Melbourne,2019-11-18 07:08:06+00:00,1196324183136849920,Any other mental health professionals interested reviewing the evidence base for Dr Nelson’s assertion? https://t.co/hH6dceiXoV,lesposen
Melbourne,2019-11-18 06:02:15+00:00,1196307612922331136,"Without our health, every part of our lives can suffer. Make sure you take care of your health. #motivationmonday  #graniteconsulting #mentalhealth https://t.co/pyIpAoyTZD",Granitetweet
Melbourne,2019-11-18 05:08:05+00:00,1196293978972250112,"Mental Health in Australia public hearing (Melbourne, Monday 18 November... https://t.co/5607Uf5Wja via @YouTube",D_M_Clark_
Melbourne,2019-11-18 01:49:09+00:00,1196243914992152576,"Exciting news for 2020! 
I will be challenging myself to 12 full months of sobriety and raising money along the way not only spread awareness of alcoholism but also rural mental health. 
More detail will follow closer to 2020!  🥳 
#grogfreeyear https://t.co/NeXeFk0qDy",DamienHamel3
Melbourne,2019-11-17 14:29:38+00:00,1196072910701465600,So I’m going to Bali in a week and I can’t wait to get away from stress and toxicity for a little. Going on a holiday is the best self care you could do for your mental health don’t fight me on this.,dazzledhazz
Melbourne,2019-11-17 14:02:37+00:00,1196066112275767296,"@PixelCGR It could be a lot of things, but if you think it’s worth checking out, never feel ashamed to see a doctor. There’s no shame in mental health.",GemmaTaters
Melbourne,2019-11-17 09:58:44+00:00,1196004736513658881,Would be amazing @NMHC could collaborate with @nhmrc and drive greater investment in medical research; only 5.4% success rate and virtually none for mental health despite it being the great health crisis facing Aust https://t.co/PzvSdCzObb,g_sheehan1
Melbourne,2019-11-17 00:11:08+00:00,1195856861506916352,"@mmpadellan Trump is an obese 73 year old man, he couldn’t possibly be in good shape, he’s obviously got mental health issues, he’s unfit to be a manager at McDonald’s, let alone a country!",demon_dave
Melbourne,2019-11-16 23:27:13+00:00,1195845809322901504,"1/2 Choose an activity you enjoy - you’re more likely to gain mental health benefits and maintain it. Walking is often a winner! @victoriawalks @DeakinIPAN 

https://t.co/AOQdaemUoy",MeganTeychenne
Melbourne,2019-11-16 21:59:04+00:00,1195823625770696704,The mental health of PhD researchers demands urgent attention https://t.co/BhpvC6T39G,SonjaDeNew
Melbourne,2019-11-16 12:02:16+00:00,1195673437756243968,@DanielAndrewsMP @georgiecrozier  @MartinFoleyMP @AlboMP ... it’s time someone takes a leadership position on this ... if we continue to cut research funding we will not solve the mental health crisis ... if we are we really serious fixing this then invest in answers https://t.co/GmGffynZO5,g_sheehan1
Melbourne,2019-11-16 08:37:08+00:00,1195621814082428930,"Marking one year after our friend and colleague Jonathan Cantwell’s passing, we painted a one-of-a-kind SwiftCarbon Ultravox. It is to be auctioned and proceeds go to mental health support initiatives. It was live… https://t.co/CgDsrfrBAY",swiftcarbon
Melbourne,2019-11-16 05:45:04+00:00,1195578511559286785,"@JessicaL82 @DrJaneMunro @DrEricLevi @andrewjtagg @mbismark @catherinecrock @carrie_kollias @venessb @SaferCareVic @JudkinsSimon @eyerait58 @rpcounat @Nishaobgyn @HarryGibbs13 @theNAMedicine @DFTBubbles @MJA_Editor @TheRACP @LauraRaiti @claski @anneelizpowell @inquisitiveGyn Incredibly interesting and critical work! If we cannot care for ALL the staff who make up the healthcare, mental health and aged care sectors then how can they care for themselves, their patients and the system! We are the system! Be kind!",heartfulpaeds
Melbourne,2019-11-16 03:33:15+00:00,1195545337022353408,Why attachment Is the number one factor In your mental health  https://t.co/gYeQEGA1am,Dragonsvoyage
Melbourne,2019-11-16 02:50:37+00:00,1195534608437137410,"Long commutes impact mental health, whereas active travel increases happiness - cycling to the train station makes my long commute slightly shorter and more bearable. Wind in my hair and all that 

https://t.co/Fxag2ECf1s",MsKymLang
Melbourne,2019-11-16 01:01:22+00:00,1195507115088965633,@alex_gparker shows those with mental illness expected to live 20 years less than those without. Highlights the need for integrated approach to health care to address both physical and mental health for those experiencing mental illness #ESSAVIC19 https://t.co/FURvqs5bJg,MeganTeychenne
Melbourne,2019-11-15 23:36:37+00:00,1195485786134609920,Our premier @DanielAndrewsMP outlines plans for a stronger and fairer #Victoria at #vicalpconf19 recommitting @VicGovAu to implementing every recommendation of the #mentalhealth #royalcommission because “it will save lives”. #ThisIsLabor https://t.co/DHR3Lz7kmJ,BenCarrollMP
Melbourne,2019-11-15 22:55:26+00:00,1195475424249184256,"Speech full of values, reform and action by @JillHennessyMP at #vicalpconf19 on equailty, spent convictions, indigenous justice, abolishing public drunkenness, family violence specialist courts, workplace safety, mental health, wage theft, and so much more. https://t.co/1h1VZdno9p",BenCarrollMP
Melbourne,2019-11-15 21:15:46+00:00,1195450343405932544,"Hey @twitter, I’ll be talking #Mentalhealth with @ozprodcom Monday...

🌈😊❤️ https://t.co/uIMrUD8qeQ",D_M_Clark_
Melbourne,2019-11-15 10:18:48+00:00,1195285012318277632,"This week I’ve learned that some people still have no idea when it comes to mental health or decisions that are made in the heat of the moment. 

Learning to be compassionate would certainly do some people a huge favour. Not everything in life is clear cut black and white.",Niksterisms
Melbourne,2019-11-15 09:33:54+00:00,1195273710455836672,"Read on for plenty of detail on what CA are doing re mental health, how they are trying to learn, and the challenges that exist. Inconsistency of support services between all the teams and competitions that  players now traverse is a particularly knotty issue",danbrettig
Melbourne,2019-11-15 05:59:13+00:00,1195219685223981058,"@oz_f The one that surprised me the most was the lack of people who would date others with mental health issues... like I thought that wouldn't be as big an issue?
Not surprised by most of the other results.",georgetweets2u
Melbourne,2019-11-15 04:33:05+00:00,1195198008603758592,"Assael Associate Ben Channon talking to @MonashUni professor @naomistead about how we can improve mental health in architecture, as part of the Transformations: Action on Equity symposium. https://t.co/VWaxK7xtQU",AssaelArchitect
Melbourne,2019-11-15 03:52:04+00:00,1195187688028065792,"So well deserved @DrLouiseByrne....Hopefully this will lay the foundations for the national version task to be alittle easier, perhaps? #NMHC #peersupport #livedexperience #mentalhealth https://t.co/yyM560WBli",ingioz
Melbourne,2019-11-15 02:53:20+00:00,1195172903425232897,Happiness apps: how schools are joining the fight for better student mental health https://t.co/S2neJKDuNE via @wef,SusanJBeaton1
Melbourne,2019-11-15 02:33:48+00:00,1195167988040683520,Bravo @willpucovski10 👏. Test career (work) can wait. Very good to see more &amp; more professional athletes making decisions to put their own mental health first over their careers and take time out when needed. Your own health is priority! @puka_up https://t.co/RHY7VWZ5c7,JPMcCurry
