City,Datetime,Tweet Id,Text,Username
Melbourne,2019-09-27 01:10:08+00:00,1177389929753481216,"Vita clinic is closed today for #football holiday but Vita crew Amelia, Sanil and Dani are up up and away to #Sydney for #GPMHST #Mentalhealth #psychiatry #psychology #gptraining https://t.co/Vxvk4nK4tY",VitaHealthAus
Melbourne,2019-09-27 00:50:36+00:00,1177385011554578432,#Sydney 🛫 here we come for  #gpmhst #Mentalhealth #gptraining #psychiatry https://t.co/V1b7xEGESU,Daniela_Nic7
Melbourne,2019-09-26 22:03:34+00:00,1177342978479640576,@MSheldonArt Powerful. Your talent is unique. Your gesture of giving to soldiers who risk their lives and mental health is heartfelt.,marisa_liistro
Melbourne,2019-09-26 20:10:22+00:00,1177314488816553984,@TheTodayShow It would be awesome if you could interview @TalindaB about 320 Changes Direction and her mental health and suicide awareness campaign! #SuicideAwareness #MentalHealthAwareness #9Today,MrsEmilyBourke
Melbourne,2019-09-26 20:00:36+00:00,1177312030291709952,"@TalindaB @DidiHirsch Need to see you guys in partnership with @ruokday, @GiveAnHour, @signsforchange, @beyondblue, @LifelineAust, @KidsHelplineAU, @WHO &amp; @headspace_aus for a Suicide Awareness &amp; Mental Health Expo in Australia! #SuicideAwareness #MentalHealthAwareness",MrsEmilyBourke
Melbourne,2019-09-26 14:08:17+00:00,1177223367495020545,@TalindaB @DidiHirsch thanks so much for answering my question on the live chat! Can’t wait to see you come to Australia for a mental health and suicide awareness expo! #SuicidePrevention https://t.co/s5T80J4z3x,MrsEmilyBourke
Melbourne,2019-09-26 13:29:26+00:00,1177213590383652864,"Tomorrow I'm recording a new podcast episode with a friend... We'll be talking about our #mentalhealth shit and whether getting on @Tinder is a good idea when you're feeling down.

What's your experience with #casualsex &amp; managing your headspace? 🧠 Tell me your stories!",artofthehookup
Melbourne,2019-09-26 13:01:58+00:00,1177206677864452096,Mental health problem? No worries. AI has that covered. 🤦🏻‍♀️ https://t.co/PVWQfo73G5,JenBFootscray
Melbourne,2019-09-26 09:45:54+00:00,1177157339754848256,If only mental health care was really this good in Australia. Rock up at a public hospital and immediately get a one-on-one with the head of the ED. #HomeandAway,jean_virginia
Melbourne,2019-09-26 08:49:59+00:00,1177143264626896896,Wohooo 🥳 paper published with Andrew Gilbert &amp; @BiancaBrijnath Legitimising depression: community perspectives and the help-seeking continuum #mentalhealth #depression #CALD #migrants  https://t.co/AlxEjBwN33,JoAntoniades
Melbourne,2019-09-26 06:39:27+00:00,1177110414796083201,"@EvanMacIsaac Tbh right now is exactly the time that filmmakers and society should be exploring the topic of mental health and radicalisation. Too many people seem to think these people are just ""evil"" But no one's born that way. Ignoring it won't do anything.",Shuttlecock
Melbourne,2019-09-26 03:17:50+00:00,1177059679446323200,Must listen for all. Great guy and trainer who speaks honestly about the daily pressures and impact on mental health. It’s a big issue for the industry https://t.co/8qfKyuGdVs,m_felgate
Melbourne,2019-09-26 02:40:43+00:00,1177050335522615296,Childs framing questions trying so hard to get both guests to admit climate strike brings high stress and poor mental health to young .. thankfully both guests failed to take the bait @abcnews,kif_inti_mary
Melbourne,2019-09-25 22:34:03+00:00,1176988260599390208,"Mental health is a thing, but not sure about feeling sorry for blokes who live off multiple bottles of red a night &amp; sleeping pills, as well as being a smug fuckhead in public. https://t.co/ZzNP2oILqp",Jizzlobberz
Melbourne,2019-09-25 16:32:09+00:00,1176897187348803584,"@TalindaB thanks a million for answering my question! I can’t wait to see you in Australia one day! Need to see you on the panel with @WHO, @GiveAnHour, @signsforchange, @KidsHelplineAU, @headspace_aus, @LifelineAust and @beyondblue for a Mental Health and Suicide Awareness expo! https://t.co/XW70eV2KwE",MrsEmilyBourke
Melbourne,2019-09-25 12:19:54+00:00,1176833705022652416,"It would be awesome if @signsforchange &amp; @GiveAnHour partnered up with @beyondblue, @KidsHelplineAU, @LifelineAust and @headspace_aus for a Mental Health &amp; Suicide Awareness Expo in Australia! It’d be even better if @TalindaB joined the panel from the US! #SuicideAwarenessWeek",MrsEmilyBourke
Melbourne,2019-09-25 12:02:36+00:00,1176829351003688962,"Depression isn't a one-size-fits-all disease, so why are our explanations of it so narrow? - ABC News https://t.co/7zck49bd0C #depression #mentalhealth #diagnosis",Carla_McEnery
Melbourne,2019-09-25 03:44:04+00:00,1176703891787919367,In #OHS terms one can call those with lived experience of suicide as a “near miss” - a situation or person that can reveal the circumstances leading to an action or the avoid of an event.  They can provide invaluable insight on mental health in workplaces. https://t.co/CcMAPmXmXC,SafetyOz
Melbourne,2019-09-25 03:43:08+00:00,1176703657246633984,@jemimahride at @AusHealthEcon 2019: “minimally adequate” treatment for child mental health problems—not quite so adequate just yet. Thanks for the important work that you &amp; co at @HEU_unimelb are doing! https://t.co/uQ5Mupb8Uk,cclarynn
Melbourne,2019-09-25 02:29:39+00:00,1176685162110713857,"It is as though
I'm being poked
relentlessly

(without an
impending sign of
mercy),

being pushed
for the sake of
torment

(and not to
guide me to
serenity).

At least,
someone is
having fun.

#poem #poetry #poetics #amwriting #mentalhealth #poke #torment #patience #serenity",scripturient_me
Melbourne,2019-09-25 01:00:26+00:00,1176662710253051904,"@Origsmartassam Newman belongs to extreme right, they’ve been denigrating @GretaThunberg mental health as they have nothing else, they’re hatefilled old white men &amp; women, the world will be rid of them soon enough, the youth of today will then take over #ClimateChange",demon_dave
Melbourne,2019-09-25 00:33:54+00:00,1176656033285992449,"@tonyposnanski You know right wing fuckwits have nothing left when they go after a 16 year old girls mental health, more proof the extreme right have nothing but hate in their despicable hearts! #GretaThunberg",demon_dave
Melbourne,2019-09-24 22:18:56+00:00,1176622070681108480,Nice interview with Jonny Wilkinson re his struggle with the pursuit of joy #RWC19 #mentalhealth https://t.co/1CL1TVny7c,timkenington
Melbourne,2019-09-24 13:29:48+00:00,1176488909389221888,"Little steps to cut back on social media usage/forced interactions are EXTREMELY important for one’s mental health. I’ve had my fb/insta/snap notifications off since months, use FB once a week, don’t have the FB messenger app, don’t view insta stories except 2-3 people’s. Bliss!",Shanzaf
Melbourne,2019-09-24 08:44:45+00:00,1176417172878290944,"Health care in Australia is generally amazing. Rebate for my GP visit, where my mental ill-health was talked about openly. 15 minutes later I had pharmacy brand Zoloft for under $20, and both my GP &amp; pharmacist were clear about side effects. #MentalHealthMatters #Mentalhealth",rustycraig39
Melbourne,2019-09-24 07:25:54+00:00,1176397331379490817,"@MrLeCornu As a rule it’s a no from me. Especially during creative writing where rhythm is everything. Some students need it and are allowed to use it for anxiety, mental health, focus etc. not a blanket ban, case by case and such.",steven_kolber
Melbourne,2019-09-23 20:09:50+00:00,1176227191706640384,@DineshDSouza Where to start with this blinding ignorance. The NAZIS were not on the left side of politics. This young Swede may look like she is from “the master race” but she may have been executed for mental health issues. Greta is an outstanding human. Climate change is a threat to us all.,ellendavismee
Melbourne,2019-09-23 08:16:23+00:00,1176047648190500866,Don’t miss this one if you can get a tix #Anxiety #Mentalhealth #art #science #people #participation @thebiganxiety https://t.co/kwjs3HbCCe,KerrynPennell
Melbourne,2019-09-23 03:23:17+00:00,1175973886963437568,"Happy Bi Visibility Day! Increasing bisexual visibility is so important, in tacking biphobia and bi-erasure, and raising up our bi+ community, who statistically experience higher rates of poorer mental health. We see you, we celebrate you 💕💜💙 #BiVisibilityDay #BiPrideDay https://t.co/9dwGmJfgUi",mqff
Melbourne,2019-09-23 02:21:30+00:00,1175958337424244737,"Well Done to our Snake girls who participated in (and came down to support) the @headspace_aus Collingwood Charity Match yesterday!

Headspace Collingwood is a free Youth Mental Health Service for 12 - 25 year olds, located in the Victoria Park Oval Social Club Building. https://t.co/Koyl5wpApx",RichmondCentral
Melbourne,2019-09-22 22:33:38+00:00,1175900991956217856,"So excited for the potential of groups such as these to address stigma in the mental health workforce. It’s a long road but first steps are happening in the UK and US. If you know of any work happening in this space, especially in Australia, I’d love to hear about it. https://t.co/THuphqcxXm",AliciaJeanKing
Melbourne,2019-09-22 22:03:33+00:00,1175893421069783040,"Today’s @theheraldsun editorial shares @berrystreet submission to @RCMentalHealth, adding “there is an urgent need for reform in juvenile protective care, to bolster mental health services in the sector &amp; to give young lives a real chance at hope, change &amp; happiness” #springst https://t.co/TwEYYV40nk",CFECFW
Melbourne,2019-09-22 13:35:53+00:00,1175765663517831169,"You lot are making things complicated for yourselves and I’m not about to share that kind of vibe. Defs all about that positive energy, because I need to take care of myself before I can take care of the people around me. Right now, my mental health is my priority. https://t.co/ZzSgNtxc1m",ChrisVills
Melbourne,2019-09-22 12:09:58+00:00,1175744043394859009,Trying to do masters in MH online after after 20 years away from study just confirms why I went into mental health. I like talking to people face to face. I am struggling big time with the fact that many of our education is not face to face but online.,sue84372645
Melbourne,2019-09-22 03:54:13+00:00,1175619281737793536,"#vidconaumentalhealth
unfortunately there are people out there who don’t believe in mental health - how would you handle a situation where someone’s shutting down something so important to those who are struggling?",saggiemimms
Melbourne,2019-09-22 00:18:14+00:00,1175564929362849793,"Tamil family will need psychological help, mental health social worker says - The New Daily. Dutton claims they're living in a house near facilies including a swimming pool.   That's a lie says Priya.  What a monster  he is. https://t.co/VSOxP22iWA",jaquix173
Melbourne,2019-09-21 23:39:05+00:00,1175555076795977728,"Happy Sunday! Did you know that knitting is good for your mental health? It reduces  stress, improves concentration, memory and so much more..... Will you join me? Knit one, purl one....❤ https://t.co/PQ4icLA3Yx",hellooumu
Melbourne,2019-09-21 11:51:49+00:00,1175377088309686273,"https://t.co/oveIAXUEAz

#Analysis #Anger #ආදරය #Effort #Emotions #Experiences #Expression #Eyes #Feelings #God #Hatred #Human #Liebe #Life #Love #Me #Memories #MentalHealth #Mind #Nature #Perception #RandomThought #Understanding #writing",nimesheM
Melbourne,2019-09-21 09:06:03+00:00,1175335369253933056,@Mark_99nc Thank you Mark. Servants health hasn’t been ideal over a very challenging cold winter. Along with the meezer madness on twitter we’ve provided good mental health support during her recovery period. She’s off very serious medication - she can now see the screen &amp; hold the ph. 🤞,sharynsully
Melbourne,2019-09-21 01:21:04+00:00,1175218355038408704,Fantastic conceptualisation of why we need people with a diverse range of experiences working inside &amp; outside the mental health system. https://t.co/HcjZnkpSu1,AliciaJeanKing
Melbourne,2019-09-21 00:50:57+00:00,1175210772118425602,What we've learned about mental health from young people https://t.co/KU94poAcw0 via @wef I’m en route to NYC for the @wef SDI summit where @orygen_aus and @wef will hold a youth MH Forum. Rising global momentum! @ScottMorrisonMP @GregHuntMP @JoshFrydenberg @headspace_aus,PatMcGorry
Melbourne,2019-09-20 21:36:07+00:00,1175161743435128834,"@JustCallMeRois I want people to talk about it, I want people to be okay and to find happiness, but it also cost me my own mental health in the process so it's tough to open myself up to those discussions for people who need it.",kidkerrigan
Melbourne,2019-09-20 10:06:31+00:00,1174988197345972224,We had an amazing two days of presentations on the economics of mental health! Forgot to tweet during the day since I was fully concentrating on the research! Will tweet about all the exciting research on the weekend! https://t.co/1p60eVwqZs,SonjaDeNew
Melbourne,2019-09-20 10:06:11+00:00,1174988114965581824,"Okay, so please excuse my shorts for a second here🙈
.
There has been a lot wrote lately about mental health &amp; I wanted to give my my two cents’ worth🤷🏻‍♂️
.
Do not discount the importance of exercise in lifting your… https://t.co/roYeRWxBL3",TroyLakePT
Melbourne,2019-09-20 08:54:13+00:00,1174970002237079557,As teachers it’s easy to talk about the mental health of our students but sometimes we forget our own. Sometimes think the people on here have kept me sane recently. Teaching is a bloody hard gig at times and sometimes it’s hard to find support. Thanks everyone . #aussieED https://t.co/2zcZGshsqf,MatthewBeggs
Melbourne,2019-09-19 13:23:52+00:00,1174675475085422592,"#Friendship #Life #Love #Memories #MentalHealth #Perception #Spirituality #humanity #society #me #you #all

https://t.co/s25YwKw2yH",nimesheM
Melbourne,2019-09-19 06:46:03+00:00,1174575363835322368,"@mbismark More is the pity as our community reflects on workplace stress, mental health, compassion fatigue, burnout and prevention of emotional, spiritual and physical ill health. The potential  impacts from the above mentioned for those workers and patients is concerning.",lmespie
Melbourne,2019-09-18 23:33:50+00:00,1174466589174841344,"@NWMHgrads During my years at NWMH, I had the privilege to work alongside some fantastic nurses during their post grad placements. Seeing them go on to leadership roles in the network gave me a lot of hope for the future of mental health services. @RachelMTindall",AliciaJeanKing
Melbourne,2019-09-18 23:21:07+00:00,1174463390464348160,Giving kids good mental health tools is becoming even more essential if they are to grow into healthy adults. https://t.co/ceUulRFLtL via @theage,michaelgrose
Melbourne,2019-09-18 22:56:52+00:00,1174457287672393728,"Day 19: #ThrowBack to five years ago when I decided to stop being frustrated by the things I didn’t like about mental health services, and start doing something about it. I wasn’t entirely sure how at the time but this was the first step. #TheLeveragedPhD https://t.co/boXELB6CUc",AliciaJeanKing
Melbourne,2019-09-18 21:32:20+00:00,1174436015013916672,@johno0910  can’t have one without the other!  #mentalhealth #suicideprevention + #healthy #ecosystem #climatechange #auspol https://t.co/Mbh8PAdQ4t,ingioz
Melbourne,2019-09-18 17:30:18+00:00,1174375106740514816,@BrogdenLucy @petrobras ... would love to learn more re approach to mental health in the workplace @NMHC #IASP2019 https://t.co/kyI4Sr5L8H,ingioz
Melbourne,2019-09-18 12:36:46+00:00,1174301235307929600,"This is the most inspiring statement about men’s mental health - long overdue to break down barriers. Thank you Wayne Schwass
https://t.co/3HRry3FtCd
If you have a son, brother, male partner or friend you owe it to them to listen as you can make a difference #pukaup",DianaEnnis4
Melbourne,2019-09-18 09:02:02+00:00,1174247197032034307,"I 100 blame the govt for not giving me marijuana medication and real mental health care this whole time, my highschool principle should have been legally obligated to be dosing me with the good stuff day 1",jtmorissette
Melbourne,2019-09-18 06:00:38+00:00,1174201544541122560,"Wayne Schwass speaking powerfully, holding back tears at the service for Danny Frawley, touching on the courage Spud showed talking about his mental health battle. “Please don’t compromise your mental health. Please put your wellbeing first. I’m so proud of you, Spud.”",Ro_Smith
Melbourne,2019-09-18 04:25:11+00:00,1174177522570944513,"She’s worried MEN are getting screwed over by the family courts - why doesn’t she lobby to support families in crisis - for mental health supports for men, for safe places for violent men to go with supports when asked to leave by police, housing for women and children to be safe https://t.co/vALaxeXY15",CarCarLaJenkins
Melbourne,2019-09-18 02:24:27+00:00,1174147139775057920,Teachers warn they're overwhelmed by mental health problems in schools https://t.co/5N6V8l7vHG,PatMcGorry
Melbourne,2019-09-18 00:28:27+00:00,1174117949210185728,@smilechickie @samueljhockey @ian_hickie #IASP2019 #digital #mentalhealth #suicideprevention https://t.co/73C61ZVwpu,ingioz
Melbourne,2019-09-17 23:13:15+00:00,1174099024909148161,Pucker up this Liptember! Raising funds and awareness for women’s mental health - you can help by popping a little colour on and registering @liptember as an individual or group. #liptember #womenshealth 😘 @ Holden… https://t.co/Fuv8mJcOlC,eliza_hynes
Melbourne,2019-09-17 11:26:17+00:00,1173921107692244992,"On-field Darius has become a meme and us fans bagging him is one thing, but ex-players, media, even his own club - people who actually count, all trying to knife him over a contract? It’s pretty shit &amp; very dangerous considering previous mental health issues.",SeaEagleSpur
Melbourne,2019-09-17 11:08:50+00:00,1173916717904363520,Fantastic article! Great to see a pro athlete open up about mental health and addictions. Great to have @RobinLehner on the @NHLBlackhawks too!! 🤘🏻🤘🏻 https://t.co/jgVS397JH5,icejxn
Melbourne,2019-09-17 07:44:16+00:00,1173865238774501376,"Remember 2018 when you picked your gang and your loyalty was up and beyond the skies towards them? I had no one and literally had to stay away from everyone because my mental health was shit then? Yeah i keep tabs, so pla don’t ask for my help.
#tweetformyself #noonespecific 🙏🏻",ChrisVills
Melbourne,2019-09-17 01:46:09+00:00,1173775115168862208,Conversations with staff followed up with specific training around #engagement and #MentalHealth and also asking staff 'what makes a perfect staff member' helped create a more engaged and empowered staff #PLVconference,justbiblio
Melbourne,2019-09-16 23:57:42+00:00,1173747820320288769,"@10NewsFirst Howe stupid parents are, what gives them rights to poison ☠️ children’s mind, not giving children rights to grow up with gender their are born with. As a children growing up not knowing if they are Arthur or Martha. Future of those children 👶 mental health problems. Crazy 😜",babic249
Melbourne,2019-09-16 22:19:07+00:00,1173723011972624385,"@WeveAllGotToEat @piersmorgan She’s made other accusations over the years and been threatened with legal action, then detracted them.  Clearly has well documented mental health issues.",CorinnaWho
Melbourne,2019-09-16 13:21:31+00:00,1173587720746070018,"@Freaxxie Incredible news Freax!!! 💙 Moving environments for your own mental health is really difficult but a very important step towards more positive things. Now, let's paint our nails!",emmycosplays
Melbourne,2019-09-16 01:43:41+00:00,1173412104012881920,A talented diverse and inspiring group of young people whose views and insights are invaluable to our mission for better mental health for all young people.  @iaymh @orygen_aus @headspace_aus @GregHuntMP @Bowenchris @ScottMorrisonMP @NMHC @ozprodcom @Oz4mentalhealth https://t.co/7Ujvr39Fwh,PatMcGorry
Melbourne,2019-09-16 01:01:39+00:00,1173401526309539840,Needed a mental health day.,nateberry76
Melbourne,2019-09-15 22:37:19+00:00,1173365205809549312,I blocked you from everything for mental health,Nathy0520
Melbourne,2019-09-15 21:53:13+00:00,1173354106410258432,"HALF MARATHON DONE!

Yesterday I completed a one in Sydney and raised $AUD589.35 for Beyond Blue to support mental health services.

So, it's now time to shift my focus to the Melbourne Marathon Festival, where I'll… https://t.co/T5fESK8FPK",paulmcauthor
Melbourne,2019-09-15 11:30:15+00:00,1173197331358863360,"An absolute privilege to have Australia’s 27th PM @JuliaGillardGPE  visit to give the Annual Renate Kamener Oration. In her capacity as Chairman of @beyondblue, JG gave a powerful speech about mental health including progress made &amp; challenges ahead for reform of the sector. https://t.co/HyMlZXHYRz",LaraSMcKay
Melbourne,2019-09-15 10:14:42+00:00,1173178318352338946,"@jonto_kaye @DParkerite Yes, and I don't think that schizophrenia is the only mental health problem that their god has got! I'm only too happy to be an atheist!",TaranReynardWhy
Melbourne,2019-09-15 07:26:43+00:00,1173136042636873731,It was great seeing @JuliaGillard speak about mental health &amp; her work at @beyondblue today! https://t.co/DGEjBIi3vD,frenchybychels
Melbourne,2019-09-14 22:28:46+00:00,1173000664118489088,"Those who can afford to on many levels. Those who have the cash, don't want kids, aren't tied to home to look after elderly relatives/parents, don't need a support network for mental health flare ups, are happy single and can tolerate the worsening conditions.#AcademicTwitter https://t.co/F2zeruRrjs",marianuncsum
Melbourne,2019-09-14 04:39:25+00:00,1172731553341853696,"@TheRoastessWith @danielzeitler_ @davidrocknyc Such a pessimistic attitude. Make sure to look after you’re mental health it is so important. Get help please. You just need to change the way you post, that is all I was saying. Take care of yourself. 💖",sianassongs
Melbourne,2019-09-14 00:43:40+00:00,1172672224089690112,"Working my ass off to buy one of my partners HRT medication. 

The wait list to get her into sessions to get a script are 3 months+ long and waiting that long will have a severely negative impact on her mental health. 

If anyone has any $ to spare please consider helping us out.",queerlytattooed
Melbourne,2019-09-14 00:08:08+00:00,1172663284983451648,Another full house @HELLREIZER this morning with STYLE ME OVER’s @melinabagnato talking about Liptember and the importance of supporting women’s mental health. We also welcomed Dennis from Oriental Teahouse to chat… https://t.co/mvBzcKqDvY,JaquelynMuller
Melbourne,2019-09-13 12:55:27+00:00,1172493997647912960,"“We knew nothing until Wednesday night. We’re really worried about his mental health. He’s a gentle soul. It’s been a shock how quickly it’s happened, but we’ve got to deal with it as a club.” Simpson on Rioli",WestCoastEagles
Melbourne,2019-09-13 12:09:48+00:00,1172482508291657728,"@1116sen Just beautiful. Have we looked at the impact of concussion on Mental Health in Footballers in later years? Not just professionals, but country/suburban players. Much to think about. #RIPSpud",SteveInSunbury
Melbourne,2019-09-13 11:30:13+00:00,1172472549499752449,Indian food for mental health w the boi https://t.co/FHUuCc0YoG,Raey153
Melbourne,2019-09-13 08:12:20+00:00,1172422746573115394,@drveebrowne Thanks Vee! And thanks for supporting me to continue my research and advocacy work alongside my clinical role. You’re such a great support for all of us at North Western Mental Health.,mbismark
Melbourne,2019-09-13 07:24:27+00:00,1172410697268916225,"Tadi pagi nonton tv berita disini dan ada informasi mengenai salah satu penyebab kematian tertinggi di Australia yaitu, ""bunuh diri"", antara usia 15-44 tahun dan dikarenakan ""mental health"" / kesehatan mental.… https://t.co/TK7dsouOo4",Ari_Sanjaaya
Melbourne,2019-09-13 05:40:44+00:00,1172384598409408512,Lovely to see Dr Megan Wood posting in her Facebook about the Awesome lovely visit of Hon PM Jacinda Ardern in Spreydon today at West Spreydon School to meet with the special community there and announce more mental health support for Christchurch @jacindaardern https://t.co/QWo0z499I2,Mushaiban
Melbourne,2019-09-13 03:47:58+00:00,1172356218314084352,"To all the people that don’t know ,not sure , low ,Blue,or in a dark place .
Suffered hardship heartache or any pain .REACH OUT ! Before it’s to late People care 👊@EduTweetOz @asiaEDchat @EdChatEU @beyondblue @headspace_aus #MentalHealthAwareness #Mentalhealth @SHAPE_America https://t.co/mHMLuyq4qX",SportandiAndres
Melbourne,2019-09-13 02:21:26+00:00,1172334441806450688,@theheraldsun Our Mental Health system has always been in crisis bosses can’t be expected to deal with e dry employees issues and perhaps they would t know,SharonP71702164
Melbourne,2019-09-12 23:01:48+00:00,1172284204312342528,"The idea fucked with my mental health too badly so i just dropped it and walked away. She didn't know i was ND back then. Maybe she remembered me in the years since and realized i was, and felt bad. Maybe she didn't.",cakeandmadness
Melbourne,2019-09-12 22:35:32+00:00,1172277590779809792,@IndigoDaya Can’t wait to hear what comes from it. At moment I am using “people/clinicians who have experienced mental distress” and “people/clinicians accessing mental health services” depending on the context .,AliciaJeanKing
Melbourne,2019-09-12 22:18:04+00:00,1172273198118789120,"And with one,
sudden click of
Fate's fingers,

you were
gone.

She had been
warming up
for a while;

if only
we had heard her.

#poem #poetry #poetics #fate #youareworththeeffort #mentalhealth #suicideprevention",scripturient_me
